title,author,rating,ratingnum,course,cuisine,preptime,cooktime,customtime,totaltime,servings,numberofsteps,actualsteps,totalingredients,ingredient1,ingredient2,ingredient3,ingredient4,ingredient5,ingredient6,ingredient7,ingredient8,ingredient9,ingredient10,ingredient11,ingredient12,ingredient13,ingredient14,ingredient15,ingredient16,ingredient17,ingredient18,source,link,ingredient19,ingredient20,ingredient21,ingredient22,ingredient23,ingredient24,ingredient25,ingredient26,ingredient27,ingredient28,ingredient29,ingredient30,ingredient31,ingredient32,ingredient33,ingredient34
Heart biscuits for Valentine's Day,Emily Leary,5, 3 ,cakes and bakes,American,Prep Time20 minutes mins,Cook Time8 minutes mins,NA,Total Time28 minutes mins,21 cookies,13,"Preheat the oven to 200C (180C fan assisted, 400F, Gas mark 4).
Beat the margarine, sugar, eggs and vanilla until fully combined.
Mix in the flour, baking powder, salt and bicarbonate of soda until fully combined.
Turn out the dough onto a very well floured board and knead only as much as it takes to get a smooth ball of dough.
Put the dough ball into a clean bowl, in the fridge to rest and cool for 15 minutes
Roll out to approximately 7-8mm thick (approx 1/3 inch).
Cut out the heart shapes using a geart-shaped cookie cutter about 7-8cm at the widest part. Aim to cut them close together to reduce the need to overwork the dough by re-rolling too many times.
Line a baking sheet with greaseproof paper and bake the cookies for 8 minutes or until pale golden at the edges.
Cool on wire rack.
In a small container, mix the icing sugar with a tbsp of water until dissolved to make a 'glue'.
On a clean board, dusted with cornflour, roll out the icing, one colour at a time and cut out heart shapes, brush the back with the glue and fix each heart to a cookie.
Grab a handful of the sprinkle hearts and dot the glue where you want one to go before pushing it gently into the icing. Use 8-10 per biscuit.
Leave it to dry, then enjoy! Or why not stack them, wrap them in cellophane and give them as a tasty Valentine's gift?",28,110 g (3.9 oz) margarine,100 g (3.5 oz) white caster sugar (superfine sugar),1 medium free range eggs,1/2 tsp vanilla extract,250 g (8.8 oz) plain white flour (all purpose flour) plus extra for dusting,1/4 tsp bicarbonate of soda (baking soda),1/4 tsp baking powder,1/4 tsp salt,1 tbsp icing sugar (powdered sugar),1 tsp cornflour (cornstarch) for dusting,100 g (3.5 oz) pink sugar paste vegetarian if required,100 g (3.5 oz) red sugar paste vegetarian if required,100 g (3.5 oz) white sugar paste vegetarian if required,30 g (1.1 oz) heart-shaped sprinkles,110 g (3.9 oz) margarine,100 g (3.5 oz) white caster sugar (superfine sugar),1 medium free range eggs,1/2 tsp vanilla extract,A Mummy Too,https://www.amummytoo.co.uk/valentines-day-cookies/,250 g (8.8 oz) plain white flour (all purpose flour) plus extra for dusting,1/4 tsp bicarbonate of soda (baking soda),1/4 tsp baking powder,1/4 tsp salt,1 tbsp icing sugar (powdered sugar),1 tsp cornflour (cornstarch) for dusting,100 g (3.5 oz) pink sugar paste vegetarian if required,100 g (3.5 oz) red sugar paste vegetarian if required,100 g (3.5 oz) white sugar paste vegetarian if required,30 g (1.1 oz) heart-shaped sprinkles,NA,NA,NA,NA,NA,NA
Autumn cookies,Emily Leary,5, 2 ,Cookies,British,Prep Time20 minutes mins,Cook Time10 minutes mins,NA,Total Time30 minutes mins,36 cookies,12,"Preheat the oven to 180C (160C fan, 350F)
Put the butter, golden syrup, salt and sugar in a microwave-safe bowl.
Heat for 60 seconds on full power. Stir well (careful, it can be very, very hot). Heat in one or two more 30 second blasts until most of the sugar is dissolved. It's ok if it's still a little grainy.
Add the flour and bicarbonate of soda. Fold through. Allow to cool until safe to handle. 
Divide the dough into three equal balls. Make a thumbprint in each, then add the ginger to one, the mixed spice to another, and the cinnamon and orange zest to the third. 
Add the colours too, one per ball. I went for red with mixed spice, green with ginger and brown with cinnamon, but you can go with any combination you like.
Knead each ball in your hands until you have an even distribution of colour and spice. Cover the dough with food wrap and chill for 15 minutes.
Roll each ball of dough out thinly - about 3mm - then use your cutters to cut out as many shapes as you can. You will need to gather and re-roll the dough once or twice to use it all up.
If you like, you can combine the last few bits of dough together and then roll them out create multicoloured sheet of dough to use for your last few leaves.
Place your leaves on a baking sheet lined with baking paper. 
Bake the cookies for approx 10 minutes each until just browning at the edges. I baked mine over a few batches.
Cool your cookies on the tray for a few minutes until they firm up, then transfer to a wire rack to cool completely",26,90 g (3.2 oz) salted butter,150 g (5.3 oz) golden syrup,1/8 tsp salt,60 g (2.1 oz) golden granulated sugar (cane sugar),250 g (8.8 oz) plain white flour (all purpose flour),1/4 tsp bicarbonate of soda (baking soda),1/2 tsp fresh root ginger grated,1/2 tsp mixed spice,1/2 tsp cinnamon,few drops red food colouring vegetarian if required,few drops brown food colouring vegetarian if required,few drops green food colouring vegetarian if required,1/2 small orange zest,90 g (3.2 oz) salted butter,150 g (5.3 oz) golden syrup,1/8 tsp salt,60 g (2.1 oz) golden granulated sugar (cane sugar),250 g (8.8 oz) plain white flour (all purpose flour),A Mummy Too,https://www.amummytoo.co.uk/autumn-cookies/,1/4 tsp bicarbonate of soda (baking soda),1/2 tsp fresh root ginger grated,1/2 tsp mixed spice,1/2 tsp cinnamon,few drops red food colouring vegetarian if required,few drops brown food colouring vegetarian if required,few drops green food colouring vegetarian if required,1/2 small orange zest,NA,NA,NA,NA,NA,NA,NA,NA
Dalek cookies,Emily Leary,5, 1 ,Cookies,British,Prep Time15 minutes mins,Cook Time7 minutes mins,NA,Total Time22 minutes mins,26 cookies,19,"Put the butter and sugar in a large mixing bowl. Beat until light and fluffy.
Add the egg and beat again.
Add the flour, baking powder, cinnamon, salt and bicarbonate of soda.
Mix using a fork, electric whisk or your hands until fully combined.
Form into a ball, cover the bowl and chill for 15 minutes.
Preheat the oven to 200C (180C fan-assisted, 400F).
Work with half the dough at a time, keeping the other half wrapped in the fridge until you're ready for it. This helps to keep it cold, which makes it easier to work with.
Place the dough on a lightly floured surface, roll out to about 50-70mm (1/4 inches) thick.
Press the cookie cutter into the dough to cut out the cookie shape. I find it helps to dip the cutter in a little flour to prevent it sticking.
You may also need to push the plunger down to make sure the detail imprints into the dough. Lift it away separately to check.
Repeat until all the dough is used up. You might need to gather and reroll the offcuts once or twice.
Place the cookies on a lined baking sheet.
Bake for 6-7 minutes, until just beginning to brown.
Allow to firm up for a few minutes on the tray, then transfer to a wire rack to cool completely.
Now, you can enjoy your Dalek cookies or, if you want to go a little further, you can decorate these little Daleks with a touch of icing and some silver candy pearls.
Mix the icing sugar with a few drops of water until you have a thick paste.
Using a brush or chopstick, put a tiny dab of icing on each of the  nine circles around the base of each a Dalek cookie.
Immediately drop a silver pearl onto each icing dab.
Repeat for the remaining cookies and leave to set.",20,110 g (3.9 oz) salted butter softened,100 g (3.5 oz) white caster sugar (superfine sugar),1 medium free range eggs,270 g (9.5 oz) plain white flour (all purpose flour),1/4 tsp bicarbonate of soda (baking soda),1/4 tsp baking powder,1/4 tsp salt,1/4 tsp cinnamon,1 tbsp icing sugar (powdered sugar),"2 tbsp silver pearls make sure they're gelatine-free, if vegetarian",110 g (3.9 oz) salted butter softened,100 g (3.5 oz) white caster sugar (superfine sugar),1 medium free range eggs,270 g (9.5 oz) plain white flour (all purpose flour),1/4 tsp bicarbonate of soda (baking soda),1/4 tsp baking powder,1/4 tsp salt,1/4 tsp cinnamon,A Mummy Too,https://www.amummytoo.co.uk/dalek-cookies/,1 tbsp icing sugar (powdered sugar),"2 tbsp silver pearls make sure they're gelatine-free, if vegetarian",NA,NA,NA,NA,NA,NA,NA,NA,NA,NA,NA,NA,NA,NA
Crocodile cookies,Emily Leary,5, 1 ,Cookies,British,Prep Time20 minutes mins,Cook Time8 minutes mins,NA,Total Time28 minutes mins,20 cookies,10,"Beat the butter, sugar, eggs, vanilla and food colouring until fully combined.
Mix in the flour, baking powder, salt and bicarbonate of soda until fully combined.
Cover the bowl with food wrap and chill for 2 hours.
Preheat the oven to 200C (180C fan-assisted, 400F).
Work with the dough in four sections, keeping the spare in the fridge as you go.
On a lightly floured surface, roll out to 1cm thick and cut out the crocodile shapes.
Grease and lightly flour a baking sheet.
Place the crocodile cookies on the tray, 1 inch apart and bake for 5-8 minutes, until the edges just begin to turn brown.
Cool on wire rack.
Decorate with icing pens - as you can see, we got a bit carried away!",20,110 g (3.9 oz) salted butter softened,100 g (3.5 oz) white caster sugar (superfine sugar),1 medium free range eggs,1/2 tsp vanilla extract,2-3 drops of green food colouring gel,300 g (8.8 oz) plain white flour (all purpose flour),1/4 tsp bicarbonate of soda (baking soda),1/4 tsp baking powder,1/4 tsp salt,coloured icing pens,110 g (3.9 oz) salted butter softened,100 g (3.5 oz) white caster sugar (superfine sugar),1 medium free range eggs,1/2 tsp vanilla extract,2-3 drops of green food colouring gel,300 g (8.8 oz) plain white flour (all purpose flour),1/4 tsp bicarbonate of soda (baking soda),1/4 tsp baking powder,A Mummy Too,https://www.amummytoo.co.uk/animal-sugar-cookies-recipe/,1/4 tsp salt,coloured icing pens,NA,NA,NA,NA,NA,NA,NA,NA,NA,NA,NA,NA,NA,NA
Elderflower cookies,Emily Leary,5, 1 ,Cookies,British,Prep Time20 minutes mins,Cook Time10 minutes mins,NA,Total Time20 minutes mins,42 cookies,7,"Preheat the oven to 180C (160C fan / 350F).
Beat together the margarine and sugar until light and fluffy.
Beat in the egg and cordial.
Stir in the flour and baking powder and mix gently until combined.
Put rounded teaspoons of mixture at least 2 inches apart on a lined baking tray. An alternative method is to put the mixture in a piping bag and pipe 1-inch-wide blobs.
Bake for  8-10 minutes until the biscuits spread and turn light golden.
Allow to cool and firm up slightly on the tray before transferring to a wire rack to cool.",12,250 g (1⅓ cups + 1 tbsp) white caster sugar (superfine sugar),250 g (2 sticks + 4 tsp) margarine,1 tsp baking powder,1 medium free range eggs,2 tsp concentrated elderflower cordial,250 g (1¾ cups) plain white flour (all purpose flour),250 g (1⅓ cups + 1 tbsp) white caster sugar (superfine sugar),250 g (2 sticks + 4 tsp) margarine,1 tsp baking powder,1 medium free range eggs,2 tsp concentrated elderflower cordial,250 g (1¾ cups) plain white flour (all purpose flour),NA,NA,NA,NA,NA,NA,A Mummy Too,https://www.amummytoo.co.uk/elderflower-sugar-cookies-recipe/,NA,NA,NA,NA,NA,NA,NA,NA,NA,NA,NA,NA,NA,NA,NA,NA
Vanilla fudge cookies,Emily Leary,4.5, 2 ,Cookies,American,Prep Time15 minutes mins,Cook Time10 minutes mins,NA,Total Time25 minutes mins,12 cookies,10,"Preheat the oven to 180C (160C fan-assisted, 350F).
In a large bowl, put the margarine, golden syrup and sugar. Beat until fluffy.
Add the vanilla and egg. Beat until well combined.
Fold in the flour and the baking powder.
Add the white chocolate and fudge pieces. Stir through.
Chill the dough for 15 minutes or until you can roll a piece into a ball in your hand.
Form the dough into 12 equally sized balls and place 2-3 inches apart on a baking paper-lined baking sheet.
Squash them down by about half to create fat discs.
Bake for 10-12 minutes until they just start to go golden at the very edges – the idea is to get them out before they’re browned so that they stay chewy when cool.
They will be very soft and slightly puffy when they first come out of the oven. Allow them to cool on the tray until they are firm enough to transfer to a wire cooling rack.",18,130 g (4.6 oz) margarine,60 g (2.1 oz) golden syrup,160 g (5.6 oz) white caster sugar (superfine sugar),1 tsp vanilla extract,1 medium free range eggs,235 g (8.3 oz) plain white flour (all purpose flour),1 tsp baking powder,100 g (3.5 oz) white chocolate chunks,50 g (1.8 oz) fudge pieces,130 g (4.6 oz) margarine,60 g (2.1 oz) golden syrup,160 g (5.6 oz) white caster sugar (superfine sugar),1 tsp vanilla extract,1 medium free range eggs,235 g (8.3 oz) plain white flour (all purpose flour),1 tsp baking powder,100 g (3.5 oz) white chocolate chunks,50 g (1.8 oz) fudge pieces,A Mummy Too,https://www.amummytoo.co.uk/fudge-and-white-choc-chip-cookies-recipe/,NA,NA,NA,NA,NA,NA,NA,NA,NA,NA,NA,NA,NA,NA,NA,NA
Dark chocolate sea salt cookies,Emily Leary,5, 1 ,Cookies,American,Prep Time15 minutes mins,Cook Time10 minutes mins,NA,Total Time25 minutes mins,25 cookies,10,"Preheat the oven to 180C (160C fan-assisted).
Put the butter, golden syrup, vanilla and sugar into a large bowl. Beat together until fluffy.
Add the egg and beat again until well combined.
Add the flour and the baking powder. Mix well.
Stir in half (100g / 3.5oz) the dark chocolate chips.  You should now have a sticky, light dough .
Take 1 tbsp scoops and place, well spaced, on a baking sheet lined with baking paper.
Top with 3 or 4 more of the chocolate chips per cookies.
Bake for 8-10 minutes until they just start to go golden at the edges. Aim to get them out before they’re too browned so that they stay chewy when cool.
While still hot on the tray, top the cookies with more chocolate chips and sprinkle with a little salt.
Allow to firm up enough to lift in one piece, then transfer to a wire rack to cool.",18,130 g (4.6 oz) salted butter softened,2 tbsp golden syrup,1 tsp vanilla extract,160 g (5.6 oz) white caster sugar (superfine sugar),1 medium free range eggs,235 g (8.3 oz) plain white flour (all purpose flour),1 tsp baking powder,200 g (7.1 oz) dark chocolate chips (bittersweet),2 tsp sea salt flakes,130 g (4.6 oz) salted butter softened,2 tbsp golden syrup,1 tsp vanilla extract,160 g (5.6 oz) white caster sugar (superfine sugar),1 medium free range eggs,235 g (8.3 oz) plain white flour (all purpose flour),1 tsp baking powder,200 g (7.1 oz) dark chocolate chips (bittersweet),2 tsp sea salt flakes,A Mummy Too,https://www.amummytoo.co.uk/big-chewy-dark-chocolate-chip-cookies/,NA,NA,NA,NA,NA,NA,NA,NA,NA,NA,NA,NA,NA,NA,NA,NA
Father Christmas cookies,Emily Leary,5, 1 ,"Cookies, Festive makes",British,Prep Time45 minutes mins,Cook Time8 minutes mins,NA,Total Time53 minutes mins,21 cookies,22,"Preheat the oven to 180C (160C fan).
Put the flour, sugar and mixed spice in a large bowl. Mix well.
Add the butter to the bowl. Rub the mix through until you get an even crumb. 
Add in the lemon extract and milk. Mix with a round knife until the dough starts to clump.
Use your hands to gather the dough into a ball. If it's unmanageably soft, wrap and pop in the fridge for 15 mins to chill and firm.
Turn the dough out on to a floured surface. For space, I find it easiest to work with half the dough at a time.
Roll the dough out very thinly - just 2-3mm (1/8 of an inch).
Cut as many men out as you can. Gather up any offcuts, rolling and cutting until all the dough is used up.
Place the cookies on lined trays. Bake in the centre of the oven for about 8 mins until just colouring at the edges.
Allow the cookies to cool enough to firm up, then transfer to a wire rack to cool completely.
Lightly dust your surface with cornflour. Roll your red sugar paste out very thinly.
Use your gingerbread man cutter to cut out as many shapes as you can.
Trim away the off the head and ends of the arms and legs to create little Santa suits. I used the head part of my gingerbread man cutter to do this, creating a shape almost like a romper suit.
Dab a very sparing touch of water onto the surface of a cookie.
Apply a Santa suit, smoothing gently with your fingers to work into shape as needed. You can use offcuts to shape a little hat for your Santas too.
Note: it's best to apply all of your suits before moving on as otherwise the sugar paste dry out and become harder to work with.
Start with the white icing pen. Drawing in tiny circles, you'll need to draw: trim along the wrists and ankles of the suit; trim and a bobble on the hat; Father Christmas's beard; trim running down the centre of his suit to his waist.
Now use a black icing pen to give Father Christmas a friendly smile. You can also draw a belt along his middle.
Finally, use your yellow pen to add a little belt buckle.
Form two small balls of sugar paste and apply to the moistened cookie surface (see pics).
As before, apply a suit (or dress), smoothing gently with your fingers to work into shape as needed.
Add all the same details as you gave Father Christmas, plus any extra flourishes you fancy.
Repeat until all of your cookies are decorated. Aren't they just ridiculously sweet and funny?",16,270 g (9.5 oz) plain white flour (all purpose flour),75 g (2.6 oz) white caster sugar (superfine sugar),150 g (5.3 oz) salted butter cubed,1/2 tsp lemon extract,1/2 tsp mixed spice,2 tbsp whole milk,150 g (5.3 oz) red sugar paste,"Icing pens (white, black and yellow)",270 g (9.5 oz) plain white flour (all purpose flour),75 g (2.6 oz) white caster sugar (superfine sugar),150 g (5.3 oz) salted butter cubed,1/2 tsp lemon extract,1/2 tsp mixed spice,2 tbsp whole milk,150 g (5.3 oz) red sugar paste,"Icing pens (white, black and yellow)",NA,NA,A Mummy Too,https://www.amummytoo.co.uk/father-christmas-cookies/,NA,NA,NA,NA,NA,NA,NA,NA,NA,NA,NA,NA,NA,NA,NA,NA
White chocolate cookies,Emily Leary,5, 3 ,Cookies,American,Prep Time10 minutes mins,Cook Time8 minutes mins,NA,Total Time18 minutes mins,30 cookies,9,"Preheat the oven to 180C (160C fan-assisted).
In a large bowl, beat together the butter, golden syrup, vanilla and sugar until fluffy.
Beat in the egg and the vanilla until well combined.
Add the flour and the baking powder and mix well – you should now have a sticky, light dough.
Fold in the white chocolate chips.
Use a tablespoon to scoop the dough, flattening off against the side of the bowl, then roll the dough into a ball with your hands. This is the best way to get 30 equally sized cookies.
Place the balls of dough on baking sheets lined with greaseproof paper, being sure to place each cookie at least an inch apart so that they don’t stick together when they spread.
Bake for 8-10 minutes until golden at the edges. Get them out of the oven before they’re fully browned so that they stay chewy when cool.
Allow to cool slightly on the tray until firm enough to transfer to a wire rack to cool completely.",16,130 g (4.6 oz) salted butter softened,2 tbsp golden syrup,160 g (5.6 oz) white caster sugar (superfine sugar),1 tsp vanilla extract,1 medium free range eggs,235 g (8.3 oz) plain white flour (all purpose flour),1 tsp baking powder,150 g (5.3 oz) white chocolate chips,130 g (4.6 oz) salted butter softened,2 tbsp golden syrup,160 g (5.6 oz) white caster sugar (superfine sugar),1 tsp vanilla extract,1 medium free range eggs,235 g (8.3 oz) plain white flour (all purpose flour),1 tsp baking powder,150 g (5.3 oz) white chocolate chips,NA,NA,A Mummy Too,https://www.amummytoo.co.uk/soft-and-chewy-white-chocolate-cookies-recipe/,NA,NA,NA,NA,NA,NA,NA,NA,NA,NA,NA,NA,NA,NA,NA,NA
White chocolate shortbread,Emily Leary,5, 1 ,Cookies,Scottish,Prep Time20 minutes mins,Cook Time30 minutes mins,NA,Total Time50 minutes mins,12 shortbreads,16,"Preheat the oven to 180C (160C fan-assisted).
Put the sugar, flour and semolina in a large bowl.
Add the cold, cubed butter and rub in until a crumb is achieved. It's normal for it to go clumpy, as long are there are no lumps of butter.
Tip the dough out into a well-greased, non-stick, medium roasting tin. Spread evenly and press down firmly with the flat of your hand.
Prick the dough all over with a fork - this helps to stop the biscuit puffing up during baking.
Bake for 25-30 mins or until firm and pale golden.
Allow to cool until firm. You can then either leave in the tin to cool completely or, if you want to speed the process up a bit, you can carefully tip the biscuit onto a cooling rack, then return it to the tin once cool.
While the biscuit is cooling, put the honeycomb pieces into a small bowl.
Position your edible gold spray about 5-7.5cm (2-3 inches) and spray while gently shaking the bowl until the honeycomb is evenly coated. Set aside to dry.
With the cold biscuit layer in the tin, pour the caramel on top and spread gently to the edges.
Melt the white chocolate, allow to cool then pour over the caramel, distributing evenly, then level off.
Melt the milk chocolate and drizzle very thinly all over the white chocolate in swirls.
Scatter the honeycomb on top.
Cover and place in the fridge to set for 30 minutes or until the white chocolate is set all the way to the centre. .
Run a knife around the edges of the tin and turn out onto a board.
Trim the top and bottom off with a sharp knife to create a neat rectangle, then cut into 16 bars.",18,300 g (10.6 oz) salted butter cold and cubed,300 g (10.6 oz) plain white flour (all purpose flour),120 g (4.2 oz) granulated white sugar caster or granulated,120 g (4.2 oz) fine semolina,25 g (0.9 oz) honeycomb pieces,Edible gold spray,400 g (14.1 oz) thick caramel,350 g (12.3 oz) white chocolate,20 g (0.7 oz) milk chocolate,300 g (10.6 oz) salted butter cold and cubed,300 g (10.6 oz) plain white flour (all purpose flour),120 g (4.2 oz) granulated white sugar caster or granulated,120 g (4.2 oz) fine semolina,25 g (0.9 oz) honeycomb pieces,Edible gold spray,400 g (14.1 oz) thick caramel,350 g (12.3 oz) white chocolate,20 g (0.7 oz) milk chocolate,A Mummy Too,https://www.amummytoo.co.uk/white-chocolate-shortbread/,NA,NA,NA,NA,NA,NA,NA,NA,NA,NA,NA,NA,NA,NA,NA,NA
Vegan oat cookies,Emily Leary,5, 3 ,Breakfast,British,Prep Time10 minutes mins,Cook Time20 minutes mins,NA,Total Time30 minutes mins,12 cookies,7,"Put the butter and sugar in a bowl and mix until fluffy
Add the milk, egg replacement powder and vanilla extract and whisk together
Stir in the flour and oats until well combined
Add the chocolate chips, seeds and raisins and mix well
Use your hands to roll 1.5 inch dough balls and place onto a non-stick an oven dish at least 2 inches apart, pressing down only slightly
Bake at 200C/390F (180C/355F fan) for 15-20 minutes, until just colouring at the edges
Cool your vegan oat cookies briefly on the tray, then transfer to a cooling rack with a spatula",10,125 g (4.4 oz) dairy-free spread,150 g (5.3 oz) golden granulated sugar (cane sugar),1 portion egg replacement powder pack equivalent of 1 egg,1/2 tsp vanilla extract,1 tbsp unsweetened plant milk,140 g (4.9 oz) porridge oats,110 g (3.9 oz) self-raising white flour (self rising flour),50 g (1.8 oz) vegan chocolate chips,35 g (1.2 oz) raisins,25 g (0.9 oz) pumpkin seeds,NA,NA,NA,NA,NA,NA,NA,NA,A Mummy Too,https://www.amummytoo.co.uk/choc-chip-raisin-and-sunflower-seed-breakfast-biscuits/,NA,NA,NA,NA,NA,NA,NA,NA,NA,NA,NA,NA,NA,NA,NA,NA
White chocolate chip oatmeal cookies,Emily Leary,4.5, 2 ,Cookies,American,Prep Time15 minutes mins,Cook Time15 minutes mins,NA,Total Time30 minutes mins,20 cookies,8,"Preheat the oven to 180C (160C fan).
Put the softened butter in a bowl, then whisk in the sugar until the mixture is pale and fluffy.
Add the milk, eggs and vanilla extract and whisk again.
Mix in the flour and oats.
Add the chocolate chips and stir through. 
Scoop tablespoons of the mixture onto a baking sheet lined with baking paper, spacing at least 5cm (2 inches) apart.
Bake for 10-15 minutes, until just golden.
Cool briefly on the baking sheet, then transfer to a cooling rack.",16,125 g (4.4 oz) salted butter softened,150 g (5.3 oz) white caster sugar (superfine sugar),1 medium free range eggs,1/2 tsp vanilla extract,1 tbsp whole milk,140 g (4.9 oz) porridge oats,110 g (3.9 oz) self-raising white flour (self rising flour),100 g (3.5 oz) white chocolate chips,125 g (4.4 oz) salted butter softened,150 g (5.3 oz) white caster sugar (superfine sugar),1 medium free range eggs,1/2 tsp vanilla extract,1 tbsp whole milk,140 g (4.9 oz) porridge oats,110 g (3.9 oz) self-raising white flour (self rising flour),100 g (3.5 oz) white chocolate chips,NA,NA,A Mummy Too,https://www.amummytoo.co.uk/white-chocolate-chip-oatmeal-cookies/,NA,NA,NA,NA,NA,NA,NA,NA,NA,NA,NA,NA,NA,NA,NA,NA
