title,author,rating,ratingnum,cuisine,category1,category2,preptime,cooktime,customtime,totaltime,servings,numberofsteps,actualsteps,totalingredients,ingredient1,ingredient2,ingredient3,ingredient4,ingredient5,ingredient6,ingredient7,ingredient8,ingredient9,ingredient10,ingredient11,ingredient12,ingredient13,ingredient14,ingredient15,source,link,ingredient16,ingredient17,ingredient18,ingredient19,ingredient20,ingredient21,ingredient22
Raspberry White Chocolate Cookies,Angela Latimer,5,10,American,Cookies & Bars,NA,5 minutes,10 minutes,NA,15 minutes,24 cookies,6,"Preheat your oven to 350°F (175°C) and line a baking sheet with parchment paper or a silicone baking mat. 
Use your stand mixer or an electric mixer to beat ¾ cup butter, ½ cup sugar, and ½ cup light brown sugar until smooth and fluffy. Then mix in 1 large egg, 2 teaspoon vanilla extract, ½ teaspoon baking soda, and ¼ teaspoon salt until well combined. 
Gradually add 2¼ cups all-purpose flour while mixing on low speed. Then, fold in ½ cup white chocolate chips followed by ½ cup raspberries (be careful not to smash them). 
Scoop the dough into portions that are 1½ tablespoons and arrange them onto the baking sheets, leaving about 3 inches in between them. 
Bake in the oven at 350°F (175°C) for 8-12 minutes, or until the edges are only slightly golden.
Remove the cookies from the oven and let them cool on the sheet for 5-10 minutes before moving them to a cooling rack. ",10,▢ ¾ cup butter (softened at room temperature),▢ ½ cup sugar,▢ ½ cup light brown sugar (packed),▢ 1 large egg (at room temperature),▢ 2 teaspoon vanilla extract,▢ ½ teaspoon baking soda,▢ ¼ teaspoon salt,▢ 2¼ cups all-purpose flour (spooned and leveled),▢ ½ cup white chocolate chips (or a chopped white chocolate candy bar),"▢ ½ cup raspberries (fresh, frozen, or freeze-dried)",NA,NA,NA,NA,NA,Bake It With Love,https://bakeitwithlove.com/raspberry-white-chocolate-cookies/,NA,NA,NA,NA,NA,NA,NA
Cherry Blossom Cookies,Angela Latimer,4.86,7,American,Cookies & Bars,NA,5 minutes,10 minutes,20 minutes,35 minutes,36 servings,9,"In a large mixing bowl with an electric mixer, cream together 1 cup butter and 1 cup confectioners sugar until smooth and creamy. 
Add 1 tablespoon maraschino cherry liquid and ½ teaspoon vanilla extract and mix until well combined. 
Add the 2¼ cups all-purpose flour and mix until fully combined, starting with only 2¼ cups of flour and adding more as needed (up to 2½ cups) to get a dough that has the consistency of playdough. *If the dough is too dry to form into balls, you can add more cherry juice 1 teaspoon at a time, until the dough is the correct consistency. 
Fold in the chopped ½ cup maraschino cherries until just incorporated. Transfer the bowl to the fridge and chill for 20-30 minutes.
Preheat the oven to 350°F (175°C) and line your baking sheet with parchment paper. 
Once chilled, scoop the dough into tablespoon-sized portions and then roll them in 3 tablespoon sugar until fully coated. Place them onto the baking sheet, leaving a few inches in between each one. 
Bake in the preheated oven at 350°F (175°C) for 10 minutes, or until the edges just begin to turn golden in color. 
Remove the cookies from the oven and immediately top each one with an unwrapped 36 Hershey's Kissess by gently pressing it into the center. 
Let the cookies cool for 5 minutes and then place them onto a cooling rack to finish cooling. ",8,▢ 1 cup butter (room temperature),▢ 1 cup confectioners sugar,▢ 1 tablespoon maraschino cherry liquid (from the jar),▢ ½ teaspoon vanilla extract,▢ 2¼ cups all-purpose flour (or more as needed),▢ ½ cup maraschino cherries (chopped),▢ 3 tablespoon sugar (for rolling),▢ 36 Hershey's Kisses,NA,NA,NA,NA,NA,NA,NA,Bake It With Love,https://bakeitwithlove.com/cherry-blossom-cookies/,NA,NA,NA,NA,NA,NA,NA
Macadamia Nut Cookies,Angela Latimer,5,4,American,Desserts,NA,10 minutes,10 minutes,NA,20 minutes,NA,6,"Using a stand or electric hand mixer, beat ½ cup butter and ¾ cup granulated sugar in a bowl until light and creamy. Add in 1 large egg, 2 teaspoon vanilla extract, ¼ teaspoon salt, ½ teaspoon baking powder, ½ teaspoon baking soda, and 1 teaspoon corn starch and mix until combined.
Add 1 ¼ cups all-purpose flour to your wet ingredients gradually, beat at low speed, or mix using a wooden spoon until just combined (do not over-mix the dough).
Gently fold in 1 ½ cups macadamia nuts until they're evenly distributed, then cover and refrigerate your cookie dough for 1 hour.
Portion the dough out onto parchment paper or silicone baking mat lined baking sheets. Use generous tablespoonful scoops and roll into balls. Place the dough balls onto your prepared baking sheet leaving 2 inches of spacing between the cookies.
Bake at 350°F (175°C/Gas Mark 4) until the bottoms of the cookies just begin to turn golden, 10 to 12 minutes.
Remove from the oven and allow the cookies to cool on the baking sheet for 10 minutes before transferring to a wire cooling rack to cool completely.",10,"▢ ½ cup butter (softened, at room temperature)",▢ ¾ cup granulated sugar,▢ 1 large egg,▢ 2 teaspoon vanilla extract,▢ ¼ teaspoon salt,▢ ½ teaspoon baking powder,▢ ½ teaspoon baking soda,▢ 1 teaspoon corn starch,▢ 1 ¼ cups all-purpose flour (spooned and leveled),▢ 1 ½ cups macadamia nuts (roughly chopped),NA,NA,NA,NA,NA,Bake It With Love,https://bakeitwithlove.com/macadamia-nut-cookies/,NA,NA,NA,NA,NA,NA,NA
Brownie Blondies,Angela Latimer,5,22,American,Cookies & Bars,NA,10 minutes,55 minutes,NA,5 minutes,18 servings,9,"Preheat your oven to 350°F (175°C) and line a 9x13 baking pan with parchment paper. Leave enough excess parchment paper to be able to lift the brownie blondies out of the pan when done.
In a large mixing bowl or the bowl of your stand mixer, combine sugars and melted butter. Mix until well combined, scraping the sides of the bowl as you go. Add the vanilla extract, salt, and espresso powder and stir until evenly distributed.
Incorporate the eggs one at a time and mix until smooth again between each addition. Stir in the sifted cocoa powder until fully incorporated, then add the flour and mix just enough that the flour is mixed in thoroughly.
Transfer the brownie batter into your prepared pan and bake the bottom layer for 25 minutes at 350°F (175°C).
Clean your bowl and add the melted butter and light brown sugar. Mix until well combined, then add the vanilla extract, baking powder, and salt. Mix until smooth.
Incorporate the eggs one at a time, mixing until smooth again. Add the flour and mix until just combined.
Remove the brownie layer from your oven when the 25-minute bake time is up, then spoon the blondie batter over the brownie layer. Use your spatula to spread the blondie batter to the edges of the pan. *Your brownie layer is not fully set; it may mix slightly with the blondie batter - this is OK.
Return the pan of brownie blondies to your oven and continue baking at 350°F (175°C) for an additional 25-35 minutes. Once an inserted knife or cake tester comes out with a few crumbs or fudgy (but not raw doughy), the brownie blondies are done.
Cool the brownie blondies in the pan on a wire cooling rack completely before using the parchment paper to lift them out to slice for serving.",16,▢ 1 ½ cups butter (melted - 3 sticks),▢ 2 ½ cups sugar,▢ ½ cup light brown sugar (packed),▢ ½ tablespoon vanilla extract,▢ 2 teaspoon espresso powder,▢ ½ teaspoon salt,▢ 5 large eggs (at room temperature),▢ 1 ¼ cups unsweetened cocoa powder (sifted),▢ 1 ¼ cups all-purpose flour,▢ 1 cup butter (melted - 2 sticks),▢ 2 cups light brown sugar (packed),▢ 1 tablespoon vanilla extract,▢ 1 teaspoon baking powder,▢ ½ teaspoon salt,▢ 2 large eggs (at room temperature),Bake It With Love,https://bakeitwithlove.com/brownie-blondies/,▢ 2 cups all-purpose flour,NA,NA,NA,NA,NA,NA
Chocolate Chip Cookies Without Brown Sugar,Angela Latimer,5,123,American,Cookies & Bars,NA,10 minutes,10 minutes,NA,20 minutes,60 chocolate chip cookies,6,"In a large mixing bowl or the bowl of your stand mixer, cream together the 1 cup butter, 1 ½ cups sugar, 2 teaspoon vanilla extract, 1 teaspoon baking soda, and ¼ teaspoon salt until smooth.
Add the lightly beaten 2 large eggs and combine thoroughly with the butter mixture. Gradually add the 2 ½ cups  all-purpose flour, mixing until all of the flour is incorporated into your cookie dough. Fold in 2 cups chocolate chips.
Portion out your cookie dough into roughly 1-1 ¼-inch round balls and place onto a parchment paper-lined baking sheet and chill. *See notes for dough chilling options.
Preheat your oven to 350℉ (175℃) once the chocolate chip cookie dough is chilled or frozen.
Bake in the center of the middle rack in your preheated oven at 350℉ (175℃) for 10-12 minutes, or 11-13 minutes if baking from frozen. Remove from the oven when the cookie edges are slightly golden.
Allow your baked cookies to cool slightly on the baking sheet, about 5 minutes. Then transfer them to a wire cooling rack to cool completely.",8,▢ 1 cup butter (2 sticks salted butter softened to room temp),▢ 1 ½ cups sugar,▢ 2 teaspoon vanilla extract,▢ 2 large eggs (lightly beaten),▢ ¼ teaspoon salt,▢ 1 teaspoon baking soda,▢ 2 ½ cups all-purpose flour,▢ 2 cups chocolate chips (1 12 oz bag),NA,NA,NA,NA,NA,NA,NA,Bake It With Love,https://bakeitwithlove.com/chocolate-chip-cookies-without-brown-sugar/,NA,NA,NA,NA,NA,NA,NA
How To Make No Bake Cookies,Angela Latimer,5,2,American,How To,NA,0 minutes,5 minutes,30 minutes,35 minutes,30 cookies,5,"In a large saucepan, heat the butter, milk, sugar and cocoa powder over medium high heat. Stir often as the butter melts.
Bring the syrup to a rolling boil, adjusting your temperature as needed to get a good bubbling boil without over flowing while stirring constantly. You need to cook the syrup at a solid rolling boil for one full minute. Set a timer.
Remove the saucepan from your stove top and stir in the vanilla and peanut butter until smooth and well combined. Then stir in the quick oats until well coated and evenly distributed in the syrup.
Use a large tablespoon to drop cookie portions in heaping tablespoonful amounts onto a parchment paper lined baking sheet or working surface. Leave about 1 inch between cookies for spreading.
Allow the cookies to set at room temperature for 30 minutes.",7,▢ ½ cup butter,▢ ½ cup milk,▢ 2 cups sugar,▢ ¼ cup unsweetened cocoa powder,▢ 1 teaspoon vanilla extract,▢ ½ cup creamy peanut butter,▢ 3 cups quick oats (not old fashioned oats or steel cut oats),NA,NA,NA,NA,NA,NA,NA,NA,Bake It With Love,https://bakeitwithlove.com/how-to-make-no-bake-cookies/,NA,NA,NA,NA,NA,NA,NA
Oatmeal Raisin Cookies,Angela Latimer,5,13,American,Cookies & Bars,NA,10 minutes,10 minutes,NA,20 minutes,30 cookies,8,"Preheat your oven to 350°F (175°C) and line a baking sheet(s) with parchment paper or a silicone baking mat.
Use your stand mixer or an electric hand mixer to cream together the softened butter, light brown sugar, and white granulated sugar until smooth.
Add the eggs, molasses, vanilla extract, baking soda, ground cinnamon, and salt, then mix until well incorporated.
Mix in the all-purpose flour until fully incorporated into the wet ingredients.
Fold in the old-fashioned rolled oats and 1 ½-2 cups of raisins until evenly distributed in the cookie dough. The oatmeal cookie dough should be sticky when done.
Portion out the dough and roll them into 1 ½-inch balls. Place the balls onto the parchment paper line baking sheet, leaving a couple of inches in between them. Lightly press the cookies to flatten slightly before baking.
Bake at 350°F (175°C) with the baking sheet on the middle rack. If making smaller cookies, bake for  8-10 minutes, and 12-15 minutes for larger cookies. Remove from the oven when the edges are golden and the center of the cookie still looks slightly under-cooked.
Cool the baked oatmeal raisin cookies for 5 minutes on the pan before transferring them to a wire rack to finish cooling.",12,"▢ 1 cup butter (softened, at room temperature)",▢ 1 cup light brown sugar (packed - or dark brown sugar),▢ ¼ cup sugar,▢ 2 large eggs (at room temperature),▢ 2 tablespoon molasses,▢ 1 tablespoon vanilla extract,▢ 1 teaspoon baking soda,▢ 1 teaspoon ground cinnamon,▢ ½ teaspoon salt,▢ 2 cups all-purpose flour,"▢ 3 cups old-fashioned rolled oats (or quick oats, or a combination)",▢ 1 ½ cups raisins (up to 2 cups),NA,NA,NA,Bake It With Love,https://bakeitwithlove.com/oatmeal-raisin-cookies/,NA,NA,NA,NA,NA,NA,NA
Red Velvet Blossoms,Angela Latimer,5,8,American,Cookies & Bars,NA,15 minutes,10 minutes,NA,25 minutes,36 servings,6,"To get started, preheat your oven to 375°F (190°C) and line a baking sheet(s) with parchment paper.
Cream together the ½ cup of granulated sugar, ½ cup of light brown sugar, and ½ cup of softened butter in the bowl of your stand mixer or a separate large mixing bowl until you reach a smooth consistency.
Add in the 1 large egg, 1 teaspoon of vanilla extract, and ¼ teaspoon of red gel food coloring, then mix in the ¾ teaspoon of baking soda, ½ teaspoon of baking powder, and ¼ teaspoon of salt until fully combined. After the liquid ingredients are mixed together completely, slowly add the 1 ½ cups of all-purpose flour and the ¼ cup of unsweetened cocoa powder. Mix until your cookie dough just combines.
Pour the ½ cup of red sanding sugar into a shallow bowl. Portion out your cookie dough and use your hands to roll the dough into 1-inch balls. Coat each cookie dough ball in the red sanding sugar by rolling it in the bowl. Transfer the coated cookie balls onto the lined baking sheet(s) and allow 2 inches of room between each cookie.
Bake in your preheated oven at 375°F (190°C) for 8-10 minutes or until the cookies begin to set on the bottoms and the centers of the cookies are still a little soft.
Remove the cookies from your oven and instantly press down an unwrapped dark chocolate Hershey's Kiss gently on top. Repeat with the remaining cookies. Let the cookies rest on the baking sheet for 10 minutes, then transfer all cookies to a cooling rack before serving.",13,▢ ½ cup sugar (white granulated sugar),▢ ½ cup light brown sugar (packed),"▢ ½ cup butter (softened, at room temperature)",▢ 1 large egg (at room temperature),▢ 1 teaspoon vanilla extract,▢ ¼ teaspoon gel food coloring (red),▢ ¾ teaspoon baking soda,▢ ½ teaspoon baking powder,▢ ¼ teaspoon salt,▢ 1 ½ cups all-purpose flour,▢ ¼ cup unsweetened cocoa powder (sifted),▢ ½ cup red sanding sugar,"▢ 36 Hershey's Kisses (roughly 36 dark chocolate candies, unwrapped)",NA,NA,Bake It With Love,https://bakeitwithlove.com/red-velvet-blossoms/,NA,NA,NA,NA,NA,NA,NA
Hello Dolly Bars,Angela Latimer,5,132,American,Cookies & Bars,NA,5 minutes,25 minutes,NA,30 minutes,24 servings,7,"Preheat your oven to 350°F (175°C) and lightly oil a 9x13 baking dish (or coat it with non-stick cooking spray, or line with parchment paper).
Put the graham crackers in a ziplock baggie, seal, and crush the crackers. 
In a mixing bowl add the crushed graham crackers and pour the melted butter over the top. Mix completely using a fork.
Transfer the graham cracker/butter mixture to your 9x13 baking pan.  Press it down using your fingers covering the entire bottom of the baking pan (layers 1 & 2).
Sprinkle in the chocolate chips (layer 3), then add in the butterscotch chips (layer 4), next add in the shredded coconut (layer 5), then the  chopped pecans (layer 6), finally pour the can of sweetened condensed milk over the top (layer 7).
Bake at 350°F (175°C) for 25 to 30 minutes or until golden brown in color.
Remove from your oven and allow the bars to cool completely. Eat or store them for later, enjoy!",7,▢ 1 ½ cups graham cracker crumbs (about 12 graham crackers crushed),"▢ ½ cup unsalted butter (1 stick of butter, melted)",▢ 1 cup semi-sweet chocolate chips,▢ 1 cup butterscotch chips,▢ 1 cup shredded sweetened coconut,▢ ½ cup pecans (chopped or crushed),▢ 14 oz sweetened condensed milk (1 14 ounce can),NA,NA,NA,NA,NA,NA,NA,NA,Bake It With Love,https://bakeitwithlove.com/hello-dolly-bars/,NA,NA,NA,NA,NA,NA,NA
Molasses Cookies,Angela Latimer,5,3,American,Cookies & Bars,NA,10 minutes,10 minutes,NA,20 minutes,36 cookies,8,"Cream ½ cup butter and 1 cup dark brown sugar together until light and fluffy. 
Stir in 2 large eggs, ½ cup molasses, ¼ teaspoon salt, 2 teaspoons baking soda, ½ teaspoon ground cloves, 1 teaspoon ground cinnamon, and 1 teaspoon ground ginger and mix well. 
Fold in 2 ½ cups all-purpose flour‌ until just combined (do not over-mix).
Cover with plastic cling film and refrigerate to chill the dough for 1-2 hours.
Preheat oven to 350°F (175°C/Gas Mark 4) and line a baking sheet(s) with parchment paper or silicone baking mat.
Roll dough into small balls (I use a small melon baller to help with this) and roll in white sugar until generously coated. Place on prepared cookie sheets with 2 inches of spacing between cookies.
Bake in the center rack of your oven at 350°F (175°C/Gas Mark 4) for 8-10 minutes.
Remove from the oven and leave the cookies on your baking sheet for 5 minutes before transferring to a wire cooling rack. Cool completely before storing.",10,▢ ½ cup butter,"▢ 1 cup dark brown sugar packed, or use light brown sugar",▢ 2 large eggs,▢ ½ cup molasses or light molasses,▢ ¼ teaspoon salt,▢ 2 teaspoons baking soda,▢ ½ teaspoon ground cloves,▢ 1 teaspoon ground cinnamon,▢ 1 teaspoon ground ginger,▢ 2 ½ cups all-purpose flour‌,NA,NA,NA,NA,NA,Bake It With Love,https://bakeitwithlove.com/molasses-cookies/,NA,NA,NA,NA,NA,NA,NA
Ultimate Guide To Chocolate Chip Cookies,Angela Latimer,5,3,American,Cookies & Bars,NA,5 minutes,10 minutes,NA,15 minutes,6 cookies,5,"Preheat oven to 350°F (175°C) and line a baking sheet with parchment paper or a silicone baking mat.
In a medium mixing bowl mix together the melted and cooled butter, sugar, brown sugar, vanilla extract, baking soda and salt until smooth and creamy.
Add the egg yolk and mix until the dough is smooth again. Stir in the flour until all of the flour is incorporated, then fold in the milk chocolate, semi-sweet chocolate chips, or dark chocolate chips.
Portion out the cookie dough by using a rounded tablespoon portion (or a cookie scoop) and place onto the prepared baking sheet. Leave about 2 inches of spacing between each cookie.
Bake the cookies for 9-11 minutes, or until the edges are beginning to turn golden brown. Remove from the oven and allow cookies to set on your baking sheet for 2-3 minutes before transferring to a wire cooling rack to cool completely.",9,"▢ ¼ cup butter (salted, ½ stick - melted, cooled)",▢ ⅓ cup light brown sugar (packed),▢ 2 tablespoon sugar,▢ ¼ teaspoon baking soda,▢ ⅛ teaspoon salt,▢ ½ teaspoon vanilla extract,▢ 1 large egg yolk (at room temperature),"▢ ⅔ cup all-purpose flour (spoon & leveled or weighed, 80 grams)","▢ ½ cup milk chocolate chips (semi-sweet chocolate chips, dark chocolate chips, or chocolate chunks)",NA,NA,NA,NA,NA,NA,Bake It With Love,https://bakeitwithlove.com/ultimate-guide-to-chocolate-chip-cookies/,NA,NA,NA,NA,NA,NA,NA
White Chocolate Chip Macadamia Nut Cookies,Angela Latimer,5,1,American,Cookies & Bars,NA,15 minutes,10 minutes,15 minutes,40 minutes,36 cookies,7,"Preheat your oven to 350°F (175°C/Gas Mark 4) and line a baking sheet(s) with parchment paper or a silicone baking mat.
Beat the 1 cup butter, ¾ cup light brown sugar, and ½ cup sugar together in a large bowl or the bowl of your stand mixer until light and fluffy.
Beat in the 2 large eggs one at a time, then stir in 1½ teaspoon vanilla extract, ½ teaspoon baking soda, ½ teaspoon baking powder, and ¼ teaspoon salt.
Gradually stir the 2½ cups all-purpose flour into wet dough until fully incorporated. Then, fold in chopped 1 cup macadamia nuts and 1 cup white chocolate.
Drop heaping tablespoonfuls of dough onto your prepared baking sheet(s) leaving 2 inches of spacing.
Bake at 350°F (175°C/Gas Mark 4) until the cookies are a light golden color, about 8-10 minutes.
Remove from the oven and allow the cookies to set on the baking sheet for 5 minutes before transferring to a wire cooling rack to cool completely.",11,"▢ 1 cup butter (softened, at room temperature)",▢ ¾ cup light brown sugar (packed),▢ ½ cup sugar,▢ 2 large eggs (at room temperature),▢ 1½ teaspoon vanilla extract,▢ ½ teaspoon baking soda,▢ ½ teaspoon baking powder,▢ ¼ teaspoon salt,▢ 2½ cups all-purpose flour,▢ 1 cup macadamia nuts (coarsely chopped),"▢ 1 cup white chocolate (coarsely chopped, or use white chocolate chips)",NA,NA,NA,NA,Bake It With Love,https://bakeitwithlove.com/white-chocolate-chip-macadamia-nut-cookies/,NA,NA,NA,NA,NA,NA,NA
Powdered Sugar Cookies,Angela Latimer,5,14,American,Cookies & Bars,NA,5 minutes,7 minutes,NA,12 minutes,36 cookies,9,"In a mixing bowl (or the bowl of your stand mixer), cream together the 1 cup butter and 1½ cup confectioners sugar sugar until smooth. 
Add in the 1 large egg and 1 teaspoon vanilla extract and beat until smooth again.
Next, add the 1 teaspoon baking soda, 1 teaspoon cream of tartar, and ¼ teaspoon salt and mix until well combined. 
Add in the 2½ cups all-purpose flour while continuing to mix until just combined and the dough forms (*see note). 
Cover your dough and place it into the fridge to chill for at least 2 hours. (*see note.)
Preheat your oven to 350°F (175°C/Gas Mark 4) and line your baking sheet(s) with parchment paper or a silicone baking mat (Silpat).
Flour your work surface and roll the chilled dough out to about ¼-inch thick. Use your favorite cookie cutters to cut out your cookies and place them onto a baking sheet lined with parchment paper or a nonstick baking mat.
Bake the cookies in the oven for about 7-9 minutes, or until the edges are lightly golden.
Remove from the oven and allow the cookies to cool for 5 minutes before transferring them to a wire rack to finish cooling. ",8,"▢ 1 cup butter (softened, at room temperature)",▢ 1½ cup confectioners sugar,▢ 1 large egg (at room temperature),▢ 1 teaspoon vanilla extract,▢ 1 teaspoon baking soda,▢ 1 teaspoon cream of tartar,▢ ¼ teaspoon salt,▢ 2½ cups all-purpose flour (spoon and leveled),NA,NA,NA,NA,NA,NA,NA,Bake It With Love,https://bakeitwithlove.com/powdered-sugar-cookies/,NA,NA,NA,NA,NA,NA,NA
Fruitcake Bars,Angela Latimer,5,18,American,Cookies & Bars,NA,15 minutes,45 minutes,NA,NA,24 servings,6,"Preheat your oven to 325°F (160°C) and lightly grease a 9x13 baking pan.
Cream the butter and light brown sugar in a large mixing bowl until light and fluffy. Add the first egg along with the vanilla extract and salt then mix to combine. Add the remaining two eggs one at a time, mixing well after adding each egg. Then add the all-purpose flour and mix thoroughly.
Gently mix in the mixed peel, candied red and green glace cherries, chopped candied pineapple, and chopped dates by folding them into the dough. 
Spread the mixture evenly into your prepared 9x13 baking pan. 
Bake in your preheated oven at 325°F (160°C) for 40-45 minutes or until lightly browned and the dough no longer looks wet. 
Once the dough is finished baking, transfer it to a wire cooling rack. Allow the fruitcake bars to cool completely before slicing and serving.",10,"▢ ¾ cup butter (softened, at room temperature)",▢ 1 ¾ cups light brown sugar (packed),▢ 3 large eggs (at room temperature),▢ 1 tablespoon vanilla extract,▢ 1 pinch salt,▢ 1 ½ cups all-purpose flour,▢ 1 cups mixed peel,"▢ 1 cup candied cherries (red and green glace cherries, quartered or chopped)",▢ ½ cup candied pineapple (chopped),"▢ ½ cup dried dates (pitted, chopped)",NA,NA,NA,NA,NA,Bake It With Love,https://bakeitwithlove.com/fruitcake-bars/,NA,NA,NA,NA,NA,NA,NA
