title,author,rating,ratingnum,cuisine,category1,category2,preptime,cooktime,customtime,totaltime,servings,numberofsteps,actualsteps,totalingredients,ingredient1,ingredient2,ingredient3,ingredient4,ingredient5,ingredient6,ingredient7,ingredient8,ingredient9,ingredient10,ingredient11,ingredient12,ingredient13,ingredient14,ingredient15,source,link,ingredient16,ingredient17,ingredient18,ingredient19,ingredient20,ingredient21,ingredient22
Cookies & Cream Macarons,Angela Latimer,5,2,French,Macarons,NA,30 minutes,15 minutes,30 minutes,15 minutes,22 macarons,22,"In the bowl of your food processor, add your 100 grams almond flour, 30 grams oreo cookie crumbs, and 130 grams confectioners sugar. 
Pulse the mixture for about a minute, or until everything is a fine powder. Then, sift the mixture into a large mixing bowl and set it aside. 
In the bowl of your stand mixer, add 100 grams egg whites and ⅛ teaspoon cream of tartar. Beat on medium-high speed using the whisk attachment until soft peaks form (typically when you can see the tracks from the whisk). 
Gradually add 90 grams sugar while continuing to mix.
Keep beating the egg whites until they reach stiff peaks, being careful not to over or undermix them. 
Use a spatula to add ⅓ of the meringue to your dry ingredients and begin to gently fold. 
Once combined, add the second ⅓, fold again, and then add the final ⅓ portion of the meringue. 
Once all of the meringue has been added, continue to slowly fold the mixture by making a J shape, turning the bowl 90°, and repeating the process. Fold until the batter falls off the spatula in ribbons and takes about 10 seconds to sink back into itself. 
Add your batter to a piping bag with a Wilton #12 tip or a storage bag with the tip cut off and line your baking sheet with either parchment paper or a silicone baking mat.  
Hold the piping bag at a 90° angle above your baking sheet (in the center of the circle, if using a template) and firmly squeeze without moving the bag until the batter fills the inner circle of the template. Then, stop squeezing and make a quick C shape to break off the batter. If not using a template, simply make uniform-sized circles. Repeat with all of the remaining batter. 
Lift the baking sheet about 8 inches above the counter and drop it 5-8 times to remove any air bubbles. Then, take a toothpick and pop any that you can still see (it is slightly more difficult to spot the bubbles due to the speckled nature of these shells). 
Leave the macaron shells to rest for 30-60 minutes, or until they are no longer tacky to the touch and lose their glossy sheen. Meanwhile, preheat your oven to 300°F (150°C/Gas Mark 2). 
Bake your shells in the lower/middle rack of your oven for 13-18 minutes, rotating the baking sheet halfway, or until they don't budge on their 'feet' if you give them a gentle nudge. 
Remove the shells from the oven and let them cool on the sheet for at least 10 minutes before moving them to a wire cooling rack to finish cooling. 
Add 12 double stuff oreos filling and 4 tablespoon butter to your mixing bowl. 
Beat, starting on low and slowly increasing to medium-high speed, until smooth and well combined. 
Add the ¼ cup confectioners sugar and crushed 2 tablespoon oreo cookie crumbs and beat again until thoroughly combined.
Transfer your buttercream to a piping bag with a large tip or a storage bag with the tip cut off. 
Take one of your macaron shells and pipe the buttercream into the center. 
Gently press a second macaron shell on top to make the sandwich. 
Repeat with the remaining shells and buttercream.
For best results, place your macarons into a sealed container and let them bloom in the fridge for 24 hours before serving. ",10,▢ 100 grams almond flour (about ¾ cup + 1½ tablespoon),"▢ 30 grams oreo cookie crumbs (about 4 cookies with no filling, crushed)",▢ 130 grams confectioners sugar (about ¾ cup +2½ tablespoons),"▢ 100 grams egg whites (about 3-4 large eggs, at room temperature)",▢ ⅛ teaspoon cream of tartar,▢ 90 grams sugar (about ¼ cup +2½ tablespoons),▢ 12 double stuff oreos filling (filling only),▢ 4 tablespoon butter (at room temperature),▢ ¼ cup confectioners sugar,"▢ 2 tablespoon oreo cookie crumbs (about 2 cookies, crushed, without the filling)",NA,NA,NA,NA,NA,Bake It With Love,https://bakeitwithlove.com/cookies-cream-macarons/,NA,NA,NA,NA,NA,NA,NA
S'mores Whoopie Pies,Angela Latimer,5,1,American,Cookies & Bars,NA,15 minutes,10 minutes,NA,25 minutes,18 whoopie pies,20,"Add 11.5 oz milk chocolate chips and 9 oz heavy cream to a microwave-safe bowl. Heat in the microwave for 1 minute. 
Let the bowl sit undisturbed for 5 minutes. 
Stir the chocolate until melted and smooth. 
Place the ganache into the fridge to firm up while you work on the rest of the whoopie pies. 
Preheat your oven to 375°F (190°C/Gas Mark 5) and line a couple of baking sheets with parchment paper. 
In a large bowl, mix together 2 cups graham cracker crumbs, 1¼ cup all-purpose flour, 1½ teaspoon baking powder, 1 teaspoon baking soda, and ¼ teaspoon salt. 
Using a stand mixer or hand mixer, cream together ½ cup butter and 1 cup light brown sugar until light and fluffy, scraping down the sides and bottom of the bowl as needed. 
Add 2 large eggs and 1½ teaspoon vanilla extract and continue to beat until thoroughly combined.
Stop mixing and add half of your flour mixture as well as half of your ½ cup buttermilk. 
Mix on low speed, stopping occasionally to scrape the bowl, until well combined. 
Add the remaining flour mixture and buttermilk and mix again on low speed until thoroughly combined. It should resemble a very sticky cookie dough. 
Use a standard-sized cookie scoop (about 1 - 1½ tablespoons) to scoop the batter and drop it onto your prepared baking sheet, leaving about 2 inches of space in between each one. 
Bake in the oven at 375°F (190°C/Gas Mark 5) for 9-11 minutes, or until the top is no longer shiny and the cake slightly springs back when touched gently.
Remove the cakes from the oven and let them cool on the baking sheet for 5 minutes before transferring them to a wire rack to cool completely. 
Using a stand mixer or hand mixer, beat together 2 cup marshmallow creme fluff and 1 cup butter until light and fluffy.
Add 1¼ cup confectioners sugar, 1½ tablespoon vanilla extract, and ¼ teaspoon salt and continue to mix until well combined.
Turn the mixer to medium-high and beat for a minute longer.
Spread, spoon, or pipe the marshmallow frosting onto the flat side of the cooled cakes.
Top the marshmallow frosting with some of your chocolate ganache. 
Gently press another cake on top and serve immediately or store them for later. ",17,"▢ 2 cups graham cracker crumbs (about 10 graham crackers, crushed)",▢ 1¼ cup all-purpose flour (spooned and leveled),▢ 1½ teaspoon baking powder,▢ 1 teaspoon baking soda,▢ ¼ teaspoon salt,▢ ½ cup butter (at room temperature),▢ 1 cup light brown sugar (firmly packed),▢ 2 large eggs (at room temperature),▢ 1½ teaspoon vanilla extract,▢ ½ cup buttermilk (room temperature),▢ 2 cup marshmallow creme fluff,▢ 1 cup butter (at room temperature),▢ 1¼ cup confectioners sugar,▢ 1½ tablespoon vanilla extract,▢ ¼ teaspoon salt,Bake It With Love,https://bakeitwithlove.com/smores-whoopie-pies/,▢ 11.5 oz milk chocolate chips (or semi-sweet or dark chocolate chips),▢ 9 oz heavy cream,NA,NA,NA,NA,NA
Levain Bakery Black And White Cookies,Angela Latimer,5,1,American,Cookies & Bars,NA,10 minutes,12 minutes,NA,22 minutes,9 cookies,10,"Preheat your oven to 400°F (205°C/Gas Mark 6) and line a couple of baking sheets with parchment paper or silicone baking mats. 
In a large bowl, whisk together your 2½ cups all-purpose flour, ½ cup unsweetened black cocoa powder, 1 teaspoon cornstarch, ¾ teaspoon baking soda, and ½ teaspoon salt until combined. Set aside. 
Using your stand mixer or an electric hand mixer, cream together 1 cup butter, 1 cup light brown sugar, and ½ cup sugar until smooth and creamy. 
Add 2 large eggs and 1-2 teaspoon vanilla extract and continue mixing until well combined. 
Add your dry ingredient mixture and slowly combine until all of the flour has been incorporated into the dough. 
Use a silicone spatula to fold in 2 cups white chocolate chips and 1 cup milk chocolate chips. 
Using a heaping ice cream scoop or a scale, portion your dough into 5-ounce balls.
Roll the balls in your hands until smooth and place them onto your baking sheet spaced well apart. If desired, press a few extra chocolate chips onto the tops of the dough balls. 
Bake in the preheated oven at 400°F (205°C/Gas Mark 6) for 10-13 minutes or until the edges have set. 
Remove the cookies from the oven and let them cool on the baking sheet for 5 minutes before transferring them to a wire cooling rack to cool completely.",12,▢ 2½ cups all-purpose flour (spooned and leveled),▢ ½ cup unsweetened black cocoa powder,▢ 1 teaspoon cornstarch,▢ ¾ teaspoon baking soda,▢ ½ teaspoon salt,"▢ 1 cup butter (softened, at room temperature)",▢ 1 cup light brown sugar (firmly packed),▢ ½ cup sugar,▢ 2 large eggs (at room temperature),▢ 1-2 teaspoon vanilla extract,▢ 2 cups white chocolate chips,▢ 1 cup milk chocolate chips (or semi-sweet chocolate morsels),NA,NA,NA,Bake It With Love,https://bakeitwithlove.com/levain-bakery-black-white-cookies/,NA,NA,NA,NA,NA,NA,NA
Jello Cookies,Angela Latimer,5,4,American,Cookies & Bars,NA,15 minutes,12 minutes,NA,27 minutes,32 cookies,8,"Preheat your oven to 350°F (175°C/Gas Mark 4) and line a baking sheet(s) with parchment paper or silicone baking mat.
In a large bowl, combine 17.9 oz snickerdoodle cookie mix, melted ½ cup butter, and 1 large egg.
Split the mixed cookie dough into 4 small bowls and then gently work the different colored gelatins into the cookie dough (3 tablespoon green flavored gelatin powder, 3 tablespoon blue flavored gelatin powder, 3 tablespoon red flavored gelatin powder, and 3 tablespoon yellow flavored gelatin powder). You can wear gloves, but using your hands to work the Jello into the dough is easiest.
When done, you should have cookie dough in 4 different colors (and flavors).
Set a small shallow dish aside with 1 cup sugar as well as some small bowls with the excess jello powder to roll the cookie dough into as you portion out the dough.
Portion the dough out into 2 tablespoon-sized balls (use a cookie scoop if desired) and then roll them into balls. Roll the dough balls in the matching jello powder followed by the sugar then transfer them onto your prepared baking sheet(s).
Leave 2 inches of spacing between each cookie for spreading, then bake at 350°F (175°C/Gas Mark 4) for 10-13 minutes. Once the tops begin to set or any color starts to show on the bottoms or tops of the cookies, remove them from the oven.
Leave the baked cookies on your baking sheet for 5 minutes to finish baking, then serve them warm or transfer to a wire cooling rack to cool completely before storing.",8,"▢ 17.9 oz snickerdoodle cookie mix (one packaged 17.5-ounce bag, omit the cinnamon sugar packet)","▢ ½ cup butter (salted, melted)",▢ 1 large egg (at room temperature),▢ 3 tablespoon green flavored gelatin powder (½ of a 3-ounce package),▢ 3 tablespoon blue flavored gelatin powder (½ of a 3-ounce package),▢ 3 tablespoon red flavored gelatin powder (½ of a 3-ounce package),▢ 3 tablespoon yellow flavored gelatin powder (½ of a 3-ounce package),▢ 1 cup sugar,NA,NA,NA,NA,NA,NA,NA,Bake It With Love,https://bakeitwithlove.com/jello-cookies/,NA,NA,NA,NA,NA,NA,NA
CRUMBL Red Velvet White Chocolate Chip Cookies,Angela Latimer,5,2,American,Cookies & Bars,NA,10 minutes,11 minutes,NA,21 minutes,8 cookies,10,"Preheat your oven to 350°F (175°C/Gas Mark 4) and line 1-2 baking sheets with parchment paper or a silicone baking mat. 
In a medium-sized mixing bowl, whisk together your dry ingredients: 1½ cup all-purpose flour, 3 tablespoon unsweetened cocoa powder, ¼ cup corn starch, ½ teaspoon baking soda, and ¼ teaspoon salt. Set aside. 
Using a hand mixer or stand mixer, cream together ½ cup butter, ½ cup light brown sugar, and ¼ cup sugar at medium speed until smooth and creamy. 
Scrape down the bowl, then add 1 large egg, 1½-2 teaspoon vanilla extract, 1 teaspoon red gel food coloring, and ½ teaspoon white vinegar and beat again on medium speed until thoroughly combined. 
Add the dry ingredients and mix on slow speed just until the flour has disappeared (don't overmix it). 
Use a silicone spatula to fold in ¾ cup white chocolate chips.
Use an ice cream scoop to scoop out the dough and set it onto the prepared baking sheets, leaving a few inches in between each one. 
Gently press the cookies down slightly and push in a few extra chocolate chips, if desired. 
Bake in the preheated oven at 350°F (175°C/Gas Mark 4) for 10-13 minutes.
Remove the cookies from the oven and let them cool on the baking sheet for 4-5 minutes before moving them to a wire rack.",13,▢ 1½ cup all-purpose flour (spooned and leveled),▢ ¼ cup corn starch,▢ 3 tablespoon unsweetened cocoa powder,▢ ½ teaspoon baking soda,▢ ¼ teaspoon salt,"▢ ½ cup butter (softened, at room temperature)",▢ ½ cup light brown sugar (packed),▢ ¼ cup sugar,▢ 1 large egg (at room temperature),▢ 1½-2 teaspoon vanilla extract,▢ 1 teaspoon red gel food coloring,▢ ½ teaspoon white vinegar,▢ ¾ cup white chocolate chips,NA,NA,Bake It With Love,https://bakeitwithlove.com/crumbl-red-velvet-white-chocolate-chip-cookies/,NA,NA,NA,NA,NA,NA,NA
Lemon Macarons,Angela Latimer,5,1,French,Macarons,NA,30 minutes,10 minutes,30 minutes,10 minutes,20 macarons,28,"In a medium-sized mixing bowl, thoroughly whisk together 1½ large eggs and ½ cup sugar until well combined. 
Add the ¼ cup butter, ½ cup lemon juice, and lemon zest and whisk until combined.
Microwave the lemon curd mixture in 30-second increments, stirring well with a spoon in between each one. This will take several minutes. You'll know it is ready when you can see the stirring tracks in the curd and it sticks to the back of your spoon.
Set the lemon curd in the fridge to chill while you prepare the macarons.
Add 125 grams almond flour and 125 grams confectioners sugar to your food processor and blend until the mixture is extra fine.
Use a sieve to sift the almond flour mixture into a large mixing bowl, using a spoon to break up any chunks. There may be some larger almond pieces left over at the end, but try to discard as little as possible.
In a metal or glass bowl, use a hand mixer or stand mixer with the whisk attachment to beat 100 grams egg whites¼ teaspoon cream of tartar, and the optional ½ teaspoon lemon extract on medium speed. The eggs will be foamy and then will reach soft peaks.
Once you have soft peaks, slowly mix in the 80 grams sugar on medium speed until well combined.
Continue to beat the meringue at medium-high speed until medium peaks have formed. Then, you can add the optional yellow gel food coloring and continue to beat until you have stiff peaks. 
Slowly fold ⅓ of the meringue into your flour mixture until combined.
Repeat this process with the remaining ⅔ of the egg whites, only adding ⅓ at a time, and gently folding in between each addition.
After the meringue has been thoroughly added, continue to gently and slowly fold the macaron batter until the batter falls from the spatula in ribbons. *The consistency should be similar to honey or lava. If you let the batter fall from your spatula, it should only take about 10 seconds to sink back into itself.
Once you have reached the perfect consistency, transfer the batter into a piping bag that has been fitted with a round tip (or a storage bag with the corner cut off).
Place parchment paper or a macaron mat onto your baking sheet.
Pipe the macarons onto your parchment paper (or mat) in 1½-inch circles, making sure to space them at least ½-inch apart from each other.
Firmly tap the baking sheet on the counter 5 times to get rid of any air bubbles. Then, use a toothpick to pop any remaining bubbles that you might see.
Allow the macarons to rest on the counter at room temperature for 30-60 minutes, or until they are dry to the touch and no longer tacky. Don't let them continue to rest past this point.
While the macarons are resting, go ahead and preheat your oven to 325˚F (160˚C/Gas Mark 3).
Once ready, bake the macarons for 10-13 minutes, or until the macarons don't move if you tap on them slightly (they should be only just starting to brown).
Remove the macarons from the oven and let them cool on the baking sheet for 10 minutes before moving them to a wire rack to finish cooling.
In a large mixing bowl, add ½ cup butter. Use a hand mixer or stand mixer to beat it for 1 minute until the butter has become light and fluffy.
Add 1¼ cup confectioners sugar and beat until combined.
Add 1¼ tablespoon lemon juice and 1 teaspoon lemon zest and beat on medium-high speed. If your frosting is too thick, you can adjust it by adding small amounts of ½ tablespoon heavy cream.
Scoop the buttercream into a piping bag with a round tip (or a storage bag with the corner cut off).
Take one of your cooled macaron shells and pipe a ring of lemon buttercream around the outer edge.
Scoop or pipe some of the chilled lemon curd into the space in the center of the macaron shell. 
Gently press another macaron shell on top to form a sandwich.
For best results, place the macarons into an airtight container in the fridge for 24 hours. Then, allow them to come up to room temperature and serve.",17,▢ 125 grams almond flour (about 1¼ cup + 2 tsp),▢ 125 grams confectioners sugar (about 1¼ cup + 1 tsp),"▢ 100 grams egg whites (about 3-4 large eggs, room temperature)",▢ ½ teaspoon lemon extract (optional),▢ ¼ teaspoon cream of tartar,▢ 80 grams sugar (about ⅓ cup + 1 tsp),▢ yellow gel food coloring (optional),▢ ½ cup sugar,▢ 1½ large eggs,▢ ¼ cup butter (melted),▢ ½ cup lemon juice,▢ lemon zest,▢ ½ cup butter (unsalted),▢ 1¼ cup confectioners sugar,▢ 1¼ tablespoon lemon juice,Bake It With Love,https://bakeitwithlove.com/lemon-macarons/,▢ 1 teaspoon lemon zest,"▢ ½ tablespoon heavy cream (optional, if needed)",NA,NA,NA,NA,NA
S'mores Macarons,Angela Latimer,5,2,French,Macarons,NA,30 minutes,15 minutes,30 minutes,15 minutes,26 macarons,29,"In a medium-sized microwave-safe bowl, add your 3 oz heavy cream and 3.75 oz semi-sweet chocolate chips. 
Heat in the microwave for 1 minute. 
Remove from the microwave and let it sit undisturbed for 5 minutes.
Use a spoon to stir the mixture until melted and combined. If not completely melted, you can heat it for another 15 seconds. 
Place the ganache into the fridge to set up while you make the macarons. 
Prepare your baking sheet with a silicone macaron mat or parchment paper. 
In the bowl of your food processor, add the 150 grams almond flour, 140 grams confectioners sugar, and 10 grams unsweetened cocoa powder.
Blend with the food processor on low speed until the mixture has become extra-fine. Then, use a fine-mesh sieve to sift the mixture into a large mixing bowl. Set aside.
Add the 110 grams egg whites to the bowl of your stand mixer and beat, using the whisk attachment, on medium speed until foamy. 
Add ½ teaspoon vanilla extract and ⅛ teaspoon cream of tartar and continue to beat until soft peaks form. 
Once you have soft peaks (where you can see lines in the meringue, but the peaks droop), begin to very gradually add 95 grams sugar.
Continue to beat on medium speed until stiff peaks form. 
Add ⅓ of your meringue into the bowl with your dry ingredients. Gently fold until combined.
Repeat this process for the second and third portions of the meringue.
After the last bit of the meringue has been added, continue to gently and slowly fold the macaron batter until the batter falls from the spatula in ribbons. *The consistency should be similar to honey or lava. If you let the batter fall from your spatula, it should only take about 10 seconds to sink back into itself.
Once you have reached the perfect consistency, transfer the batter into a piping bag that has been fitted with a round tip (or a storage bag with the corner cut off).
Pipe the macarons onto your parchment paper (or mat) in 1½-inch circles, making sure to space them at least ½-inch apart from each other.
Firmly tap the baking sheet on the counter 5 times to get rid of any air bubbles. Then, use a toothpick to pop any remaining bubbles that you might see.
Allow the macarons to rest on the counter at room temperature for 30-60 minutes, or until they are dry to the touch and no longer tacky.
While the macarons are resting, go ahead and preheat your oven to 300˚F (150˚C/Gas Mark 2).
Once ready, bake the macarons for 15-17 minutes, or until the macarons don't move if you tap on them slightly.
Remove the macarons from the oven and let them cool on the baking sheet for 10 minutes before moving them to a wire rack to finish cooling.
Match up your macaron shells so that each pair is close to the same size. Get prepared by placing your ganache into a piping bag with a round tip and your ¼ cup marshmallow creme into a separate piping bag with the corner cut off. You'll also want to crush your 1 graham cracker.
Taking one macaron shell, pipe a ring of chocolate ganache around the outside. Add some marshmallow creme to the middle and sprinkle crushed graham crackers on top. Then, top with the second macaron shell.  
Melt your ¼ cup chocolate chips in the microwave, stirring every 30 seconds, until melted and smooth. 
Flip your assembled macaron upside down and lightly dip it into the melted chocolate. 
While the chocolate is still wet, sprinkle some graham crackers on top and add a few of your 2 tablespoon marshmallow bits.
Set the macarons aside for 2-3 minutes for the chocolate to set.
For best results, place your macarons into a sealed container in the fridge for 24 hours before letting them come to room temperature and serving them. ",13,▢ 150 grams almond flour,▢ 140 grams confectioners sugar,▢ 10 grams unsweetened cocoa powder,▢ 110 grams egg whites (room temperature),▢ ½ teaspoon vanilla extract,▢ ⅛ teaspoon cream of tartar,▢ 95 grams sugar,▢ 3 oz heavy cream,▢ 3.75 oz semi-sweet chocolate chips (or milk or dark),▢ ¼ cup marshmallow creme,"▢ 1 graham cracker (crushed, save some for topping)",▢ ¼ cup chocolate chips (melted),▢ 2 tablespoon marshmallow bits,NA,NA,Bake It With Love,https://bakeitwithlove.com/smores-macarons/,NA,NA,NA,NA,NA,NA,NA
Chocolate Peanut Butter No Bake Cookies,Angela Latimer,5,33,American,Cookies & Bars,NA,0 minutes,5 minutes,30 minutes,35 minutes,30 cookies,5,"In a large saucepan, heat the butter, milk, sugar and cocoa powder over medium high heat. Stir often as the butter melts.
Bring the syrup to a rolling boil, adjusting your temperature as needed to get a good bubbling boil without over flowing while stirring constantly. You need to cook the syrup at a solid rolling boil for one full minute. Set a timer.
Remove the saucepan from your stove top and stir in the vanilla and peanut butter until smooth and well combined. Then stir in the quick oats until well coated and evenly distributed in the syrup.
Use a large tablespoon to drop cookie portions in heaping tablespoonful amounts onto a parchment paper lined baking sheet or working surface. Leave about 1 inch between cookies for spreading.
Allow the cookies to set at room temperature for 30 minutes.",7,▢ ½ cup butter,▢ ½ cup milk,▢ 2 cups sugar,▢ ¼ cup unsweetened cocoa powder,▢ 1 teaspoon vanilla extract,▢ ½ cup creamy peanut butter,▢ 3 cups quick oats (not old fashioned oats or steel cut oats),NA,NA,NA,NA,NA,NA,NA,NA,Bake It With Love,https://bakeitwithlove.com/chocolate-peanut-butter-no-bake-cookies/,NA,NA,NA,NA,NA,NA,NA
Lemon Almond Cookies,Angela Latimer,5,7,American,Cookies & Bars,NA,5 minutes,12 minutes,30 minutes,47 minutes,18 cookies,8,"In a large mixing bowl, stir together your almond flour, melted butter, honey, lemon zest, vanilla and almond extract, and salt until well combined.
Cover the bowl with plastic wrap and transfer it to the refrigerator to chill for 30 minutes.  
Preheat your oven to 350°F (175°C) and line a baking sheet with parchment paper.
Use either a small cookie scoop or a tablespoon to scoop balls onto the prepared cookie sheet, leaving about 2 inches of space in between each ball. Use your hands to gently press on each one to slightly flatten them. 
Bake in the preheated oven at 350°F (175°C) for 12-14 minutes, or until the edges have turned golden brown. 
Remove the cookies from the oven and allow them to cool on the pan for 10 minutes before transferring them to a cooling rack. 
In a large mixing bowl, whisk together the sifted confectioners' sugar, lemon zest, and lemon juice until well combined and smooth. *Add more lemon juice if necessary to reach your desired consistency.
Once the cookies are completely cool, use a spoon to spread the glaze over the top of the cookies. ",10,"▢ 2½ cups almond flour (spooned and leveled, superfine)","▢ ¼ cup butter (melted, *see notes)",▢ 5 tablespoon honey,▢ 1½ tablespoon lemon zest (packed),▢ 1 teaspoon vanilla extract,▢ ¼ teaspoon almond extract,▢ ¼ teaspoon salt,▢ 2 cups confectioners sugar (sifted),▢ 1 teaspoon lemon zest (packed),▢ 3 tablespoon lemon juice (plus more as needed),NA,NA,NA,NA,NA,Bake It With Love,https://bakeitwithlove.com/lemon-almond-cookies/,NA,NA,NA,NA,NA,NA,NA
