title,author,rating,ratingnum,cuisine,category1,category2,preptime,cooktime,customtime,totaltime,servings,numberofsteps,actualsteps,totalingredients,ingredient1,ingredient2,ingredient3,ingredient4,ingredient5,ingredient6,ingredient7,ingredient8,ingredient9,ingredient10,ingredient11,ingredient12,ingredient13,ingredient14,ingredient15,source,link,ingredient16,ingredient17,ingredient18,ingredient19,ingredient20,ingredient21,ingredient22
Sour Patch Kids Cookies,Angela Latimer,4.89,18,American,Cookies & Bars,NA,10 minutes,10 minutes,NA,20 minutes,24 cookies,5,"Start by preheating your oven to 350°F (175°C) then line the baking sheet(s) with parchment paper, or use a silicone baking mat.
Cream the ¾ cup butter (or butter and shortening blend) with 1 cup sugar in a large mixing bowl or the bowl of your stand mixer until light and fluffy, about 1 minute. Beat in the 1 large egg and 2 teaspoon vanilla extract until well combined, then mix in the ½ teaspoon baking soda and ¼ teaspoon salt.
Gradually add in the 2 cups all-purpose flour, mixing it into the dough until it is smooth, then fold in the chopped 1 cup Sour Patch Kids candies until evenly distributed in the dough.
Portion the cookie dough onto your baking sheet(s) in tablespoon portions. Leave approximately 2 inches of spacing between the cookies for spreading.
Bake the cookies for 9-12 minutes at 350°F (175°C) or until the bottoms are just starting to become a light golden brown. Take the cookies out of the oven and cool them for at least 5 minutes on your baking sheet. Then transfer them to a wire cooling rack to cool completely.",8,▢ ¾ cup butter (or a blend - ½ cup softened butter and ¼ cup shortening is my preferred ratio),▢ 1 cup sugar,▢ 1 large egg (at room temperature),▢ 2 teaspoon vanilla extract,▢ ½ teaspoon baking soda,▢ ¼ teaspoon salt,▢ 2 cups all-purpose flour,▢ 1 cup Sour Patch Kids candies (chop into halves or thirds to make ¾ cup and reserve the rest for placing on top of the cookies),NA,NA,NA,NA,NA,NA,NA,Bake It With Love,https://bakeitwithlove.com/sour-patch-kids-cookies/,NA,NA,NA,NA,NA,NA,NA
Thumbprint Cookies,Angela Latimer,5,9,American,Cookies & Bars,NA,15 minutes,10 minutes,30 minutes,55 minutes,24 cookies,10,"Use your stand mixer or hand mixer to beat the butter until light and creamy. 
Add the sugar and brown sugar, and beat at medium speed for about 2 minutes, scraping down the bowl as needed. Then, add in the egg yolk and vanilla extract and beat well. 
In a separate bowl, whisk together the flour, cornstarch, and salt. Then, gradually add the mixture to the wet dough in small increments with the mixer on low speed until combined. *This dough is meant to be very crumbly and dry.
Use a cookie scoop or tablespoon to scoop out the dough and use your hands to roll it into a smooth ball. *Make sure the dough is very smooth and there are no seams so that your cookies don't crack. 
Roll the dough balls in the granulated sugar until fully coated, and then place them onto a parchment paper-lined baking sheet. Use your thumb (or a rounded teaspoon) to gently press an indention into the center of the balls. Repeat until you have used all of the dough. 
Transfer the baking sheet to the freezer and allow the cookie dough to chill for 30 minutes. 
Once chilled, preheat your oven to 375°F (190°C) and place your jam, jelly, or preserves into a small microwave-safe bowl. Heat the jam for 5-10 seconds, or until you can easily stir it but is not hot. 
Use a spoon to scoop the jam into each of the thumbprint indentions, filling the cavity all the way to the brim. Arrange the cookies so that they have 2 inches of space between them on the parchment paper-lined baking sheet(s). 
Bake at 375°F (190°C)  for 10-11 minutes, or until the edges are only beginning to turn golden. 
Remove the cookies from the oven and allow them to cool completely. ",10,"▢ 1 cup butter (room temperature, unsalted)",▢ ⅓ cup sugar,▢ ⅓ cup light brown sugar (packed),▢ 1 large egg yolk,▢ ¾ teaspoon vanilla extract,▢ 2¼ cup all-purpose flour (spooned and leveled),▢ 2 teaspoon cornstarch,▢ ½ teaspoon salt,▢ ½ cup sugar (for rolling),▢ ⅓ cup jam (or preserves),NA,NA,NA,NA,NA,Bake It With Love,https://bakeitwithlove.com/thumbprint-cookies/,NA,NA,NA,NA,NA,NA,NA
Greek Almond Cookies (Kourabiedes),Angela Latimer,5,8,Greek,Cookies & Bars,NA,15 minutes,15 minutes,NA,30 minutes,24 cookies,7,"Preheat your oven to 350°F (175°C) and line a baking sheet with parchment paper.
Using a stand mixer or hand mixer, cream together the room-temperature butter and confectioners' sugar until light and fluffy, about 5 minutes. Add the egg yolks and beat for another 5 minutes. 
Use a silicone spatula to scrape down the bowl. Then, add in the brandy, rose water, vanilla extract, almond extract, baking powder, and salt, and beat well until thoroughly combined.
Slowly add the all-purpose flour into the wet dough, about 1 cup at a time. Mix in between each addition only until the flour is incorporated. Once all of the flour has been mixed into the dough, stir in the slivered almonds.  
Roll the dough into balls that are about 1 inch in size. Use your hands to slightly flatten them and then add a small indention in the center of the cookie with your thumb. Place the cookies onto the prepared baking sheet, leaving approximately 2 inches of space in between them.
Bake in the preheated oven at 350°F (175°C) for 15-18 minutes, or until slightly golden in color.
Remove the baked cookies from the oven. Dust a serving platter with more confectioners' sugar and place a single layer of the still-warm cookies on top. Lightly spritz them with some water infused with a touch of rose water, if desired, and generously dust them with more confectioners' sugar. Add another layer of cookies and repeat the process until you have a full pyramid of cookies. *This is a traditional, yet optional, method of displaying the cookies.",11,"▢ 1 cup butter (unsalted, softened, at room temperature - 2 sticks, 16 tablespoons, or 8 ounces per batch)",▢ ½ cup confectioners sugar (plus more for dusting),▢ 2 large egg yolks (at room temperature),▢ 1 tablespoon brandy,▢ 1 tablespoon rose water (see recipe),▢ 1 teaspoon vanilla extract,▢ ½ teaspoon almond extract,▢ ½ teaspoon baking powder,▢ ½ teaspoon salt,▢ 3 cups all-purpose flour (spooned and leveled),▢ 1¼ cups slivered almonds,NA,NA,NA,NA,Bake It With Love,https://bakeitwithlove.com/greek-almond-cookies-kourabiedes/,NA,NA,NA,NA,NA,NA,NA
Amaretti Cookies,Angela Latimer,5,7,Italian,Cookies & Bars,NA,10 minutes,20 minutes,NA,30 minutes,32 cookies,9,"Preheat the oven to 325°F (160°C) and line a baking sheet with parchment paper. 
In a large bowl, sift together the almond flour and sugar. Set aside.
Add your egg whites and a pinch of salt to a mixing bowl and use an electric mixer to beat the eggs until stiff peaks form.
Use a silicone spatula to gently fold in the almond extract and vanilla extract into the egg whites. Then do the same with the first ⅓ of the almond flour mixture. 
Gently fold in another ⅓ portion of the flour until well combined. Lastly, sift the remaining flour into the mixture and fold until a thick dough has formed. 
Use a cookie scoop to scoop out the dough and then roll it in your hands until it forms a ball. Roll the ball in a shallow bowl of granulated sugar and then roll it again in a bowl of powdered sugar. Make sure the cookie is generously coated. 
Place the coated dough balls onto the prepared cookie sheet, leaving about 2 inches of space between them for spreading, and lightly press them with your hands to flatten them slightly.
Bake in the oven at 325°F (160°C) for 20-25 minutes or until the tops have only slightly turned golden.
Remove from the oven and cool for 5 minutes before transferring to wire racks to finish cooling. ",8,▢ 4½ cups almond flour,▢ 1½ cups sugar,▢ 5 large egg whites (at room temperature),▢ 1 pinch salt,▢ 1½ teaspoon almond extract,▢ ½ teaspoon vanilla extract,▢ ½ cup sugar,▢ ½ cup confectioners sugar,NA,NA,NA,NA,NA,NA,NA,Bake It With Love,https://bakeitwithlove.com/amaretti-cookies/,NA,NA,NA,NA,NA,NA,NA
Bunny Butt Cookies,Angela Latimer,5,6,American,Cookies & Bars,NA,20 minutes,6 minutes,NA,26 minutes,24 cookies,11,"Use an electric mixer to cream together the sugar and room-temperature butter. Then, add the eggs, pure vanilla extract, baking powder, and salt, and mix well. 
Add the all-purpose flour and mix just until the flour has been well incorporated into the dough. Transfer the bowl to the fridge and allow it to chill for one hour (or you can wrap the dough in plastic wrap and chill it for up to 3 days). 
Preheat your oven to 375°F (190°C) and line your baking sheet(s) with parchment paper.
Once the dough has chilled, work with small portions of the dough on a floured surface. Use a rolling pin to roll the sugar cookie dough out until it is between ¼ and ½-inch thick. Then, use round cookie cutters to cut the dough into your desired rounds.
Place the cutout cookies onto the prepared baking sheet and bake at 375°F (190°C) for 6-9 minutes.
Remove your sugar cookies from the oven before the edges begin to turn golden. Let them cool on the baking sheet for 5 minutes and then move them to a cooling rack. Let them cool completely before frosting.
Pour your sanding sugar onto separate plates or shallow bowls.
Spread a thin layer of vanilla frosting over top of each of the cooled sugar cookies. Then, gently press the cookies with the frosting side facing down into the sanding sugar. 
Cut your larger marshmallows in half for the bunny feet. Decorate them to look like feet on the non-sticky side using either pink frosting, sprinkles, or pink candy. 
Add a dot of frosting to the sticky side of the marshmallow and press them onto the cookie. Then, add a dot of frosting to a mini marshmallow and press it into the center of the cookie to act as a tail. 
Serve immediately or store for later. ",12,"▢ ¾ cup butter (unsalted, softened, at room temperature)",▢ 1 cup sugar,▢ 2 large eggs (at room temperature),▢ 1 teaspoon vanilla extract (or extract flavor of your choice),▢ 1 teaspoon baking powder,▢ 1 teaspoon salt,▢ 2½ cups all-purpose flour (spooned and leveled),▢ sanding sugar (in various colors),▢ 16 oz vanilla buttercream frosting (or use store-bought),▢ 24 marshmallows (cut in half),▢ 24 mini marshmallows,"▢ assorted pink sprinkles (or pink mini marshmallows, pink candy, or pink icing gel)",NA,NA,NA,Bake It With Love,https://bakeitwithlove.com/bunny-butt-cookies/,NA,NA,NA,NA,NA,NA,NA
Best Store Bought Brownie Mixes To Buy,Angela Latimer,5,2,American,Tips Tricks and Information,NA,10 minutes,50 minutes,NA,NA,35 servings,7,"Preheat your oven to 325ºF (160°C) and spray a 9x13 baking pan or dish with non-stick cooking spray.
In a large mixing bowl, whisk together the brownie mix and espresso powder (if using).
Next, add the eggs, water, melted butter, and vanilla extract. Stir just until everything is combined.
(Optional) Fold in any of your desired mix-ins.
Pour the brownie batter into your prepared 9x13 baking pan and use a spatula to spread it out evenly.
Bake at  325ºF (160°C) for 50 minutes. Test your brownies by inserting a toothpick in the center, it should come out clean.
Remove your brownies from the oven and let them cool for 15-20 minutes before slicing.",10,▢ 3 boxes Ghirardelli brownie mix (19-20 ounces),"▢ 3 teaspoon espresso powder (optional, for an extra-rich chocolate flavor)",▢ 3 large eggs,▢ ¾ cup water,▢ 1 ½ cups butter (melted),▢ 3 teaspoon vanilla extract,"▢ ¼ cup chocolate chips (or chocolate chunks, or chopped baking chocolate)","▢ ¼ cup nuts (chopped walnuts, macadamia nuts, almonds, pistachios, peanuts)",▢ ¼ cup M&Ms candies (or your favorite chocolate candies),▢ ¼ cup mini marshmallows,NA,NA,NA,NA,NA,Bake It With Love,https://bakeitwithlove.com/best-store-bought-brownie-mixes-to-buy/,NA,NA,NA,NA,NA,NA,NA
Mexican Wedding Cookies,Angela Latimer,5,9,Mexican,Cookies & Bars,NA,5 minutes,15 minutes,5 minutes,25 minutes,36 cookies,7,"Preheat your oven to 350°F (175°C) and line a baking sheet with parchment paper or a nonstick cooking mat. 
Use your stand mixer or a medium-sized mixing bowl to cream together the butter and confectioners' sugar until light and fluffy. Then, mix in the vanilla and almond extract as well as the salt. 
Gradually add the sifted all-purpose flour to the creamed ingredients, mixing until combined in between each addition.  
Add the chopped walnuts or pecans and use a silicone spatula to fold them into the dough. *If your dough seems very soft, you can place the whole bowl into the fridge for 15-30 minutes to chill it. 
Use your hands to roll the dough into balls that are about 1¼ inches in size then place them on the prepared baking sheet, leaving about 2 inches in between each cookie. 
Bake at 350°F (175°C) for 15 to 20 minutes, or until they have just begun turning a light golden color. Remove the cookies from the oven and let them cool slightly until you can handle them with your hands.
Roll the still-warm cookies in confectioners' sugar until fully coated and then transfer them to a wire rack to finish cooling. ",7,▢ 1 cup butter (room temperature),▢ ½ cup confectioners sugar (plus more for rolling),▢ 1 teaspoon vanilla extract,▢ 1 teaspoon almond extract,▢ ¼ teaspoon salt,"▢ 2 cups all-purpose flour (spooned and leveled, sifted)","▢ ¾ cup walnuts (finely chopped, or pecans)",NA,NA,NA,NA,NA,NA,NA,NA,Bake It With Love,https://bakeitwithlove.com/mexican-wedding-cookies/,NA,NA,NA,NA,NA,NA,NA
How To Freeze Sugar Cookies,Angela Latimer,5,3,American,How To,NA,10 minutes,6 minutes,NA,16 minutes,36 cookies (3 dozen),6,"In a large mixing bowl (or the bowl of your stand mixer), cream together the butter and sugar. Add the eggs, vanilla extract, baking powder, and salt and combine thoroughly.
Add the flour and stir until all of the flour has been incorporated into your sugar cookie dough. If you are going to roll your cookies out soon, you can place the bowl in the refrigerator to chill for at least one hour. 
If it is going to be a while (up to 3 days) before you will be rolling out your dough, wrap the dough in cling film to refrigerate and chill.
Preheat your oven to 375°F (190°C) and line your baking sheet(s) with parchment paper.
After your dough has chilled, work with small portions of the dough on a floured surface. Roll out until ¼-inch to ½-inch thick and cut into desired shapes. Transfer to a parchment paper lined baking sheet and bake for 6-9 minutes at 375°F (190°C).
Remove your cookies from the oven before getting golden around the bottom edges. Allow them to remain on the baking sheet for 5-6 minutes before transferring to a wire cooling rack to cool completely.",7,▢ ¾ cup butter (1 ½ sticks at room temperature),▢ 1 cup sugar,▢ 2 large eggs,▢ 1 teaspoon vanilla extract (or extract of your choice),▢ 1 teaspoon baking powder,▢ ½ teaspoon salt (use 1 teaspoon salt with unsalted butter),▢ 2 ½ cups all-purpose flour,NA,NA,NA,NA,NA,NA,NA,NA,Bake It With Love,https://bakeitwithlove.com/how-to-freeze-sugar-cookies/,NA,NA,NA,NA,NA,NA,NA
Sopapilla Cheesecake Bars,Angela Latimer,5,15,"American, Mexican, TexMex",Cookies & Bars,NA,10 minutes,30 minutes,NA,40 minutes,12 servings,8,"Preheat your oven to 350°F (175°C) and lightly grease a 9x13 baking dish with nonstick cooking spray. 
Using your stand mixer (or a hand mixer with a mixing bowl), beat the room-temperature cream cheese, 1 cup of sugar, and vanilla extract until creamy and smooth, about 3 minutes or so at medium speed.
Unroll both cans of crescent roll dough and spread them each into a 9x13 rectangle, pinching together the seams. Lay one sheet of dough into the prepared 9x13 baking dish.
Spread the cream cheese mixture evenly over the dough, smoothing out the top with a silicone spatula. Then, lay the second sheet of crescent roll dough over the top. 
In a small bowl, use a fork to smash together the room-temperature butter, cinnamon, and the remaining ¾ cup of sugar until it forms a thick paste. Then, drop small chunks of the butter mixture over the top of the dough, making sure to cover the entire surface. 
Bake in the oven at 350°F (175°C) for about 30 minutes, or until the crescent roll dough has puffed up and turned golden in color. 
Remove the cheesecake from the oven and drizzle with the optional honey, if desired. 
Allow the sopapilla cheesecake bars to cool completely before slicing and serving (at least 2 hours). *Alternatively, you can let the bars cool to room temperature and then chill them in the fridge overnight. ",7,▢ 16 oz cream cheese (room temperature),▢ 1¾ cup sugar (divided),▢ 2 teaspoon vanilla extract,▢ 16 oz refrigerated crescent roll dough (each can is 8 ounces),▢ ½ cup butter (room temperature),▢ 1 teaspoon ground cinnamon,"▢ ¼ cup honey (optional, for drizzling over top)",NA,NA,NA,NA,NA,NA,NA,NA,Bake It With Love,https://bakeitwithlove.com/sopapilla-cheesecake-bars/,NA,NA,NA,NA,NA,NA,NA
Rugelach,Angela Latimer,5,2,"Jewish, Polish",Cookies & Bars,NA,15 minutes,15 minutes,30 minutes,NA,48 cookies,12,"Using the paddle attachment, cream together the room-temperature butter and cream cheese in the bowl of your stand mixer until light and fluffy.
Add in the sugar, salt, and vanilla extract, and then mix until well combined. While the mixer is on the lowest speed, slowly add the all-purpose flour, only mixing until just combined (you don't want to over-mix the dough). 
Dump the dough out onto a well-floured work surface and roll it into a large ball. Cut the ball into 4 equal-sized balls and wrap each one tightly with plastic wrap. Place the wrapped balls of dough into the fridge for at least 1 hour to chill. 
In a medium-sized bowl, mix together your light brown sugar, sugar, ground cinnamon, raisins, and walnuts. Set the mixture aside until ready to use. *Alternatively, you could place all of the ingredients into a food processor and blend them to combine. 
Remove one portion of the dough from the fridge, unwrap it, and place it on your floured work surface (if needed, you can let it sit at room temperature for a few minutes to make it easier to roll). Use a rolling pin to roll the dough out into a 9-inch disk (about ⅛-inch thick). 
Sprinkle ½ cup of the prepared filling over top of the dough and use your fingers to lightly press it in. Use a sharp knife or pizza cutter to cut the dough into 12 equal-sized wedges (cutting it just like you would a pizza). 
Roll up each wedge, starting with the wide end and rolling towards the smaller point. Place the rolls onto a baking sheet lined with parchment paper with the points tucked underneath them. Place the sheet into the fridge to chill for an additional 30 minutes while you prepare the rest of the balls of dough.
Preheat your oven to 350°F (175°C). 
In a small bowl, lightly whisk together the egg and milk to make an egg wash. In a separate bowl, stir together the sugar and ground cinnamon. 
Brush each cookie with the egg wash mixture and then sprinkle on the cinnamon sugar.
Bake in the oven at 350°F (175°C) for 15-20 minutes, or until the outsides have lightly browned, rotating the pans halfway through baking.
Remove the rugelach from the oven and transfer them to a wire cooling rack to cool. ",15,▢ 8 oz cream cheese (room temperature),"▢ ½ lb butter (room temperature, unsalted)",▢ ¼ cup sugar,▢ 1 teaspoon vanilla extract,▢ ¼ teaspoon salt,▢ 2¼ cups all-purpose flour,▢ ¼ cup light brown sugar (packed),▢ 6 tablespoon sugar,▢ ½ teaspoon ground cinnamon,▢ ¾ cup raisins,▢ 1 cup walnuts (finely chopped),▢ 1 large egg (lightly beaten),▢ 1 tablespoon milk,▢ 1 teaspoon ground cinnamon,▢ 3 tablespoon sugar,Bake It With Love,https://bakeitwithlove.com/rugelach/,NA,NA,NA,NA,NA,NA,NA
Easter Basket Cookies,Angela Latimer,5,2,American,Cookies & Bars,NA,30 minutes,10 minutes,NA,40 minutes,30 Easter basket cookies,5,"Bake a half recipe of my double sugar cookies, as directed. Mix a half recipe of my vanilla buttercream frosting, as directed.
Color your coconut by dividing your desired portions per selected colors and placing each coconut portion into a ziploc plastic storage bag. I used three colors, so divided my coconut into three batches and placed each portion into one of three storage bags.
Add a drop of gel food coloring into each storage bag of coconut, seal the bag. Use your fingers to move the coconut around in the bag, distributing the coloring throughout the coconut. Allow the coconut to dry for a few minutes.
Once cookies are cooled, pipe or spread the buttercream frosting onto the cookies. I suggest piping a circle around the cookie edge to hold your coconut 'nest' in place.
Sprinkle coconut onto the frosted cookies then place 3 of each Cadbury shimmer mini milk chocolate eggs onto each cookie.",5,▢ ½ batch double sugar cookies (see recipe),▢ ½ batch vanilla buttercream (see recipe),▢ 4 cups shredded coconut (divided into 3-4 portions),▢ gel food coloring (3 or 4 desired pastel colors),▢ 1 9 oz bag Cadbury's shimmer mini chocolate eggs,NA,NA,NA,NA,NA,NA,NA,NA,NA,NA,Bake It With Love,https://bakeitwithlove.com/easter-basket-cookies/,NA,NA,NA,NA,NA,NA,NA
Red Velvet Crinkle Cookies,Angela Latimer,5,6,American,Cookies & Bars,NA,10 minutes,10 minutes,NA,20 minutes,24 cookies,10,"Get started by preheating your oven to 350°F (175°C) and line a baking sheet (or two) with parchment paper. 
Using your stand mixer or hand mixer, cream together the room-temperature butter, brown sugar, and white granulated sugar until fluffy and light. 
Add your eggs, one at a time, beating well in between each addition. Make sure to scrape down the sides and bottom of the mixing bowl so that everything is well distributed. 
Next, mix in the vanilla extract, red food coloring, baking powder, and salt until well combined. 
Add the flour and sifted cocoa powder to the bowl and mix until just combined, being careful not to overmix your cookie dough. 
Fill a small, shallow bowl with your granulated sugar and a separate bowl with the powdered sugar. 
Use your hands to roll the cookie dough into tablespoon-sized balls. Then, roll the ball in the granulated sugar followed by the powdered sugar before placing it onto the prepared baking sheet. 
Repeat with the remaining cookie dough, placing the balls about 1 inch apart on the baking sheet.
Bake at 350°F (175°C) for about 10 minutes, or until they have risen and cracked with a center that is still gooey. 
Remove the cookies from the oven and allow them to cool for a couple of minutes before moving them to a wire cooling rack",12,▢ ½ cup butter (room temperature),▢ ¾ cup light brown sugar (packed),▢ ½ cup sugar,▢ 2 large eggs (room temperature),▢ 2 teaspoon vanilla extract,▢ ½ teaspoon red food coloring (or more if needed),▢ 1½ teaspoon baking powder,▢ ½ teaspoon salt,▢ 2 cups all-purpose flour,▢ ⅓ cup unsweetened cocoa powder (sifted),▢ ½ cup granulated sugar,▢ ½ cup confectioners sugar,NA,NA,NA,Bake It With Love,https://bakeitwithlove.com/red-velvet-crinkle-cookies/,NA,NA,NA,NA,NA,NA,NA
No Bake Easter Peeps Nests,Angela Latimer,5,2,American,Easter,NA,15 minutes,0 minutes,NA,15 minutes,NA,3,"Start out with making your no bake cookies as usual, except when spooning the cookie mixture out onto your waxed paper use a heaping tablespoonful portion. Once all of your cookie mixture has been spooned out onto the waxed paper, use a teaspoon to push an indent into the center of the cookie.
Color your coconut by putting two one cup portions of the shredded coconut into ziploc baggies. Fill a small bowl or cup with 1 teaspoon of water and add the food coloring, mix thoroughly, then pour into the ziploc baggies. Seal the baggies up and work the coconut around in the bag to distribute the color. Spread colored coconut out onto a baking sheet and allow to dry.
Once the cookies are set and the coconut is dried, fill the wells of the cookies with the colored coconut. Place a Peep chick into the center of the cookie on top of the coconut, then place 4-5 mini jelly beans around the Peep chick on the coconut 'nest'. ",6,▢ 8 Chocolate No Bake Cookies (made with wells in the center),▢ 8 Peanut Butter Oatmeal No Bake Cookies (made with wells in the center),▢ 2 cups coconut (shredded),▢ food dye (one or two colors of your choice),▢ 16 Peeps chicks,▢ mini jelly beans (enough for 4-5 'eggs' per nest),NA,NA,NA,NA,NA,NA,NA,NA,NA,Bake It With Love,https://bakeitwithlove.com/no-bake-cookie-easter-peeps-nests/,NA,NA,NA,NA,NA,NA,NA
