title,author,dateinfo,rating,ratingnum,genre,cuisine,keyword,preptime,cooktime,customtime,totaltime,servings,numberofsteps,actualsteps,totalingredients,ingredient1,ingredient2,ingredient3,ingredient4,ingredient5,source,link,ingredient6,ingredient7,ingredient8,ingredient9,ingredient10,ingredient11,ingredient12,ingredient13,ingredient14,ingredient15,ingredient16,ingredient17,ingredient18,ingredient19,ingredient20,ingredient21,ingredient22,ingredient23,ingredient24,ingredient25,ingredient26,ingredient27,ingredient28
Tie-Dye Cookies (Butter Cookies),Becky Hardin,"Published Dec 21, 2021",4.75,4,Desserts,NA,NA,45 minutes,10 minutes,Chill Time: 30 minutes mins,25 minutes,24 cookies,13,"In the bowl of a stand mixer fitted with the paddle attachment, beat the butter and sugar together until light and fluffy, about 3 minutes.
1 cup unsalted butter, ⅔ cup granulated sugar
Add the egg, vanilla, and almond extract and beat at medium speed until well mixed.
1 large egg, 1 teaspoon pure vanilla extract, ¼ teaspoon almond extract
In a separate bowl, whisk together the flour and salt.
2¼ cups all-purpose flour, ¾ teaspoon kosher salt
Add the dry ingredients to the wet ingredients and mix on low speed just until all flour has been incorporated. Do not over-mix the cookie dough or the cookies will be tough.
Scrape around the sides and bottom of the bowl with a rubber spatula to ensure all flour has been incorporated.
Divide the dough into 3 equal portions and place each portion into a separate small bowl.
Color two portions of dough with food coloring and gently mix until the food coloring is incorporated.
Food coloring
Tightly cover each dough with plastic wrap and refrigerate for 30 minutes.
While the dough chills, preheat oven to 350°F. Line 2 baking sheets with parchment paper. Set aside. Pour sanding sugar into a small bowl (if using).
Coarse sanding sugar
Remove the chilled cookie dough from the refrigerator.
Begin forming the cookies by scooping about 1 teaspoon of each of the three colors of dough per cookie. Roll the colored dough together to form a cookie dough ball. Roll the ball of tie dyed dough into the sanding sugar. Place onto prepared baking sheet and slightly press the dough down – just until the top is flattened a little. Repeat, placing cookies 2 inches apart on the baking sheet, until all dough is used.
Bake for 8-10 minutes, or until edges are just set.
Let cookies cool for 1 minute on the baking sheet, then transfer to a cooling rack to completely cool.",9,"▢ 1 cup unsalted butter 226 grams, room temperature (2 sticks)",▢ ⅔ cup granulated sugar 133 grams,"▢ 1 large egg 50 grams, room temperature and lightly beaten",▢ 1 teaspoon pure vanilla extract 4 grams,▢ ¼ teaspoon almond extract 1 gram,Cookie Rookie,https://www.thecookierookie.com/tie-dye-cookies-butter-cookies/,▢ 2¼ cups all-purpose flour 270 grams,▢ ¾ teaspoon kosher salt,▢ Food coloring,"▢ Coarse sanding sugar optional, for topping",NA,NA,NA,NA,NA,NA,NA,NA,NA,NA,NA,NA,NA,NA,NA,NA,NA,NA,NA
Spritz Cookies,Becky Hardin,"Published Dec 16, 2021",4.78,9,Desserts,NA,NA,20 minutes,10 minutes,NA,30 minutes,60 cookies,8,"Preheat oven to 375°F. Set aside baking sheets. Do not use parchment paper – bake the cookies directly on the baking sheets.
In the bowl of a stand mixer fitted with the paddle attachment, beat the butter, sugar, and salt together until light and fluffy, about 3 minutes.
1 cup unsalted butter, ⅔ cup granulated sugar, 1 teaspoon kosher salt
Add the egg yolks, one at a time, mixing well after each addition.
3 large egg yolks
Add the vanilla and almond extracts, beating just until incorporated.
½ teaspoon pure vanilla extract, ½ teaspoon almond extract
Turn off the mixer and add the flour. With the mixer on low speed, fold in the flour just until all flour has been incorporated.
2½ cups all-purpose flour
Follow the directions for your cookie press to form the cookies onto the baking sheets. Decorate with sprinkles and sugars, if desired.
Sprinkles and sanding sugars
Bake for 8-10 minutes.
Transfer cookies to a wire rack to completely cool.",8,"▢ 1 cup unsalted butter 226 grams, room temperature (2 sticks)",▢ ⅔ cup granulated sugar 133 grams,▢ 1 teaspoon kosher salt 3 grams,"▢ 3 large egg yolks 42 grams, room temperature",▢ ½ teaspoon pure vanilla extract 2 grams,Cookie Rookie,https://www.thecookierookie.com/spritz-cookies/,▢ ½ teaspoon almond extract 2 grams,▢ 2½ cups all-purpose flour 300 grams,"▢ Sprinkles and sanding sugars optional, for decorating",NA,NA,NA,NA,NA,NA,NA,NA,NA,NA,NA,NA,NA,NA,NA,NA,NA,NA,NA,NA
Cranberry Orange Biscotti,Becky Hardin,"Published Dec 10, 2021",4.67,6,Baking,NA,NA,20 minutes,40 minutes,NA,NA,20 biscotti,10,"Preheat oven to 350°F and line a large baking sheet with parchment paper.
In the bowl of a stand mixer fitted with the paddle attachment, cream the butter and sugar together on medium-high speed until light and fluffy, about 1 minute.
4 tablespoons unsalted butter, ½ cup granulated sugar
Add the eggs and vanilla (and almond extract, if using) and mix until well combined. Make sure to scrape the sides of the bowl a few times so everything gets well mixed.
2 large eggs, 1 teaspoon pure vanilla extract, ¼ teaspoon almond extract
Add the flour, almond flour, and baking powder and mix just until no large lumps remain– make sure not to overmix!
1¼ cups all purpose flour, ¼ cup almond flour, 1 teaspoon baking powder
Add the orange zest and cranberries and gently fold them into the batter.
1 teaspoon orange zest, 1 cup dried cranberries
Transfer the batter to the baking sheet and pat it into an oval that is about 14 inches long, 3 inches wide, and ½-inch thick. It helps to wet your hands– this is a sticky batter!
Bake the biscotti for 20-22 minutes, or until it is golden brown around the edges.
Remove the biscotti from the oven and allow it to cool for 10 minutes.
Slice the biscotti into ½-inch slices and place them cut side up on the sheet pan. Bake for an additional 15-18 minutes, or until the biscotti are dry and golden brown.
Allow the biscotti to cool fully before transferring them to an airtight container.",10,"▢ 4 tablespoons unsalted butter 57 grams, room temperature (½ stick)",▢ ½ cup granulated sugar 100 grams,"▢ 2 large eggs 100 grams, room temperature",▢ 1 teaspoon pure vanilla extract 4 grams,"▢ ¼ teaspoon almond extract 1 gram, optional",Cookie Rookie,https://www.thecookierookie.com/cranberry-orange-biscotti/,▢ 1¼ cups all purpose flour 150 grams,▢ ¼ cup almond flour 24 grams,▢ 1 teaspoon baking powder 4 grams,▢ 1 teaspoon orange zest 2 grams,▢ 1 cup dried cranberries 170 grams,NA,NA,NA,NA,NA,NA,NA,NA,NA,NA,NA,NA,NA,NA,NA,NA,NA,NA
Splatter Paint Christmas Cookies,Becky Hardin,"Published Nov 28, 2021",4.15,7,Baking,NA,NA,NA,12 minutes,Dry Time: 20 hours hrs,12 minutes,36 2-inch cookies,23,"In the bowl of a stand mixer fitted with the paddle attachment, beat the butter and sugar together at medium speed until light and fluffy, about 3 minutes.
1 cup unsalted butter, ⅔ cup granulated sugar
Add the egg, vanilla, and almond extract and beat at medium speed until well incorporated, about 1 minute.
1 large egg, 1 teaspoon pure vanilla extract, ¼ teaspoon almond extract
In a separate bowl, whisk the flour, kosher salt, and coarse sea salt together.
2¼ cups all-purpose flour, ½ teaspoon kosher salt, ¼ teaspoon coarse sea salt
In one addition, add the dry ingredients to the wet ingredients and mix on low speed just until no flour is visible. Do not overbeat the dough or the cookies will be tough.
Scrape around the sides and bottom of the bowl with a rubber spatula to ensure all of the flour has been incorporated.
Divide the dough in half and place one half on a large piece of parchment paper. Roll out the dough to be ¼-inch thick, and transfer the dough with the parchment paper to a large sheet pan.
Roll out the other half of the dough and place the rolled dough (with the parchment paper) on top of the first half of rolled dough on the sheet pan.
Cover the dough with plastic wrap and refrigerate for at least 2 hours. (To freeze the cookie dough at this point, cover the rolled dough on the baking sheet with plastic wrap and foil. Freeze until ready to bake).
After the cookie dough has chilled, preheat the oven to 350°F. Line a baking sheet with parchment paper.
Cut the rolled and chilled cookie dough into desired shapes. Place onto the prepared baking sheet.
Bake for 10-12 minutes, or until the edges and bottoms are just beginning to darken.
Remove cookies from the oven and let cool for 1 minute on the baking sheet, then use a metal spatula to transfer cookies to a cooling rack. Repeat with remaining cookies. Allow cookies to fully cool before icing.
In a liquid measuring cup, whisk the corn syrup and water together.
¼ cup light corn syrup, ¼ cold water
In a large bowl, whisk the powdered sugar, 6 tablespoons of the corn syrup/water mixture, and the extract together (reserve the remaining corn syrup/water mixture to thin the icing, if needed).
4 cups powdered sugar, ¼ teaspoon pure vanilla extract
Mix in enough of the white food coloring to make white icing. Pour the white icing about an inch deep into a dish slightly larger than the size of a cookie.
Food coloring
Test the icing consistency by turning a cookie upside down and dipping it halfway top-down and flat into the icing. Let the icing drip off the top of the cookie, then quickly flip the cookie over and place on a wire rack. The icing should be thin enough for dipping but thick enough not to drip off the cookies. (If too thin, add a little more sugar; if too thick, add a little corn syrup/water mixture.)
Frost all the cookies with white icing and let them dry several hours or overnight.
Use a different food-safe paintbrush for each color.
When the cookies are completely dry, add several drops of one color of gel food coloring to a very small bowl. Add a tiny bit of water or vodka and mix well.
Extra water or vodka
Before splattering the cookies, test the food color consistency over a piece of paper or paper towel – it should splatter easily – not too watery or thick.
Splatter the ‘paint’ by dipping the paintbrush in the food coloring, hold it (brush side down) over what is being splattered, and use your other hand to tap your wrist. Alternately, this is very messy but works a little better, hold the brush (brush side down) over the cookie and flick the food coloring off of the brush and onto the cookie with the tip of a finger on the opposite hand.
Use a different paintbrush for each color and splatter one color until done with that color, then repeat with other colors until all cookies are decorated.
Let cookies dry overnight before serving.",14,▢ 1 cup unsalted butter 226 grams (2 sticks),▢ ⅔ cup granulated sugar 133 grams,"▢ 1 large egg 50 grams, lightly beaten",▢ 1 teaspoon pure vanilla extract 4 grams,▢ ¼ teaspoon almond extract 1 gram,Cookie Rookie,https://www.thecookierookie.com/splatter-paint-christmas-cookies/,▢ 2¼ cups all-purpose flour 270 grams,▢ ½ teaspoon kosher salt,▢ ¼ teaspoon coarse sea salt,"▢ ¼ cup light corn syrup 78 grams, divided","▢ ¼ cold water 57 grams, divided",▢ 4 cups powdered sugar 452 grams,▢ ¼ teaspoon pure vanilla extract 1 gram (or almond extract),"▢ Food coloring white, red, and green",▢ Extra water or vodka,NA,NA,NA,NA,NA,NA,NA,NA,NA,NA,NA,NA,NA,NA
Chocolate Butter Cookies,Becky Hardin,NA,4.61,109,Baking,NA,NA,30 minutes,10 minutes,Chill Time: 2 hours hrs,40 minutes,42 cookies,10,"In the bowl of a stand mixer fitted with the paddle attachment, cream the butter and both sugars together on medium-low speed until smooth, about 2 minutes. Add eggs and vanilla and mix until incorporated, about 1 minute.
1¼ cups unsalted butter, 1 cup granulated sugar, 1 cup brown sugar, 2 large eggs, 1 tbsp pure vanilla extract
In a medium bowl, whisk the cocoa, flour, baking soda, espresso powder, and both salts together.
¾ cup unsweetened cocoa powder, 2 cups all-purpose flour, 1¼ tsp baking soda, 1½ tsp espresso powder, 1 tsp kosher salt, ¾ tsp coarse sea salt
Add the dry ingredients to the wet ingredients and mix on low speed until no dry flour can be seen.
Cover a clean work surface with plastic wrap. Roll half of the dough (it will be somewhat sticky) into a log about 10-12 inches long and 2 inches in diameter. Use the plastic wrap to help form the log. Repeat with the other half of the dough.
Refrigerate the cookie dough for at least 2 hours.
When ready to bake, set oven rack to middle position and preheat oven to 350°F. Line 3 baking sheets with parchment paper.
Slice the dough logs into ½ inch thick rounds and place onto prepared baking sheets, 3 inches apart.
Liberally sprinkle each dough circle with nonpareils (if desired), pressing lightly to make sure the sprinkles adhere to the dough.
colorful nonpareils sprinkles
Bake for 10 minutes, or until cookies are just set around the edges.
Transfer cookies to a wire rack to completely cool.",12,"▢ 1¼ cups unsalted butter 283g, room temperature (2½ sticks)",▢ 1 cup granulated sugar 200g,▢ 1 cup brown sugar 213g,"▢ 2 large eggs 100g, room temperature",▢ 1 tbsp pure vanilla extract 12g,Cookie Rookie,https://www.thecookierookie.com/chocolate-butter-cookies/,▢ ¾ cup unsweetened cocoa powder 63g,▢ 2 cups all-purpose flour 240g,▢ 1¼ tsp baking soda 8g,▢ 1½ tsp espresso powder 4g,▢ 1 tsp kosher salt 3g,▢ ¾ tsp coarse sea salt,"▢ colorful nonpareils sprinkles optional, for topping",NA,NA,NA,NA,NA,NA,NA,NA,NA,NA,NA,NA,NA,NA,NA,NA
Carrot Cake Sandwich Cookies,Becky Hardin,"Published Nov 21, 2021",4.20,10,Baking,NA,NA,45 minutes,15 minutes,Chill Time: 30 minutes mins,30 minutes,24 sandwich cookies,16,"Process the oats in a food processor by pulsing 3-5 times. The oats should still have pieces that are approximately ½ the size of original oats (not fully ground); set aside.
1 cup old-fashioned oats
Grate the carrots and place the grated carrots on 3-4 layers of paper towels. Top the carrots with more paper towels and tightly roll up the carrots, squeezing as you roll to remove as much moisture as possible; set aside.
3 cups grated carrots
In the bowl of a stand mixer fitted with the paddle attachment, beat the butter, coconut oil, brown sugar, and granulated sugar together until light and fluffy, about 3 minutes at medium speed.
½ cup unsalted butter, ½ cup coconut oil, 1 cup brown sugar, ¾ cup granulated sugar
Add the salt and vanilla and beat another 2 minutes at medium speed until fully incorporated, smooth, and fluffy.
2 teaspoons kosher salt, 1½ teaspoons pure vanilla extract
On medium-low speed, add the eggs, one at a time, scraping down the bowl after adding each egg. Mix just until fully incorporated, about 30 seconds per egg.
2 large eggs
In a large bowl, sift the all-purpose flour, bread flour, baking soda, baking powder, cinnamon, apple pie spice, and ground ginger together. Add the flour mixture to the wet ingredients in one addition and mix on low speed until the flour is incorporated and no dry flour can be seen. (Don’t mix too long or too much gluten will form, making the cookies a little tough.)
1¾ cup all-purpose flour, ½ cup bread flour, 1 teaspoon baking soda, 1 teaspoon baking powder, 1½ teaspoons ground cinnamon, 1½ teaspoons apple pie spice, 1 teaspoon ground ginger
Add the oats, coconut, grated carrots, raisins, and pecans and mix on the lowest speed just until incorporated.
¾ cup sweetened shredded coconut, ¾ cup golden raisins, ¾ cup chopped roasted pecans
Cover the dough and refrigerate for 30 minutes before scooping and baking.
While the dough rests in the refrigerator, adjust the oven rack to the middle position, heat the oven to 350°F, and line 2 baking sheets with parchment.
When ready to bake, scoop cookie dough using a #40 scoop (a 2-tablespoon scoop) and place scoops of cookie dough 2 inches apart onto the lined cookie sheets.
Bake 12-15 minutes, rotating the cookie sheet halfway through baking. The cookies should be slightly darker in color with slightly firm edges and centers still slightly soft to the touch.
Let the cookies cool for 1 minute on the baking sheet, then use a spatula to transfer the cookies to a wire rack to completely cool.
While the cookies cool, make the frosting: In the bowl of a stand mixer fitted with the paddle attachment, cream the powdered sugar, cream cheese, and butter together for 3 minutes on medium speed, or until light and fluffy.
1¼ cup powdered sugar, 8 ounces cream cheese, 5 tablespoons unsalted butter
Add sour cream, vanilla extract, ground ginger, salt, lemon juice and zest, and orange juice. Beat on medium speed until smooth and fully incorporated, about 1 minute.
2 tablespoons sour cream, ½ teaspoon pure vanilla extract, ¼ teaspoon ground ginger, ½ lemon, ½ orange, ½ teaspoon kosher salt
The frosting can be used immediately. If making ahead, the frosting will keep refrigerated in an airtight container for up to 3 days. When ready to use, let the filling come to room temperature and fluff it up using an electric mixer with a paddle attachment at medium speed for 1 minute before using.
To assemble the cookies, spread about 1½ tablespoons of the cream cheese filling onto the flat side of 24 cookies and top with a second cookie (flat sides together). Slightly press the sandwich cookie together so both sides stick together.",28,"▢ ½ cup unsalted butter 113 grams, room temperature (1 stick)",▢ ½ cup coconut oil 114 grams,▢ 1 cup brown sugar 213 grams,▢ ¾ cup granulated sugar 150 grams,▢ 2 teaspoons kosher salt 6 grams,Cookie Rookie,https://www.thecookierookie.com/carrot-cake-sandwich-cookies/,▢ 1½ teaspoons pure vanilla extract 6 grams,"▢ 2 large eggs 50 grams, room temperature",▢ 1¾ cup all-purpose flour 210 grams,▢ ½ cup bread flour 60 grams,▢ 1 teaspoon baking soda 6 grams,▢ 1 teaspoon baking powder 4 grams,▢ 1½ teaspoons ground cinnamon 5 grams,▢ 1½ teaspoons apple pie spice 5 grams,▢ 1 teaspoon ground ginger 3 grams,"▢ 1 cup old-fashioned oats 100 grams, slightly ground",▢ ¾ cup sweetened shredded coconut 64 grams,"▢ 3 cups grated carrots 270 grams, from about 9 carrots(2 cups/180 grams yield after squeezing out water)",▢ ¾ cup golden raisins 128 grams,▢ ¾ cup chopped roasted pecans 86 grams,▢ 1¼ cup powdered sugar 141 grams,"▢ 8 ounces cream cheese 227 grams, room temperature (1 brick)","▢ 5 tablespoons unsalted butter 71 grams, room temperature","▢ 2 tablespoons sour cream 28 grams, room temperature",▢ ½ teaspoon pure vanilla extract 2 grams,▢ ¼ teaspoon ground ginger,▢ ½ teaspoon kosher salt,▢ ½ lemon juiced and zested,▢ ½ orange juiced
White Chocolate Macadamia Nut Cookies,Becky Hardin,"Published Nov 8, 2021",4.72,21,Baking,NA,NA,10 minutes,10 minutes,NA,20 minutes,18 cookies,8,"Preheat your oven to 350°F and line 2 large baking sheets with parchment paper. Set aside.
In the bowl of a stand mixer fitted with the paddle attachment, cream the butter and sugar together on medium speed until light and fluffy, about 2 minutes.
½ cup unsalted butter, 1 cup granulated sugar
Scrape down the sides of the bowl and add the egg and vanilla extract. Mix to combine.
1 large egg, 1 teaspoon pure vanilla extract
Add the flour and baking soda and mix just until all of the dry ingredients are incorporated. You don’t want to overmix!
1½ cups all-purpose flour, ¾ teaspoon baking soda
Add the white chocolate chips and macadamia nuts and fold them into the cookie dough gently.
½ cup white chocolate chips, ½ cup chopped macadamia nuts
Scoop the dough into 2-tablespoon-sized balls and place them at least 2 inches apart on the prepared baking sheets.
Bake for 10-12 minutes, or until the edges are starting to turn golden brown.
Allow the cookies to cool completely before serving.",8,"▢ ½ cup unsalted butter 113 grams, room temperature (1 stick)",▢ 1 cup granulated sugar 200 grams,"▢ 1 large egg 50 grams, room temperature",▢ 1 teaspoon pure vanilla extract 4 grams,▢ 1½ cups all-purpose flour 180 grams,Cookie Rookie,https://www.thecookierookie.com/white-chocolate-macadamia-nut-cookies/,▢ ¾ teaspoon baking soda 5 grams,▢ ½ cup white chocolate chips 85 grams,▢ ½ cup chopped macadamia nuts 80 grams,NA,NA,NA,NA,NA,NA,NA,NA,NA,NA,NA,NA,NA,NA,NA,NA,NA,NA,NA,NA
Nutella Stuffed Cookies,Becky Hardin,"Published Nov 7, 2021",4.62,31,Baking,NA,NA,30 minutes,10 minutes,Freeze: 20 minutes mins,NA,24 cookies,7,"Preheat oven to 350°F.
Spread a piece of parchment paper out on a large baking sheet. Using a ½-tablespoon measuring spoon, measure out heaping scoops of Nutella, and place them on the baking sheet. You should have 24 total scoops. Place the baking sheet in the freezer for at least 20 minutes, until the Nutella hardens.
1 cup Nutella
While the Nutella chills, in a large bowl, cream the butter and sugars together using a hand mixer. Beat in the egg and vanilla extract until incorporated.
½ cup unsalted butter, ½ cup brown sugar, ¼ cup granulated sugar, 1 large egg, 1 teaspoon pure vanilla extract
In a separate bowl, whisk together the flour, baking soda, and salt. Add the flour mixture to the wet ingredients, little by little, beating lightly after each addition. Stir the chopped dark chocolate into the batter.
2 cups all-purpose flour, ½ teaspoon baking soda, ½ teaspoon kosher salt, 3 ounces finely chopped dark chocolate
Remove the Nutella from the freezer. Use a cookie scoop to gather a portion of the dough in your hand. Make a small indentation in the ball of dough. Take a frozen dollop of Nutella and place it in the well of the cookie dough, and gently roll the dough between your hands to form a ball that completely covers the Nutella. Place back on the baking sheet. Repeat until the cookie dough is gone.
Place the cookie dough balls in the refrigerator for 5 minutes.
Bake for 10-12 minutes, then let cool on a wire rack.",10,▢ 1 cup Nutella 270 grams,"▢ ½ cup unsalted butter 113 grams, melted (1 stick)",▢ ½ cup brown sugar 107 grams,▢ ¼ cup granulated sugar 50 grams,"▢ 1 large egg 50 grams, room temperature",Cookie Rookie,https://www.thecookierookie.com/nutella-stuffed-cookies/,▢ 1 teaspoon pure vanilla extract 4 grams,▢ 2 cups all-purpose flour 240 grams,▢ ½ teaspoon baking soda 3 grams,▢ ½ teaspoon kosher salt,▢ 3 ounces finely chopped dark chocolate 85 grams (or chocolate chips),NA,NA,NA,NA,NA,NA,NA,NA,NA,NA,NA,NA,NA,NA,NA,NA,NA,NA
Pecan Sandies,Becky Hardin,"Published Nov 3, 2021",4.50,8,Baking,NA,NA,10 minutes,15 minutes,NA,25 minutes,24 cookies,7,"Preheat oven to 350°F. Line a baking sheet with parchment paper and set aside.
In a large mixing bowl, using a hand mixer, beat the butter, sugar, vanilla and milk together until smooth, about 2 minutes.
1 cup unsalted butter, ½ cup granulated sugar, 2 teaspoons pure vanilla extract, 1 tablespoon milk
Slowly add in half of the flour, beating until it is well combined. It will be a thick dough.
2 cups all-purpose flour
Add in the remaining half of the flour. Once the dough is well mixed and soft, stir in the chopped pecans.
¾ cup chopped pecans
Scoop or use a large spoon, measure dough and shape into balls, about 1 inch in size. Place on the prepared baking sheet. You can leave them as they are, or gently press them with the bottom of a lightly floured glass to flatten the tops. Bake for about 13-15 minutes, until the bottoms of the cookies are light golden brown.
Remove the cookies from the oven and allow them to cool slightly, then transfer to a wire rack to cool completely.. Once they have cooled, they will be slightly firm.
Fill a large Ziplock bag with powdered sugar and toss the cookies in the sugar until they are completely coated. Top with chopped pecans if desired.
¾ cup powdered sugar",7,"▢ 1 cup unsalted butter 227 grams (2 sticks), cold",▢ ½ cup granulated sugar 100 grams,▢ 2 teaspoons pure vanilla extract 8 grams,"▢ 1 tablespoon milk 14 grams, plus more if needed",▢ 2 cups all-purpose flour 240 grams,Cookie Rookie,https://www.thecookierookie.com/pecan-sandies/,▢ ¾ cup chopped pecans 86 grams,▢ ¾ cup powdered sugar 85 grams,NA,NA,NA,NA,NA,NA,NA,NA,NA,NA,NA,NA,NA,NA,NA,NA,NA,NA,NA,NA,NA
