title,author,dateinfo,rating,ratingnum,genre,cuisine,keyword,preptime,cooktime,customtime,totaltime,servings,numberofsteps,actualsteps,totalingredients,ingredient1,ingredient2,ingredient3,ingredient4,ingredient5,source,link,ingredient6,ingredient7,ingredient8,ingredient9,ingredient10,ingredient11,ingredient12,ingredient13,ingredient14,ingredient15,ingredient16,ingredient17,ingredient18,ingredient19,ingredient20,ingredient21,ingredient22,ingredient23,ingredient24,ingredient25,ingredient26,ingredient27,ingredient28
Buckeye Candy Recipe,Becky Hardin,"Published Dec 17, 2019",4.35,20,Cookies,NA,NA,30 minutes,NA,Chilling time: 1 hour hr,30 minutes,60 candies,6,"Line 2 baking sheets with parchment paper. Set aside.
In the bowl of a stand mixer fitted with the paddle attachment, cream the powdered sugar, peanut butter, butter, vanilla, and salt together until creamy and incorporated, about 2-3 minutes.
4 cups powdered sugar, 1½ cups creamy peanut butter, ½ cup salted butter, 1½ teaspoons pure vanilla extract, 1 teaspoon kosher salt
Shape the dough into 1-inch balls and refrigerate until firm, about 1 hour.
When the dough is completely chilled, microwave the chocolate chips and shortening (or oil), stirring every 15 seconds, on HIGH until most of the chips are melted. Remove from the microwave and stir until smooth and all chips are melted.
12 ounces semisweet chocolate chips, 1 tablespoon vegetable shortening
Insert a toothpick in the top-middle of a peanut butter ball and dip ⅔ of it in the melted chocolate. Let the excess chocolate drip into the bowl, and place the buckeye on the prepared baking sheet. Repeat with all peanut butter balls. (Note: If the chocolate begins to thicken, microwave for a few seconds until desired consistency.)
Refrigerate the Buckeyes in a covered container until firm before serving.",7,▢ 4 cups powdered sugar 452,"▢ 1½ cups creamy peanut butter 405 grams, Jif recommended","▢ ½ cup salted butter 113 grams, melted (1 stick)",▢ 1½ teaspoons pure vanilla extract 6 grams,▢ 1 teaspoon kosher salt 3 grams (use less if using salted peanut butter),Cookie Rookie,https://www.thecookierookie.com/buckeye-candy-recipe/,"▢ 12 ounces semisweet chocolate chips 340 grams (1 package), Ghirardelli recommended",▢ 1 tablespoon vegetable shortening 12 grams,NA,NA,NA,NA,NA,NA,NA,NA,NA,NA,NA,NA,NA,NA,NA,NA,NA,NA,NA,NA,NA
Mom’s Famous Snickerdoodle Cookies Recipe,Becky Hardin,"Published Dec 15, 2019",4.82,16,Cookies,NA,NA,20 minutes,12 minutes,NA,32 minutes,24 cookies,9,"Preheat oven to 375°F and line 3 baking sheets with parchment.
In a large bowl, whisk the flour, cream of tartar, baking soda, and salt together; set aside.
2¾ cups Bob's Red Mill Organic All-Purpose Flour, 2 teaspoons cream of tartar, 1 teaspoon Baking Soda, ½ teaspoon kosher salt
In the bowl of a stand mixer fitted with the paddle attachment, cream the shortening and butter together for 30 seconds. Add 1½ cups sugar and beat until lighter in color and fluffy, about 3 minutes.
½ cup vegetable shortening, ½ cup unsalted butter, 2½ cups granulated sugar
Beat in eggs, one at a time, just until incorporated.
2 large eggs
Add the flour mixture (all at once) to the creamed butter mixture and mix on low just until no flour is visible. Do not over work the dough or the cookies will be tough.
Set up a “work station” near the baking sheets with a bowl of cinnamon and the remaining 1 cup sugar and a bowl of iced water. Set a folded paper towel next to the water bowl.
¼ cup ground cinnamon, 2 cups iced water
Gently roll 2 tablespoons dough into a ball, dip the dough into the iced water and briefly place it on the paper towel (to absorb excess water). Roll the cookie dough ball in the cinnamon/sugar and set it on a baking sheet. Repeat with all the dough, spacing the balls 2-inches apart. There should be 8 cookies per sheet.
Bake the cookies, on the middle rack at 375°F for 10-12 minutes (rotating after 6 minutes). The cookies are done when the edges are just set and barely browning, and the centers are soft, cracked, and will look slightly undercooked.
Cool the cookies 5-8 minutes on the baking sheet then transfer to a cooling rack.",10,▢ 2¾ cups Bob's Red Mill Organic All-Purpose Flour 374 grams,▢ 2 teaspoons cream of tartar 7 grams,▢ 1 teaspoon Baking Soda 6 grams,▢ ½ teaspoon kosher salt,▢ ½ cup vegetable shortening 92 grams (½ stick),Cookie Rookie,https://www.thecookierookie.com/best-snickerdoodle-recipe/,"▢ ½ cup unsalted butter 113 grams, room temperature (1 stick)","▢ 2½ cups granulated sugar 500 grams, divided",▢ 2 large eggs 100 grams,▢ ¼ cup ground cinnamon 36 grams,▢ 2 cups iced water 454 grams,NA,NA,NA,NA,NA,NA,NA,NA,NA,NA,NA,NA,NA,NA,NA,NA,NA,NA
No Bake Cookies (Chocolate Peanut Butter),Becky Hardin,"Published Dec 10, 2019",4.63,35,Cookies,NA,NA,10 minutes,NA,Resting time: 30 minutes mins,10 minutes,30 cookies,6,"Line 2 large baking sheets with parchment paper; set aside.
Add the butter, sugar, milk, cocoa powder, and salt to a large saucepan and bring to a rolling boil. Boil for 1 minute, then remove from the heat.
½ cup unsalted butter, 2 cups granulated sugar, ½ cup milk, ¼ cup unsweetened cocoa powder, ⅛ teaspoon kosher salt
Stir in the peanut butter, vanilla, and cinnamon (if using); mix until incorporated.
½ cup creamy peanut butter, 2 teaspoons pure vanilla extract, ⅛ teaspoon ground cinnamon
Add the oats and mix will.
3 cups quick oats
Working quickly, drop by tablespoon onto the prepared baking sheets and let the cookies completely set/cool. If desired, flatten the mounds slightly with a spoon.
Store in an airtight container.",9,▢ ½ cup unsalted butter 113 grams (1 stick),▢ 2 cups granulated sugar 400 grams,"▢ ½ cup milk 114 grams, at least 2%",▢ ¼ cup unsweetened cocoa powder 21 grams,▢ ⅛ teaspoon kosher salt,Cookie Rookie,https://www.thecookierookie.com/best-no-bake-cookies/,▢ ½ cup creamy peanut butter 135 grams,▢ 2 teaspoons pure vanilla extract 8 grams,▢ ⅛ teaspoon ground cinnamon optional,▢ 3 cups quick oats 267 grams,NA,NA,NA,NA,NA,NA,NA,NA,NA,NA,NA,NA,NA,NA,NA,NA,NA,NA,NA
M&M Cookies Recipe,Becky Hardin,"Published Oct 25, 2019",4.49,75,Cookies,NA,NA,15 minutes,10 minutes,NA,25 minutes,30 cookies,27,"Heat oven to 350°F and adjust baking rack to middle position. Line 2-3 large baking sheets with parchment paper.
In the bowl of an electric mixer, add granulated sugar and brown sugar. Turn mixer to low and mix just to combine.
Add shortening and softened butter, turn mixer to medium and beat 3 minutes or until lighter in color and smooth.
Add vanilla and beat on medium 30 seconds.
Add eggs one-at-a-time, mixing just until incorporated after each addition. Turn off the mixer.
In a large mixing bowl, whisk together flour, baking soda, and coarse salt and kosher salt.
Add flour mixture to the sugar/butter mixture and turn mixer to low speed. Mix just until flour mixture is incorporated.
Fold in 1¾ cup M&M candies.
If time allows, cover, refrigerate and let the dough rest 1-24 hours. If time doesn’t allow, the cookies can be baked immediately and are still terrific without the rest time.
Drop the dough, using a 2” scoop (about 1½ tablespoons), onto the baking sheets about 2-inches apart (12 cookies to a baking sheet).
Press 3-4 additional candies into each cookie.
Bake cookies at 350°F for 9 minutes or just until the edges of the cookies start to set and are a little firmer to the touch.
Place baking sheets with cookies on a cooling rack for 2 minutes, then transfer cookies directly to the cooling rack.
Enjoy the best M&M Cookies!
Preheat oven to 350°F and adjust baking rack to middle position. Line 2-3 large baking sheets with parchment paper.
In the bowl of a stand mixer fitted with the paddle attachment, mix the granulated sugar and brown sugar together on low until just combined.
1 cup granulated sugar, 1 cup dark brown sugar
Add the shortening and butter, turn mixer to medium speed, and beat until lighter in color and smooth, about 3 minutes.
⅔ cup vegetable shortening, ⅔ cup unsalted butter
Add the vanilla and beat on medium speed for 30 seconds.
2 teaspoons pure vanilla extract
Add eggs one at a time, mixing just until incorporated after each addition. Turn off the mixer.
2 large eggs
In a large mixing bowl, whisk the flour, baking soda, coarse salt, and kosher salt together.
2¾ cup all-purpose flour, 1 teaspoon baking soda, ½ teaspoon coarse sea salt, ½ teaspoon kosher salt
Add the flour mixture to the sugar/butter mixture and turn the mixer to low speed. Mix just until flour mixture is incorporated.
Fold in 1¾ cup M&M candies.
2½ cups M&M's candies
If time allows, cover, refrigerate and let the dough rest 1-24 hours. If time doesn’t allow, the cookies can be baked immediately and are still terrific without the rest time.
Drop the dough, using a 2-inch cookie scoop (about 1½ tablespoons), onto the baking sheets about 2 inches apart (12 cookies to a baking sheet).
Press 3-4 additional candies into each cookie.
Bake cookies at 350°F for 9 minutes, or just until the edges of the cookies start to set and are a little firmer to the touch.
Place baking sheets with cookies on a cooling rack for 2 minutes, then transfer cookies directly to the cooling rack.",11,▢ 1 cup granulated sugar 200 grams,▢ 1 cup dark brown sugar 213 grams,▢ ⅔ cup vegetable shortening 123 grams (⅔ stick),"▢ ⅔ cup unsalted butter 151 grams, room temperature (1⅓ stick)",▢ 2 teaspoons pure vanilla extract 8 grams,Cookie Rookie,https://www.thecookierookie.com/best-mm-cookies-recipe/,"▢ 2 large eggs 100 grams, room temperature",▢ 2¾ cup all-purpose flour 330 grams,▢ 1 teaspoon baking soda 6 grams,▢ ½ teaspoon coarse sea salt (SEE NOTE),▢ ½ teaspoon kosher salt,"▢ 2½ cups M&M's candies 425 grams, divided",NA,NA,NA,NA,NA,NA,NA,NA,NA,NA,NA,NA,NA,NA,NA,NA,NA
Mom’s Peanut Butter Cookies Recipe,Becky Hardin,"Published Oct 7, 2019",4.71,24,Cookies,NA,NA,10 minutes,10 minutes,NA,20 minutes,24 cookies,27,"Heat oven to 350°F and line 2 large baking sheets with parchment paper. (If not using parchment, do NOT grease the baking sheets.)
In the bowl of an electric mixer, add butter and peanut butter. Beat on medium speed 2 minutes until completely incorporated.
Add the brown and granulated sugars and beat an additional 2-3 minutes or until smooth, creamy and paler in color.
Add the egg and vanilla and beat another 1 minute.
In another large mixing bowl, whisk together flour, ½ teaspoon baking soda, table salt, sea salt and cinnamon.
Add the flour mixture to the butter mixture and turn the mixer to low speed. Mix until the flour is almost incorporated. There should be just a little flour visible.
Remove the mixing bowl from the mixer and add the peanut butter chips, if using.
Stir the dough gently just until all flour is incorporated.
Use an 1.5” scoop to scoop balls onto the baking sheet 2-inches apart. (If you don’t have a cookie scoop – use about 1½ tablespoons of dough per cookie and roll the dough into balls.)
Lightly sprinkle the cookies with powdered sugar.
To put fork marks into the cookies, gently press the fork onto the cookie dough – being sure to crisscross the fork to get that traditional “peanut butter cookie” appearance.
Bake 9-10 minutes at 350°F or until the edges of the cookies are set.
Transfer the cookies to a cooling rack and…
Enjoy!
Preheat oven to 350°F and line 2 large baking sheets with parchment paper. (If not using parchment, do NOT grease the baking sheets.)
In the bowl of a stand mixer fitted with the paddle attachment, beat the butter and peanut butter together on medium speed until completely incorporated, about 2 minutes.
½ cup unsalted butter, ½ cup creamy peanut butter
Add the brown and granulated sugars and cream until smooth, creamy, and pale in color, about 2-3 minutes.
½ cup dark brown sugar, ½ cup granulated sugar
Add the egg and vanilla and beat another 1 minute.
1 large egg, 1 teaspoon pure vanilla extract
In another large mixing bowl, whisk the flour, baking soda, salt, and cinnamon together.
1¼ cups all-purpose flour, ½ teaspoon baking soda, ¾ teaspoon kosher salt, 1 teaspoon ground cinnamon
Add the flour mixture to the butter mixture and turn the mixer to low speed. Mix until the flour is almost incorporated. There should be just a little flour visible.
Remove the mixing bowl from the mixer and fold in the peanut butter chips, if using.
1 cup peanut butter baking chips
Stir the dough gently just until all flour is incorporated.
Use a 1½-inch cookie scoop to scoop balls onto the baking sheet 2 inches apart. (If you don’t have a cookie scoop – use about 1½ tablespoons of dough per cookie and roll the dough into balls.)
Lightly sprinkle the cookies with powdered sugar.
¼ cup powdered sugar
To put fork marks into the cookies, gently press the fork onto the cookie dough – being sure to crisscross the fork to get that traditional “peanut butter cookie” appearance.
Bake 9-10 minutes, or until the edges of the cookies are set.
Transfer the cookies to a cooling rack to cool to room temperature.",12,"▢ ½ cup unsalted butter 113 grams, room temperature (1 stick)",▢ ½ cup creamy peanut butter 135 grams,▢ ½ cup dark brown sugar 107 grams,▢ ½ cup granulated sugar 100 grams,"▢ 1 large egg 50 grams, room temperature and lightly beaten",Cookie Rookie,https://www.thecookierookie.com/peanut-butter-cookies-recipe/,▢ 1 teaspoon pure vanilla extract 4 grams,▢ 1¼ cups all-purpose flour 150 grams,▢ ½ teaspoon baking soda 3 grams,▢ ¾ teaspoon kosher salt,▢ 1 teaspoon ground cinnamon 3 grams,"▢ 1 cup peanut butter baking chips 170 grams, optional","▢ ¼ cup powdered sugar 28 grams, for topping",NA,NA,NA,NA,NA,NA,NA,NA,NA,NA,NA,NA,NA,NA,NA,NA
Candy Rice Krispie Treats (Loaded Rice Krispies),Becky Hardin,"Published Sep 23, 2019",4.80,10,Cookies,NA,NA,15 minutes,10 minutes,Cool: 1 hour hr,25 minutes,24 people,19,"Spray a 13×9-inch baking pan with nonstick cooking spray.
Make one aluminum foil sling by cutting one piece of foil 18-inches long and folding it 8-inches wide. Fit the foil into the length of the pan, pushing it against the sides and corners of the pan. The excess should hang over about 2-inches on the sides.
Cut another piece of foil 14-inches long ((if using extra large foil, fold it to a 12-inch width.) and fit it, perpendicular, over the first sheet. Again, the foil should have an excess of a couple of inches on each end.
Spray the foil pieces with nonstick cooking spray.
Spray a rubber spatula with non-stick cooking spray.
Cut the candy bars into 8 pieces each and combine all candy in a medium-size mixing bowl. Mix well.
Melt the butter in a large Dutch oven set over medium-low heat. Add marshmallows, vanilla and salt. Cook and stir with sprayed spatula (re-spraying as needed) about 3 minutes or until marshmallows are just melted.
Remove from the heat and stir in cereal and half of the candy mixture. Stir until the candy is fully incorporated.
Spray the spatula or spray your hands and pour the mixture into the prepared pan. Press the Rice Krispie/marshmallow mixture evenly into the pan. Top with the remaining candy and lightly press the candy into the cereal mixture.
Set the Rice Krispie Treats on a cooling rack and let sit for 1 hour to firm. After an hour, lift the Krispies by the foil sling and return to the cooling rack to cool completely. Cut into equal-sized 12-24 bars.
Spray a 9x13-inch baking pan with nonstick cooking spray.
Make one aluminum foil sling by cutting one piece of foil 18 inches long and folding it 8 inches wide. Fit the foil into the length of the pan, pushing it against the sides and corners of the pan. The excess should hang over about 2 inches on the sides.
Cut another piece of foil 14 inches long (if using extra-large foil, fold it to a 12-inch width) and fit it, perpendicular, over the first sheet. Again, the foil should have an excess of a couple of inches on each end.
Spray the foil pieces with nonstick cooking spray and spray a rubber spatula with nonstick cooking spray.
Combine all candy in a medium-size mixing bowl. Mix well.
10 mini Twix candy bars, 10 mini Snickers candy bars, ¾ cup mini M&M’s, ¾ cup mini Reese’s Peanut Butter Cups
Melt the butter in a large Dutch oven set over medium-low heat. Add marshmallows, vanilla, and salt. Cook and stir with the sprayed spatula (re-spraying as needed) until the marshmallows are just melted, about 3 minutes.
8 tablespoons unsalted butter, 20 ounces jumbo marshmallows, 2 teaspoons pure vanilla extract, ¼ teaspoon kosher salt
Remove from the heat and stir in cereal and half of the candy mixture. Stir until the candy is fully incorporated.
10 cups Rice Krispies cereal
Spray the spatula or spray your hands and pour the mixture into the prepared pan. Press the Rice Krispie/marshmallow mixture evenly into the pan. Top with the remaining candy and lightly press the candy into the cereal mixture.
Set the Krispie Treats on a cooling rack and let sit for 1 hour to firm. After an hour, lift the Krispies by the foil sling and return to the cooling rack to cool completely. Cut into 24 equal-sized bars.",9,"▢ 10 mini Twix candy bars 100 grams, chopped (about 1¼ cups)","▢ 10 mini Snickers candy bars 90 grams, chopped (about 1¼ cups)",▢ ¾ cup mini M&M’s 133 grams,"▢ ¾ cup mini Reese’s Peanut Butter Cups 104 grams, halved",▢ 8 tablespoons unsalted butter 113 grams (1 stick),Cookie Rookie,https://www.thecookierookie.com/candy-rice-crispy-treats-loaded-rice-crispies/,▢ 20 ounces jumbo marshmallows 567 grams (2 packages),▢ 2 teaspoons pure vanilla extract 8 grams,▢ ¼ teaspoon kosher salt,▢ 10 cups Rice Krispies cereal 283 grams (10 ounces),NA,NA,NA,NA,NA,NA,NA,NA,NA,NA,NA,NA,NA,NA,NA,NA,NA,NA,NA
Loaded Chocolate Chip Giant Cookies Recipe,Becky Hardin,"Published Sep 18, 2019",4.72,14,Cookies,NA,NA,20 minutes,16 minutes,NA,36 minutes,60 cookies,21,"Heat oven to 350°F and position the oven rack to the middle position. Line 2-3 large baking sheets with parchment paper.
In the bowl of a stand mixer, combine granulated sugar, brown sugars, butter and oil. Mix on medium speed 3 minutes. Scrape down the sides after each minute. Add egg and vanilla and beat another 1 minute. Again, scrape down the sides.
While the sugar mixture is mixing, whisk together flour, table salt, coarse salt and baking soda in a large bowl.
Turn off the mixer and add the flour mixture. Turn the mixer to low and mix just until no flour is visible. Do not over-mix or the cookies won’t be as tender.
Add the Rice Krispies, oats, coconut, chocolate chips and peanut butter chips. Mix just until incorporated.
At this point, the dough can be placed in an airtight container and refrigerated up to two days. If refrigerating, remove the dough from the fridge 1 hour prior to using.
When ready to bake, use a 2”-diameter scoop (2 tablespoon sizto scoop the batter for each cookie. Place 2”-3” apart on a baking sheet.
Add extra chocolate and peanut butter chips to the top of the cookies, if more baking chips are desired.
Bake 14-16 minutes, rotating the cookie sheet after 7 minutes.
Transfer the giant cookies to a cooling rack and repeat the baking process until all cookies are baked.
Enjoy!
Preheat oven to 350°F and position the oven rack in the middle position. Line 2-3 large baking sheets with parchment paper. Set aside.
In the bowl of a stand mixer fitted with the paddle attachment, beat the granulated sugar, brown sugars, butter, and oil together. on medium speed for 3 minutes. Scrape down the sides after each minute. Add the egg and vanilla and beat another 1 minute. Again, scrape down the sides.
1 cup granulated sugar, ½ cup light brown sugar, ½ cup dark brown sugar, 1 cup unsalted butter, 1 cup canola oil, 1 large egg, 1½ teaspoons pure vanilla extract
While the sugar mixture is mixing, whisk the flour, salt, and baking soda together in a large bowl.
3½ cups all-purpose flour, 1½ teaspoons kosher salt, 1 teaspoon baking soda
Turn off the mixer and add the flour mixture. Turn the mixer to low and mix just until no flour is visible. Do not over-mix or the cookies won’t be as tender.
Add the Rice Krispies, oats, coconut, and ¾ of the chocolate chips and peanut butter chips. Mix just until incorporated.
1 cup Rice Krispies cereal, 1 cup old-fashioned rolled oats, ½ cup sweetened shredded coconut, 12 ounces milk chocolate chips, 11.5 ounces semi-sweet chocolate chips, 10 ounces peanut butter baking chips
At this point, the dough can be placed in an airtight container and refrigerated up to 2 days. If refrigerating, remove the dough from the fridge 1 hour prior to using.
When ready to bake, use a 2-inch diameter scoop (2 tablespoon size) to scoop the batter for each cookie. Place 2-3 inches apart on a baking sheet.
Top cookies with the remaining ¼ chocolate and peanut butter chips.
Bake 14-16 minutes, rotating the cookie sheet after 7 minutes.
Transfer cookies to a cooling rack and repeat the baking process until all cookies are baked.",16,▢ 1 cup granulated sugar 200 grams,▢ ½ cup light brown sugar 107 grams,▢ ½ cup dark brown sugar 107 grams,"▢ 1 cup unsalted butter 226 grams, room temperature (2 sticks)",▢ 1 cup canola oil 200 grams,Cookie Rookie,https://www.thecookierookie.com/loaded-chocolate-chip-giant-cookies/,"▢ 1 large egg 50 grams, lightly beaten",▢ 1½ teaspoons pure vanilla extract 6 grams,▢ 3½ cups all-purpose flour 420 grams,▢ 1½ teaspoons kosher salt 5 grams,▢ 1 teaspoon baking soda 6 grams,▢ 1 cup Rice Krispies cereal 28 grams,▢ 1 cup old-fashioned rolled oats 100 grams,▢ ½ cup sweetened shredded coconut 43 grams,"▢ 12 ounces milk chocolate chips 340 grams, divided (1 package), Ghirardelli recommended","▢ 11.5 ounces semi-sweet chocolate chips 326 grams, divided (1 package), Ghirardelli recommended","▢ 10 ounces peanut butter baking chips 283 grams, divided (1 package)",NA,NA,NA,NA,NA,NA,NA,NA,NA,NA,NA,NA
Edible Peanut Butter Cookie Dough Recipe,Becky Hardin,NA,4.56,56,Cookies,NA,NA,5 minutes,NA,NA,5 minutes,6 people,7,"In a microwave-safe bowl, heat the flour in the microwave on high for 30 seconds. Stir and repeat at 15-second intervals until the internal temperature is 160°F (see note).
¾ cup all-purpose flour
Add the cinnamon and whisk until incorporated. Set the flour aside to completely cool.
¼ teaspoon ground cinnamon
In a large mixing bowl, using a hand mixer, cream the peanut butter and butter together until incorporated, about 2 minutes.
¼ cup unsalted butter, ¼ cup creamy peanut butter
Add the sugar and brown sugar and beat for 3 minutes.
¼ cup granulated sugar, ¼ cup dark brown sugar
Add the salt, vanilla, and milk. Mix until fully incorporated.
¼ teaspoon kosher salt, 1 teaspoon pure vanilla extract, 1½ tablespoons milk
Add the cooled flour/cinnamon mixture and mix just until the flour is incorporated.
Add the peanut butter chips and stir just until incorporated.
(Optional) Roll the dough into 1-inch balls for an easy on-the-go snack.
½ cup peanut butter baking chips",10,▢ ¾ cup all-purpose flour 90 grams,▢ ¼ teaspoon ground cinnamon,▢ ¼ cup creamy peanut butter 68 grams,"▢ ¼ cup unsalted butter 57 grams, room temperature (½ stick)",▢ ¼ cup granulated sugar 50 grams,Cookie Rookie,https://www.thecookierookie.com/edible-peanut-butter-cookie-dough-recipe/,▢ ¼ cup dark brown sugar 53 grams,▢ ¼ teaspoon kosher salt 3 grams,▢ 1 teaspoon pure vanilla extract 4 grams,▢ 1½ tablespoons milk 21 grams,▢ ½ cup peanut butter baking chips 85 grams,NA,NA,NA,NA,NA,NA,NA,NA,NA,NA,NA,NA,NA,NA,NA,NA,NA,NA
