title,author,dateinfo,rating,ratingnum,genre,cuisine,keyword,preptime,cooktime,customtime,totaltime,servings,numberofsteps,actualsteps,totalingredients,ingredient1,ingredient2,ingredient3,ingredient4,ingredient5,source,link,ingredient6,ingredient7,ingredient8,ingredient9,ingredient10,ingredient11,ingredient12,ingredient13,ingredient14,ingredient15,ingredient16,ingredient17,ingredient18,ingredient19,ingredient20,ingredient21,ingredient22,ingredient23,ingredient24,ingredient25,ingredient26,ingredient27,ingredient28
M&M Christmas Cookies,Becky Hardin,"Published Dec 9, 2023",4.43,14,Desserts,NA,NA,15 minutes,14 minutes,Chill Time: 1 hour hr,29 minutes,NA,11,"In a small mixing bowl, combine the flour, baking soda, cornstarch, and salt with a whisk. Set aside.
2⅓ cups all-purpose flour, 1 teaspoon baking soda, 1½ teaspoons cornstarch, ½ teaspoon kosher salt
In a medium mixing bowl with a hand mixer, beat the butter, brown sugar, and granulated sugar.
¾ cup unsalted butter, ¾ cup light brown sugar, ½ cup granulated sugar
Add the eggs and vanilla. Mix until combined.
2 large eggs, 2 teaspoons pure vanilla extract
Add the dry mixture, and mix with a large spoon or rubber spatula until completely combined.
Fold in the chocolate chips and M&M's.
½ cup semisweet chocolate chips, 10 tablespoons red and green M&M's
Cover and chill for at least 1 hour to prevent the cookies from spreading.
Preheat oven to 325°F and line a large baking sheet with parchment paper.
Use a cookie scoop to measure 3 tablespoons of dough. Roll into a smooth ball. Place 6 on each baking sheet.
Bake for 12-14 minutes, or until the edges begin to brown.
While the cookies are still warm, press in the remaining M&M's in (just for looks).
Allow the cookies to cool for 10 minutes before transferring to a wire cooling rack.",11,▢ 2⅓ cups all-purpose flour 280 grams,▢ 1 teaspoon baking soda 6 grams,▢ 1½ teaspoons cornstarch 5 grams,▢ ½ teaspoon kosher salt,"▢ ¾ cup unsalted butter 170 grams, melted (1½ sticks)",Cookie Rookie,https://www.thecookierookie.com/mm-christmas-cookies/,▢ ¾ cup light brown sugar 160 grams,▢ ½ cup granulated sugar 100 grams,"▢ 2 large eggs 100 grams, room temperature",▢ 2 teaspoons pure vanilla extract 8 grams,▢ ½ cup semisweet chocolate chips 85 grams,"▢ 10 tablespoons red and green M&M's 106 grams, divided (½ cup + 2 tablespoons for topping)",NA,NA,NA,NA,NA,NA,NA,NA,NA,NA,NA,NA,NA,NA,NA,NA,NA
Snowball Cookies (Nutella Stuffed),Becky Hardin,"Published Dec 8, 2023",4.57,23,Desserts,NA,NA,30 minutes,12 minutes,Chill Time: 1 hour hr,42 minutes,24 cookies,11,"Line 2 baking sheets with parchment paper.
Spray another baking sheet with nonstick spray. Divide the Nutella into ½-teaspoon-sized balls and place the balls on the sprayed baking sheet. Be sure they aren’t touching. Freeze for at least 30 minutes.
¼-½ cup Nutella
Chop the pecans in a food processor until fine. Don’t process too much or the nuts will turn oily. Set aside. (If a food processor isn’t available, place the pecans in a resealable bag and roll or pound until the nuts are finely chopped.)
¾ cup very finely chopped or ground pecans
In the bowl of a stand mixer, beat the butter and ½ cup powdered sugar on medium-high speed until the mixture is light. Add in the vanilla extract, salt, and ground pecans.
8½ tablespoons unsalted butter, 1½ cups powdered sugar, ½ teaspoon pure vanilla extract, ¼ teaspoon kosher salt
Add the flour and mix on low speed until the flour has been incorporated. Roll the dough onto a clean work surface and knead gently for 30 seconds. Form the dough into a ball, cover loosely with plastic wrap, press gently to flatten into a disc, and place in the refrigerator for 30 minutes to firm up.
1¼ cups all-purpose flour
Preheat oven to 375°F.
Remove the Nutella balls and cookie dough from the fridge. (If the Nutella balls start to soften, place them in the freezer for a few minutes.) Pinch off a 2-inch piece of the dough and divide it in half. Slightly flatten one half in the palm of your hand and place a Nutella ball in the middle of the dough. Top it with the other dough half and wrap the 2 sides together around the Nutella ball. Gently roll the cookie in your hands to seal the edges and to form a ball. Place the cookie ball on a parchment-lined cookie sheet, 2 inches apart, and repeat until all cookies are made.
Place the trays of cookies in the refrigerator for 30 minutes.
After 30 minutes, place the cookies in the hot oven and bake 14-16 minutes or until they are light golden brown and firm to the touch. Remove from the oven and let rest 3 minutes on the baking sheet.
Place ½ cup powdered sugar in a bowl and roll the warm cookies, one-at-a-time, in the sugar. Return them to the still-hot baking sheet to cool another 5 minutes. Roll the cookies with a second coating of powdered sugar. Allow to completely dry.
If a third coat of powdered sugar is desired, place powdered sugar in a small wire sieve and sprinkle it over the cookies.",7,▢ ¼-½ cup Nutella 68-135 grams,▢ ¾ cup very finely chopped or ground pecans 63 grams,"▢ 8½ tablespoons unsalted butter 120 grams, room temperature and cubed","▢ 1½ cups powdered sugar 170 grams, divided into ½ cup (57 grams) and 1 cup (113 grams) portions",▢ ½ teaspoon pure vanilla extract 2 grams,Cookie Rookie,https://www.thecookierookie.com/nutella-stuffed-snowball-cookies/,▢ ¼ teaspoon kosher salt,▢ 1¼ cups all-purpose flour 150 grams,NA,NA,NA,NA,NA,NA,NA,NA,NA,NA,NA,NA,NA,NA,NA,NA,NA,NA,NA,NA,NA
Ginger Cookies,Becky Hardin,"Published Dec 5, 2023",5,2,Desserts,NA,NA,15 minutes,15 minutes,NA,30 minutes,16 cookies,13,"Preheat oven to 350°F. Line a baking sheet with parchment paper. Set aside.
Combine the flour, baking soda, spices, and salt in a medium bowl; set aside.
2 cups all-purpose flour, 1 teaspoon baking soda, ½ teaspoon kosher salt, ½ teaspoon ground cinnamon, ½ teaspoon apple pie spice, 1 teaspoon ground ginger, ½ teaspoon ground cloves
In another medium-sized bowl, use a hand mixer to beat the shortening for 30 seconds.
¾ cup vegetable shortening
Add the sugar and beat until fully blended, about 2 minutes.
1 cup granulated sugar
Add the molasses and egg. Beat until combined 1-2 minutes.
2 tablespoons unsulphured molasses, 1 large egg
Add the dry ingredients all at once.
Beat on low speed just until dry ingredients are moist.
Shape into 1½-inch balls.
Dip each ball into cold water and shake off excess water.
Roll the wet ball in sugar. (For a lighter coating of sugar, don’t dip in the water first).
Place dough balls 3 inches apart on a parchment paper-covered cookie sheet.
Bake for 11-14 minutes. (The cookie should be just a little underbaked when you take them out of the oven.)
Remove immediately from the cookie tray and place on cooling racks.",11,▢ 2 cups all-purpose flour 240 grams,▢ 1 teaspoon baking soda 6 grams,▢ ½ teaspoon ground cinnamon,▢ ½ teaspoon apple pie spice store-bought or homemade,▢ 1 teaspoon ground ginger 3 grams,Cookie Rookie,https://www.thecookierookie.com/ginger-doozie-cookies/,▢ ½ teaspoon ground cloves,▢ ½ teaspoon kosher salt,▢ ¾ cup vegetable shortening 138 grams (¾ stick) – SEE NOTE,"▢ 1 cup granulated sugar 200 grams, plus more for dipping",▢ 2 tablespoons unsulphured molasses 43 grams,▢ 1 large egg 50 grams,NA,NA,NA,NA,NA,NA,NA,NA,NA,NA,NA,NA,NA,NA,NA,NA,NA
Royal Icing Recipe,Laurel Perry,"Published Dec 3, 2023",4.84,6,Desserts,NA,NA,20 minutes,0 minutes,NA,20 minutes,NA,6,"Add the powdered sugar and meringue powder to the bowl of a stand mixer fitted with the whisk attachment. Whisk to combine.
4 cups powdered sugar, 4 tablespoons meringue powder
Pour in 8 tablespoons of warm water and the vanilla extract, and mix on medium-low speed until combined.
8-10 tablespoons warm water, 1 teaspoon pure vanilla extract
Turn the mixer up to medium-high and mix until soft peaks form, about 1-2 minutes.
Slowly add more water 1 teaspoon at a time until your desired consistency is achieved. To create an icing that works well for outlining and flooding cookies, lift up the whisk and let the icing drip back into the bowl. It should take 10-15 seconds to smooth out. If it is smoothing out too quickly, beat the icing for another minute. If it is taking longer to smooth out, add a little more water.
Divide the icing into small bowls and add gel food color, making as many colors as you would like.
Gel food coloring
Fit piping bags with a Wilton #3 or #4 tip. Fill the bags with icing and decorate your cookies as desired.",5,▢ 4 cups powdered sugar 452 grams,▢ 4 tablespoons meringue powder 43 grams,▢ 8-10 tablespoons warm water 114-142 grams,▢ 1 teaspoon pure vanilla extract 4 grams,▢ Gel food coloring optional,Cookie Rookie,https://www.thecookierookie.com/royal-icing-recipe/,NA,NA,NA,NA,NA,NA,NA,NA,NA,NA,NA,NA,NA,NA,NA,NA,NA,NA,NA,NA,NA,NA,NA
Pignoli Cookies (Pine Nut Cookies),Becky Hardin,NA,4.75,84,Desserts,NA,NA,15 minutes,10 minutes,Cool Time: 10 minutes mins,35 minutes,16 cookies,8,"Preheat oven to 350°F. Line a baking sheet with parchment paper or spray it with nonstick cooking spray. Set aside.
To the bowl of a food processor, add the almond paste, sugar, powdered sugar, egg white, and salt. Blend until smooth. (The dough should be thick and tacky but not runny).
7 oz. almond paste, ⅓ cup granulated sugar, ¼ cup powdered sugar, 1 large egg white, ¼ tsp kosher salt
Place the pine nuts in a medium bowl.
4 oz. pine nuts
Scoop about 1 tbsp of dough per cookie and form into 1-inch balls. Roll each cookie dough ball into the pine nuts, coating the top and sides.
Place cookie dough balls about 1-2 inches apart onto the prepared baking sheet.
Bake for 10-12 minutes, or until they just start to turn a golden brown. Don’t overbake, or you’ll get a tough center.
Let cookies cool and firm up on the baking sheet for at least 10 minutes.
Dust with powdered sugar and serve.",7,"▢ 7 oz. almond paste 198g, cut into pieces (1 standard package)*",▢ ⅓ cup granulated sugar 67g,"▢ ¼ cup powdered sugar 28g, plus more for serving",▢ 1 large egg white 35g,▢ ¼ tsp kosher salt,Cookie Rookie,https://www.thecookierookie.com/pignoli-cookies/,▢ 4 oz. pine nuts 113g,"▢ powdered sugar optional, for dusting",NA,NA,NA,NA,NA,NA,NA,NA,NA,NA,NA,NA,NA,NA,NA,NA,NA,NA,NA,NA,NA
Christmas Bark,Becky Hardin,NA,4.61,38,Desserts,NA,NA,10 minutes,NA,Cool Time: 1 hour hr,10 minutes,16 pieces,6,"Cover a large baking sheet with wax paper (I recommend wax paper, but parchment sprayed with nonstick spray will work in a pinch).
Spread the broken cookies, pretzels, peppermint chips, and about ¾ of the M&M's onto the baking sheet.
7 red holiday Oreos, 7 cool mint Oreos, 1½ cups stick pretzels, ½ cup mint M&M's, ½ cup peanut M&M's, ½ cup peppermint baking chips
Place the white chocolate in a microwave-safe container and microwave for 1½ minutes on medium power. Stir and then microwave for another minute until melted and smooth. Watch it carefully to make sure it doesn't burn.
1 lb. white chocolate baking bars
Pour the melted chocolate over the cookie/candy mixture, spreading with a spatula if needed to coat completely.
Sprinkle the rest of the M&M's and red and green sprinkles over the still-wet chocolate. This won't work if it has hardened.
2 tbsp red and green sprinkles
Chill the tray of bark until set and firm, about 1 hour. Remove and gently break the bark into small pieces.",8,"▢ 7 red holiday Oreos 79g, broken into pieces, any variety works","▢ 7 cool mint Oreos 79g, broken into pieces",▢ 1½ cups stick pretzels 60g,"▢ ½ cup peppermint baking chips 85g, recommend using the Andes baking chips","▢ ½ cup mint M&M's 85g, divided, any variety works",Cookie Rookie,https://www.thecookierookie.com/christmas-bark/,"▢ ½ cup peanut M&M's 85g, divided","▢ 1 lb. white chocolate baking bars 454g, Ghirardelli recommended",▢ 2 tbsp red and green sprinkles 24g,NA,NA,NA,NA,NA,NA,NA,NA,NA,NA,NA,NA,NA,NA,NA,NA,NA,NA,NA,NA
Molasses Cookies,Becky Hardin,NA,4.85,20,Desserts,NA,NA,10 minutes,10 minutes,NA,20 minutes,24 cookies,9,"Preheat oven to 350°F. Line a baking sheet with parchment paper. Set aside.
Using a hand mixer, beat the melted shortening, sugar, and molasses together in a large bowl for 3 minutes.
1½ cups vegetable shortening, 2 cups granulated sugar, ¼ cup unsulphured molasses
Add the eggs and beat until well blended, about 2 minutes.
2 large eggs
Combine the dry ingredients in a medium bowl.
4 cups all-purpose flour, 4 tsp baking soda, 1 tsp kosher salt, 1 tsp ground cloves, 1 tsp ground ginger, 2 tsp ground cinnamon
Add the dry ingredients to the shortening/sugar mixture and beat until thoroughly blended.
Let the cookie dough stand for 5-10 minutes.
Roll into balls, then roll the balls in sugar (optional, my family prefers these without the sugar on top).
Place onto parchment-covered cookie sheets 3 inches apart and bake for 10-11 minutes, or until firm around the edges but not completely set.
Place cookies on a cooling rack to cool completely.",10,"▢ 1½ cups vegetable shortening 276g, melted (1½ sticks)","▢ 2 cups granulated sugar 400g, plus more for rolling",▢ ¼ cup unsulphured molasses 85g,"▢ 2 large eggs 100g, slightly beaten",▢ 4 cups all-purpose flour 480g,Cookie Rookie,https://www.thecookierookie.com/molasses-cookies/,▢ 4 tsp baking soda 24g,▢ 1 tsp kosher salt 3g,▢ 1 tsp ground cloves 3g,▢ 1 tsp ground ginger 3g,▢ 2 tsp ground cinnamon 6g,NA,NA,NA,NA,NA,NA,NA,NA,NA,NA,NA,NA,NA,NA,NA,NA,NA,NA
Cake Mix Cookies,Becky Hardin,NA,4.59,193,Desserts,NA,NA,10 minutes,10 minutes,NA,20 minutes,NA,5,"In a large mixing bowl, combine dry cake mix, eggs, and oil.
15.25 ounces cake mix, 2 large eggs, ½ cup vegetable oil
If using any mix-ins (like chocolate chips), fold them into the batter.
optional mix-ins
Scoop the dough into balls and drop onto a baking sheet lined with parchment paper.
Bake cookies at 350°F for 8-12 minutes.
Let the cookies cool on the pan for at least 5 minutes before eating or transferring to a cooling rack.",4,"▢ 15.25 ounces cake mix 432 grams, any flavor (1 box)",▢ 2 large eggs 100 grams,"▢ ½ cup vegetable oil 100 grams, or substitute the same amount of melted butter","▢ optional mix-ins chocolate chips, candies, nuts, etc.",NA,Cookie Rookie,https://www.thecookierookie.com/cake-mix-cookies/,NA,NA,NA,NA,NA,NA,NA,NA,NA,NA,NA,NA,NA,NA,NA,NA,NA,NA,NA,NA,NA,NA,NA
Meat Temperature Chart (Free Printable),Becky Hardin,"Published Nov 29, 2022",4.61,23,Desserts,NA,NA,20 minutes,15 minutes,NA,35 minutes,NA,9,"Trim excess fat from the steak (but leave a little bit for flavor)
Let the steak sit at room temperature for at least 20 minutes before cooking
Prepare the grill and heat up about 30 minutes before cooking
Pat away extra moisture from the steak, and then season to your liking
Sear steaks until they lift without sticking to the grates
Turn your steaks over once and continue cooking
Use meat thermometer to check internal temperatures. A medium-rare steak should heat to about 140 F. Medium will be closer to 155 F and Well Done should be at a temperature of 165 F.
Remove the steaks from the grill when the thermometer reads about 5 degrees lower than you want it (the meat will continue cooking after removed from the grill).
Let the steaks cool briefly before serving",1,▢ 4 steaks,NA,NA,NA,NA,Cookie Rookie,https://www.thecookierookie.com/meat-temperature-chart/,NA,NA,NA,NA,NA,NA,NA,NA,NA,NA,NA,NA,NA,NA,NA,NA,NA,NA,NA,NA,NA,NA,NA
White Chocolate Cranberry Cookies,Becky Hardin,"Published Nov 9, 2023",4.50,2,Cookies,NA,NA,15 minutes,10 minutes,NA,25 minutes,24 cookies,6,"Preheat oven to 375°F and line 2 large baking sheets with parchment paper or grease lightly with nonstick spray.
In a large mixing bowl, use a hand mixer to beat the Snickerdoodle cookie mix, large egg, softened butter, and sour cream together for 2-3 minutes, or until thoroughly combined.
17.9 ounces Snickerdoodle cookie mix, 1 large egg, ½ cup salted butter, 3 tablespoons sour cream
Fold in the white chocolate chips and dried cranberries until evenly distributed.
¾ cup white chocolate chips, ¾ cup dried cranberries
Using a 1½-inch cookie scoop, scoop out dough and form into even balls. Place them on the prepared baking sheets with 1 inch between each cookie.
Bake for 8-13 minutes or until the edges get golden brown. Do not overbake.
Remove from the oven and cool for 5 minutes before removing to a cooling rack or serving warm.",6,"▢ 17.9 ounces Snickerdoodle cookie mix 507 grams, cinnamon sugar packet removed (1 bag)",▢ 1 large egg 50 grams,"▢ ½ cup salted butter 226 grams, room temperature (1 stick)",▢ 3 tablespoons sour cream 43 grams,▢ ¾ cup white chocolate chips 128 grams,Cookie Rookie,https://www.thecookierookie.com/white-chocolate-cranberry-cookies/,▢ ¾ cup dried cranberries 86 grams,NA,NA,NA,NA,NA,NA,NA,NA,NA,NA,NA,NA,NA,NA,NA,NA,NA,NA,NA,NA,NA,NA
Fudge Brownie Pie,Becky Hardin,"Published Sep 30, 2023",4.70,46,Cookies,NA,NA,15 minutes,35 minutes,NA,50 minutes,10 slices,10,"Preheat oven to 325°F. Set the blind-baked pie crust aside to cool.
1 9-inch refrigerated pie crust
Melt ⅔ cup of the chocolate chips and butter in a microwave-safe bowl and heat at 50% power, stirring often, for about 90 seconds, or until the chocolate is almost melted.
1 cup semisweet chocolate chips, 4 tablespoons unsalted butter
Add the oil and cocoa powder and whisk until smooth.
¼ cup vegetable oil, 2 tablespoons unsweetened cocoa powder
In a separate bowl, whisk the sugar, eggs, vanilla, and salt together until creamy and smooth.
¾ cup dark brown sugar, 2 large eggs, 1 tablespoon pure vanilla extract, 1½ teaspoons kosher salt
Add the chocolate mixture and whisk until incorporated.
Add the flour and the remaining ⅓ cup of chocolate chips. Stir just until no dry flour remains.
¼ cup all-purpose flour
Spread the pecans over the bottom of the pie crust and pour the batter evenly over the pecans. Use a rubber spatula to spread out the batter, if necessary.
1¼ cups chopped honey roasted pecans
Bake for 30-35 minutes, or until a toothpick inserted in the center comes out with just a thin coating of batter attached.
Transfer pie to a cooling rack and cool 1-2 hours, until just warm.
Serve with a scoop of ice cream and a drizzle of chocolate syrup.",11,"▢ 1 9-inch refrigerated pie crust 213 grams, blind-baked per package directions","▢ 1 cup semisweet chocolate chips 170 grams, divided (Ghirardelli recommended)",▢ 4 tablespoons unsalted butter 57 grams (½ stick),▢ ¼ cup vegetable oil 50 grams,▢ 2 tablespoons unsweetened cocoa powder 11 grams,Cookie Rookie,https://www.thecookierookie.com/fudge-brownie-pie-recipe/,▢ ¾ cup dark brown sugar 160 grams,▢ 2 large eggs 100 grams,▢ 1 tablespoon pure vanilla extract 12 grams,▢ 1½ teaspoons kosher salt 5 grams,▢ ¼ cup all-purpose flour 30 grams,"▢ 1¼ cups chopped honey roasted pecans 143 grams, toasted",NA,NA,NA,NA,NA,NA,NA,NA,NA,NA,NA,NA,NA,NA,NA,NA,NA
Pumpkin Cookies,Becky Hardin,NA,4.88,8,Cookies,NA,NA,20 minutes,11 minutes,NA,31 minutes,36 cookies,10,"Preheat oven to 350°F. Line a baking sheet with parchment paper and set aside.
Using a hand mixer, cream the butter and sugars together in a large bowl.
¾ cup unsalted butter, 1 cup granulated sugar, ½ cup brown sugar
Beat in the pumpkin puree, egg, and vanilla extract. Set aside.
1 cup pumpkin puree, 1 large egg, 1 teaspoon pure vanilla extract
In a separate bowl, combine the flour, baking powder, baking soda, pumpkin pie spice, and salt.
2½ cups all-purpose flour, 1 teaspoon baking powder, 1 teaspoon baking soda, 1 tablespoon pumpkin pie spice, ½ teaspoon kosher salt
Add the dry ingredients to the wet ingredients, and stir until just combined.
Drop heaping tablespoonfuls of cookie dough onto the baking sheet at least 1 inch apart.
Bake the cookies for 11-13 minutes. Let the cookies cool.
While the cookies cool, prepare the frosting: Use a hand mixer to beat the cream cheese, butter, powdered sugar, vanilla extract, and salt together until smooth.
8 ounces cream cheese, ¼ cup butter, 2½ cups powdered sugar, 1 teaspoon pure vanilla extract, ⅛ teaspoon kosher salt
Once the cookies have cooled, frost the cookies.
Sift a sprinkling of cinnamon on top of the cookies if desired.
Ground cinnamon",17,"▢ ¾ cup unsalted butter 170 grams, room temperature (1½ sticks)",▢ 1 cup granulated sugar 200 grams,▢ ½ cup brown sugar 107 grams,▢ 1 cup pumpkin puree 227 grams (about ½ can) – not pumpkin pie filling!,"▢ 1 large egg 50 grams, room temperature",Cookie Rookie,https://www.thecookierookie.com/pumpkin-cookies/,▢ 1 teaspoon pure vanilla extract 4 grams,▢ 2½ cups all-purpose flour 300 grams,▢ 1 teaspoon baking powder 4 grams,▢ 1 teaspoon baking soda 6 grams,▢ 1 tablespoon pumpkin pie spice 9 grams,▢ ½ teaspoon kosher salt,"▢ 8 ounces cream cheese 227 grams, room temperature (1 brick)","▢ ¼ cup butter 57 grams, room temperature (½ stick)",▢ 2½ cups powdered sugar 283 grams,▢ 1 teaspoon pure vanilla extract 4 grams,▢ ⅛ teaspoon kosher salt,"▢ Ground cinnamon optional, for sprinkling",NA,NA,NA,NA,NA,NA,NA,NA,NA,NA,NA
Frosted Sugar Cookie Bars,Becky Hardin,"Published Sep 13, 2023",4.34,6,Cookies,NA,NA,20 minutes,20 minutes,NA,40 minutes,24 bars,11,"Preheat oven to 350°F. Line a 9×13-inch baking pan with parchment paper. Set aside for now.
Cream the butter and sugars together using an electric hand mixer.
1 cup unsalted butter, ¾ cup granulated sugar, ½ cup brown sugar
Mix in the vanilla and almond extracts, eggs, baking soda, and salt.
1 teaspoon pure vanilla extract, ¼ teaspoon almond extract, 2 large eggs, ½ teaspoon baking soda, ½ teaspoon kosher salt
Add in the flour, little by little, beating lightly until incorporated.
2½ cups all-purpose flour
Press the dough into the pan.
Bake for 18-20 minutes until the edges are golden brown. Allow to cool.
To make the frosting, beat the butter and powdered sugar together.
¼ cup unsalted butter, 1½ cups powdered sugar
Add in the milk and vanilla extract and beat again until smooth.
2 tablespoons milk, 1 teaspoon pure vanilla extract
Once the bars have cooled, gently lift up the parchment paper and bars from the pan and lay on a flat surface.
Spread the frosting over the bars. Then, top with sprinkles.
Sprinkles
Cut into 24 squares.",14,"▢ 1 cup unsalted butter 226 grams, room temperature (2 sticks)",▢ ¾ cup granulated sugar 150 grams,▢ ½ cup brown sugar 107 grams,▢ 1 teaspoon pure vanilla extract 4 grams,▢ ¼ teaspoon almond extract 1 gram,Cookie Rookie,https://www.thecookierookie.com/frosted-sugar-cookie-bars/,"▢ 2 large eggs 100 grams, room temperature",▢ ½ teaspoon baking soda 3 grams,▢ ½ teaspoon kosher salt,▢ 2½ cups all-purpose flour 300 grams,"▢ ¼ cup unsalted butter 57 grams, melted (½ stick)",▢ 1½ cups powdered sugar 170 grams,▢ 2 tablespoons milk 28 grams,▢ 1 teaspoon pure vanilla extract 4 grams,"▢ Sprinkles optional, for topping",NA,NA,NA,NA,NA,NA,NA,NA,NA,NA,NA,NA,NA,NA
Gluten Free Chocolate Chip Cookies (Soft and Chewy!),Becky Hardin,"Published Jun 13, 2023",4.68,25,Cookies,NA,NA,10 minutes,10 minutes,NA,20 minutes,12 cookies,7,"Preheat oven to 350°F. Line a baking sheet with parchment paper and set aside.
In the bowl of a stand mixer fitted with the beater attachment, beat the butter and sugars until creamy, about 2 minutes.
8 tablespoons salted butter, ½ cup granulated sugar, ¼ cup dark brown sugar
Add the vanilla and egg and beat on low for 15 seconds. It's important not to overbeat the egg so that your cookies stay soft.
1 large egg, 1 teaspoon pure vanilla extract
Add the flour, corn starch, baking soda, and salt. Mix until it becomes crumbly (this is crumblier than a normal dough.)
1½ cups Gluten Free Flour, ½ teaspoon Bob’s Red Mill Corn Starch, ½ teaspoon Baking Soda, ¼ teaspoon coarse kosher salt
Add in the chocolate chips and beat until just combined. Use your hands to bring the dough together and form a large ball.
1 cup milk chocolate chips
Make 1½-inch balls with the dough and place them on the baking sheet, spaced out quite a bit to allow for spreading.
Bake for 10-11 minutes and remove from the oven. Trust me on the time; you do not want to overbake. They'll look puffy and just barely browned on the edges. Allow to rest on the hot baking sheet for at least 15 minutes and they will flatten a bit and be just perfect!",10,"▢ 8 tablespoons salted butter 113 grams, melted (1 stick)",▢ ½ cup granulated sugar 100 grams,▢ ¼ cup dark brown sugar 53 grams,"▢ 1 large egg 50 grams, room temperature",▢ 1 teaspoon pure vanilla extract 4 grams,Cookie Rookie,https://www.thecookierookie.com/gluten-free-chocolate-chip-cookies-recipe/,▢ 1½ cups Gluten Free Flour 222 grams,▢ ½ teaspoon Bob’s Red Mill Corn Starch,▢ ½ teaspoon Baking Soda 3 grams,▢ ¼ teaspoon coarse kosher salt,▢ 1 cup milk chocolate chips 170 grams,NA,NA,NA,NA,NA,NA,NA,NA,NA,NA,NA,NA,NA,NA,NA,NA,NA,NA
