title,author,rating,ratingnum,course,cuisine,preptime,cooktime,customtime,totaltime,servings,numberofsteps,actualsteps,totalingredients,ingredient1,ingredient2,ingredient3,ingredient4,ingredient5,ingredient6,ingredient7,ingredient8,ingredient9,ingredient10,ingredient11,source,link,ingredient12,ingredient13,ingredient14,ingredient15,ingredient16,ingredient17,ingredient18,ingredient19,ingredient20,ingredient21,ingredient22,ingredient23,ingredient24
Snickerdoodles,Mia Kouppa,5, 3 ,Dessert,American,Prep Time: 10 minutes minutes,Cook Time: 15 minutes minutes,NA,Total Time: 25 minutes minutes,40 cookies,9,"Preheat oven to 350 °F
In the bowl of your stand mixer combine the butter and sugars.  Beat well until light and fluffy, approximately 5 minutes.
Add the eggs and the vanilla extract.  Beat again for 3 - 5 minutes, scraping down the sides occasionally using a rubber spatula.
Meanwhile, in a medium size bowl whisk together the dry ingredients.
Add the dry ingredients to the wet ingredients and with the mixer speed set to medium, mix until just combined.
In a small bowl combined the ingredients for the topping.
Using a mini ice cream scooper, or a tablespoon form balls with the dough; you should make approximately 40 balls of cookie dough.  Roll them into the cinnamon sugar mixture.
Place balls on a parchment lined cookie sheet.  Bake in middle of the oven for 10 - 13 minutes, or until the bottoms are lightly browned.
Allow to cool on baking tray for a few minutes before transferring to a cooling rack. Enjoy!",12,"1 cup unsalted butter, softened",1 cup white granulated sugar,"½ cup light brown sugar, packed",2 eggs,2 tsp vanilla extract,2½ cups all-purpose flour,1½ tsp cream of tartar,1 tsp baking soda,½ tsp cinnamon,¼ tsp salt,⅓ cup white granulated sugar,Mia Kouppa,https://miakouppa.com/snickerdoodles/,2½ tsp cinnamon,NA,NA,NA,NA,NA,NA,NA,NA,NA,NA,NA,NA
Peanut butter date bars,Mia Kouppa,5, 6 ,"Dessert, Snack",American,Prep Time: 30 minutes minutes,NA,Freezing time: 2 hours hours,Total Time: 2 hours hours 30 minutes minutes,12 servings,7,"In the bowl of your stand mixer mix together the almond flour, cinnamon and salt with a fork.  Once combined add the rest of the ingredients for the peanut butter layer and mix well using the paddle attachment of your mixer.
Prepare your baking tray by lining it with parchment paper allowing for there to be parchment paper hanging over on both long sides.  Transfer the peanut butter layer to the baking pan and press it down evenly so that the entire surface of the pan is covered and it is uniformly distributed.  We like to do this by laying a piece of plastic wrap over the peanut butter layer and pressing down on that and then smoothing it out.
Cover with plastic wrap or parchment paper and then transfer to freezer for approximately 30 minutes.  Meanwhile, prepare the date layer.
Place all of ingredients for your date layer into the pitcher of your high speed blender or your food processor and blend until smooth.  This may take a bit of time and you will need to pat the ingredients down intermittently to ensure that everything is getting blended or processed. 
Once your date layer is a smooth consistency, remove the pan from the freezer, uncover the peanut butter layer and spread the date layer evenly and smoothly on top of it.
Cover with plastic wrap or parchment paper and return to freezer until frozen.
Once frozen, use a knife to help release your peanut butter and date layers and use a large knife to cut our your portions.  Return to the baking pan and keep in freezer until ready to enjoy.",13,2½ cups almond flour,1 tsp cinnamon,½ tsp salt,⅔ cup all - natural peanut butter creamy or chunky,¼ cup melted coconut oil,¼ cup maple syrup,50 grams chocolate chunks we use 100% cacao (or dark chocolate chips),1½ cups chopped walnuts,2 tbsp cocoa powder,¼ tsp salt,"10 Medjool dates, pitted",Mia Kouppa,https://miakouppa.com/recipe-peanut-butter-date-bars/,2 tbsp water,"1 tbsp coconut oil, melted",NA,NA,NA,NA,NA,NA,NA,NA,NA,NA,NA
Tahini honey cookies,Mia Kouppa,4.94, 15 ,Dessert,Greek,Prep Time: 15 minutes minutes,Cook Time: 8 minutes minutes,NA,Total Time: 23 minutes minutes,14 cookies,8,"Preheat oven to 350 degrees Fahrenheit
In a medium size bowl whisk together the almond flour, baking soda, cinnamon, nutmeg and salt.  Set aside.
In the bowl of your stand mixer fitted with the paddle attachment blend together the honey and tahini until well combined.
Slowly add in the dry ingredients and mix well to combine.  Add up to 2 tablespoons of water if you find that the batter is crumbly.  Your dough should be moist enough to shape into balls.
Place your sesame seeds in a shallow bowl. Using a mini-scooper or a tablespoon, make balls of dough and roll them in the sesame seeds to coat them all around.
Transfer the cookie dough to a parchment lined baking sheet and use a glass to press down to turn the balls into discs approximately ¼ inch thick.
Bake in the middle rack of your oven for about 8-10 minutes or until golden brown.  Allow your cookies to cool on the cookie tray for 3 - 5 minutes before transferring them to a cooling rack.
Enjoy!",9,1½ cups almond flour,½ tsp baking soda,½ tsp cinnamon,¼ tsp nutmeg,¼ tsp salt,⅓ cup honey,⅓ cup tahini,2 tbsp water if needed,½ cup sesame seeds,NA,NA,Mia Kouppa,https://miakouppa.com/recipe-tahini-honey-cookies/,NA,NA,NA,NA,NA,NA,NA,NA,NA,NA,NA,NA,NA
Oatmeal raisin cookies,Mia Kouppa,5, 10 ,Dessert,American,Prep Time: 20 minutes minutes,Cook Time: 12 minutes minutes,NA,NA,40 cookies,10,"Preheat your oven to 350 degrees Fahrenheit.
In a medium size bowl combine your raisins with your boiled water. Ensure that your raisins are submerged.  Add more boiling water if required.  Set aside.
In the bowl of your stand mixer combine the melted butter, eggs, brown sugar and maple syrup.  Beat using your paddle attachment for 8 - 10 minutes. 
Meanwhile, in a medium size bowl combine the oats, oat flour, gluten-free flour, cinnamon, nutmeg, salt, and baking soda.  Mix until well combined.
With your mixer speed set to low slowly add in your dry ingredients.  Mix until just combined.  Add in your vanilla extract and mix.
Drain your raisins and pat them dry with paper towels to dry them out as much as possible.  Add your raisins to the batter and mix until just combined. 
Line your baking tray with parchment paper and shape your cookies.  Place your cookies on the baking tray, leaving about 1 inch between cookies on the tray.  We like to use a mini ice-cream scooper.  If you don't have a mini ice-cream scoop, use a tablespoon. Each cookie should be approximately 30 grams each.  Do not flatten your cookies.
Bake in the middle rack of your oven for approximately 12 minutes or until golden brown on bottom.  
Allow cookies to cool on the baking tray for 2 - 3 minutes before transferring them to a cooking rack.
Enjoy! ",14,1 ½ cups (225 grams) raisins,2 cups (500 mL) boiling water,¾ cup (180 grams) melted unsalted butter,1 cup (200 grams) brown sugar we use dark brown sugar,2 large eggs,2 tbsp (30 mL) maple syrup,3 cups (300 grams) large flake oats,½ cup oat flour,"1 ½ cups flour, gluten-free you can also use regular all purpose flour",2 tsp cinnamon,½ tsp ground nutmeg,Mia Kouppa,https://miakouppa.com/recipe-oatmeal-raisin-cookies/,1 tsp baking soda,1 tsp salt,1 tsp vanilla extract,NA,NA,NA,NA,NA,NA,NA,NA,NA,NA
Tsoureki Paximadia or Tsoureki Biscotti,Mia Kouppa,5, 4 ,"Breakfast, Dessert, Snack",Greek,Prep Time: 15 minutes minutes,Cook Time: 20 minutes minutes,Resting time: 20 minutes minutes,NA,NA,9,"Preheat your oven to 300 degrees Fahrenheit. 
Using a serrated bread knife slice your tsoureki 1/4 to 1/2 inch thick.
Line a baking tray with parchment paper and place the slices of tsoureki on the paper, being sure not to overcrowd the baking tray. 
Bake in the middle rack of your oven for 10 minutes.  Remove from oven, flip the tsoureki slices over, and return the pan to the oven.  It is a good idea to rotate your pan at this point.  Bake for an additional 10 minutes. 
Turn off the oven.  With your paximadia still in the oven use an oven mitt or a kitchen towel to keep the door open about 1 - 2 inches.  Leave your paximadia in the oven for at least 20 minutes until they are hard and have dried out. 
Once you have removed your paximadia from the oven and they are cooled, melt your chocolate, combined with the coconut oil or vegetable oil, in the top of a double boiler (see recipe note).  
Once your chocolate has melted, dip one end of your paximadia into the chocolate and then add the sprinkles if desired.
Rest the paximadia on a cooling rack until the chocolate has set.  
For best results, store the paximadia that have been dipped in chocolate in the refrigerator. ",4,1 loaf of tsoureki,1 cup chocolate or white chocolate,1 tsp coconut oil or vegetable oil,sprinkles for decorating,NA,NA,NA,NA,NA,NA,NA,Mia Kouppa,https://miakouppa.com/recipe-tsoureki-paximadia-or-tsoureki-biscotti/,NA,NA,NA,NA,NA,NA,NA,NA,NA,NA,NA,NA,NA
Vegan shortbread cookies,Mia Kouppa,5, 2 ,Dessert,American,Prep Time: 15 minutes minutes,Cook Time: 12 minutes minutes,Chilling time: 30 minutes minutes,Total Time: 1 hour hour,NA,11,"In the bowl of your stand mixer (or another large bowl if using a hand held mixer) beat the non-dairy butter or coconut oil until creamy and soft.
Next add the maple syrup, vanilla powder and salt and mix until well combined.
Add in the flour and beat at medium speed until well incorporated.  You will note that the dough is crumbly. 
Using your hands, knead the dough until it comes together and you are able to form the dough into two balls.  The dough should not be too sticky, but should stick together when you press it together. If the dough is too dry you can add a little more maple syrup (1/2 tbsp at a time). If the dough is too wet, you more flour, 1 tbsp at a time). 
Wrap each of these 2 balls of dough in plastic wrap and flatten them into discs.  Refrigerate for a minimum of 30 minutes.
Preheat your oven to 350 degrees Fahrenheit. 
Take one disc of dough out of the fridge at a time and roll between two pieces of parchment paper, or between two pieces of plastic wrap until you have a thickness of approximately 1/2 inch. 
Use your cookie cutters to cut out your cookie shapes and transfer to the baking tray.  Repeat until you have used all the dough. (You will have to gather your dough and roll it out again several times as you shape your cookies).  Decorate if desired (See Recipe Note).
Bake in the middle rack of your oven for approximately 12 minutes.  Note that your cookies will get a light golden brown underneath but with otherwise not change colour too much.  As well, they will not change shape or rise during baking.
Allow to cool on the baking tray for about 2 minutes and then transfer carefully to a cookie rack until completely cooled. 
Enjoy! ",5,"1/2 cup (115 grams) non-dairy butter, room temperature you can use softened coconut oil instead",1/3 cup (80 mL) maple syrup,2 1/4 cup (335 grams) all-purpose flour,1/4 tsp vanilla powder or 1/2 tsp vanilla extract,1/4 tsp salt,NA,NA,NA,NA,NA,NA,Mia Kouppa,https://miakouppa.com/recipe-vegan-shortbread-cookies/,NA,NA,NA,NA,NA,NA,NA,NA,NA,NA,NA,NA,NA
Blondies,Mia Kouppa,5, 7 ,Dessert,American,Prep Time: 30 minutes minutes,Cook Time: 40 minutes minutes,Cooling time: 1 hour hour,NA,20 blondies,14,"Preheat your oven to 350 degrees Fahrenheit.
In a medium sized bowl whisk together the flour, baking powder, salt and vanilla powder.  Set aside.
In the bowl of your stand mixer combine the sugars and the melted butter.  Blend until well combined.
With the mixer speed set on low, add the eggs, one at a time, to the butter and sugars.  Beat well until light and fluffy. (If you are using vanilla extract as opposed to vanilla powder, add it here)
With the mixer set to low add in the flour mixture.  Mix until well combined.
To your blondie batter add the chocolate chips, candy coated chocolate and the coconut.  Mix until just well combined, being careful not to overmix the batter.
Coat the bottom of your 13 x 9 inch baking pan with a little bit of butter or cooking spray and then line the greased bottom with parchment paper.
Transfer the batter into your pan.  It will be quite thick.  Use an offset spatula or the back of a spoon to spread the blondie batter evenly across the entire pan.  Smooth out the top.
Use candy coated chocolates to decorate the top of your batter, if desired.
Bake in center rack of your oven for approximately 30 minutes or until golden brown on top.
Allow your blondies to cool completely in the pan for at least one hour.  After they are cooled, transfer the blondies to a cutting board by carefully lifting up the parchment paper and cut into serving size pieces.
The best way to cut your blondies it to use a serrated knife and to wipe it clean after each cut.
Blondies will keep for several days at room temperature in a tightly covered container.  Otherwise, store in the refrigerator.  They can also be frozen!
Enjoy!",13,3 cups (450 grams) all purpose flour,2 tsp baking powder,1 tsp salt,1 tsp vanilla powder or 2 tsp vanilla extract,1 cup (200 grams) granulated white sugar,"1 1/4 cup (250 grams) brown sugar, packed","1 cup (225 grams) unsalted butter, melted",3 eggs,3/4 cup (130 grams) white chocolate chips,3/4 cup (130 grams) dark or milk chocolate chips,3/4 cup candy coated chocolate and more to decorate (optional),Mia Kouppa,https://miakouppa.com/blondies/,1/2 cup (50 grams) unsweetened shredded coconut,cooking spray or butter to grease bottom of pan,NA,NA,NA,NA,NA,NA,NA,NA,NA,NA,NA
Heart shaped sugar cookies,Mia Kouppa,5, 2 ,Dessert,American,Prep Time: 30 minutes minutes,Cook Time: 12 minutes minutes,Chilling time: 30 minutes minutes,Total Time: 1 hour hour 15 minutes minutes,24 cookies,14,"In a medium size mixing bowl whisk together the flour, the baking powder and the salt.  Set aside.
In the bowl of your stand mixer (or using your hand held mixer) beat the butter until nice and fluffy.  Add the sugar and continue to mix until well combined.
Next, add the egg and the vanilla.  Beat well at medium speed until the dough pulls off the side of the bowl and all the ingredients are incorporated together.
Remove half of the dough and form it into a ball.  Wrap in plastic wrap and set aside.  
To the dough remaining in the bowl add the food colouring.  Beat well until the food colouring is incorporated and the dough is uniform in colour.  We suggest beginning with 1/4 teaspoon of food colouring gel and increasing from there until you get the colour that you want.
Form this coloured dough into a ball and wrap it as well with plastic wrap.  Chill both balls of dough in the refrigerator for a minimum of 30 minutes. 
When you are ready to shape and bake your cookies, preheat your oven to 350 degrees Fahrenheit. 
Prepare a baking tray with either parchment paper or a silicone baking mat.
Remove dough from fridge and cut off pieces of both the white and coloured dough.  Press them together to make a ball.  
Use a rolling pin to roll the dough out to a thickness of about 1/3 inch.  We find that rolling the dough between two pieces of either wax paper or parchment paper makes it much easier. 
Use your cookie cutter to cut out your heart shapes.  Place your cookie cutter strategically to give you pretty colour patterns.
Transfer the cookies to the baking tray.  When your tray is full, bake in the middle rack of your oven for between 10 - 12 minutes. 
Remove tray from oven and allow the cookies to cool for about 5 minutes before transferring them to a cooking rack.
Enjoy!",8,2 1/2 cups (375 grams) all-purpose flour,1 tsp baking powder,1/4 tsp salt,1 cup (200 grams) granulated sugar,"1 cup (225 grams) unsalted butter, softened","1 egg, large",1 1/2 tsp vanilla extract,1/4 - 1/2 tsp red food colouring gel,NA,NA,NA,Mia Kouppa,https://miakouppa.com/heart-shaped-sugar-cookies/,NA,NA,NA,NA,NA,NA,NA,NA,NA,NA,NA,NA,NA
Lemon ricotta cookies,Mia Kouppa,5, 2 ,Dessert,Italian,Prep Time: 25 minutes minutes,Cook Time: 15 minutes minutes,Resting Time: 30 minutes minutes,Total Time: 1 hour hour 10 minutes minutes,40 cookies,12,"Preheat oven to 350 degrees Fahrenheit.
Place the flour, baking powder, baking soda and salt in a medium sized mixing bowl and whisk together until combined.  Set aside.
In the bowl of your stand mixer beat the butter until smooth and then add in the sugar and the eggs.   Beat at medium speed until well combined, (approximately 3 minutes).  
Next add in the ricotta cheese, vanilla powder (or extract), lemon zest, and lemon juice.  Beat at medium speed until well combined.
Reduce the speed of your mixer to low and slowly add in the flour mixture.  Mix well until everything is well combined.  Do not over mix.
Drop 1 tbsp of dough for each cookie on a parchment lined baking tray, leaving about 1 inch between each cookie.  Do not flatten the dough.
Bake in the middle rack of your oven for 12 - 15 minutes or until the underside of your cookies is golden brown.  
Allow the cookies to cool for 2 - 3 minutes on the baking tray and then transfer them to a wire rack to cool completely.  In the meanwhile, prepare your glaze.
To make the glaze whisk together the icing sugar, lemon juice and lemon zest until smooth.  
When your cookies are fully cooled, dip the tops of your cookies into the glaze to thinly coat each cookie top completely.  Return to the wire rack (place some parchment paper under the cooling rack to catch the drip) and allow the glaze to set.  This will take 10 to 15 minutes.
Transfer your cookies to an airtight container.  They will keep at room temperature for 2 - 3 days; any longer and they can be stored in the refrigerator.   
Enjoy!",14,2 3/4 cup (410 grams) all purpose flour,2 1/2 tsp baking powder,1/2 tsp baking soda,1/2 tsp salt,"1/2 cup (115 grams) butter, unsalted softened",1 1/2 cup (300 grams) sugar,"2 eggs large, at room temperature",454 grams (15 ounces) ricotta cheese,1/2 tsp vanilla powder or 1 tsp vanilla extract,1 1/2 tbsp lemon zest Meyer lemons if possible,"4 tbsp lemon juice, freshly squeezed Meyer lemons if possible",Mia Kouppa,https://miakouppa.com/lemon-ricotta-cookies/,1 1/2 cups (195 grams) icing sugar,"1/4 cup (60 mL) lemon juice, freshly squeezed Meyer lemons if possible",1 tbsp lemon zest Meyer lemons if possible,NA,NA,NA,NA,NA,NA,NA,NA,NA,NA
Ginger molasses cookies,Mia Kouppa,5, 14 ,Dessert,American,Prep Time: 20 minutes minutes,Cook Time: 10 minutes minutes,NA,Total Time: 30 minutes minutes,40 cookies,10,"Preheat oven to 350 degrees Fahrenheit. 
In a medium sized mixing bowl whisk together the flour, baking soda, salt, ginger, cinnamon and nutmeg.  Set aside.
In the bowl of a stand mixer fitted with the paddle attachment combine the butter and brown sugar.  Beat until well combined. 
Add the egg and beat until well combined and then mix in the orange zest and the molasses.
With the mixer set to low speed, slowly add in the flour mixture.  Beat until just well combined.
For each cookie, drop one tablespoon of dough onto the parchment lined cookie sheet, leaving at least one inch between cookies. 
Sprinkle each cookie with a bit of demerara sugar if desired.
Bake in the middle rack of your oven for 10 minutes.
Remove from oven and allow to cook for 5 minutes before transferring to a cookie rack to cool completely.
Enjoy!",12,2 1/4 cups (337 grams) all - purpose flour,1/4 tsp salt,1 tsp baking soda,1 tbsp ground ginger,1/2 tsp cinnamon,1/4 tsp nutmeg,"3/4 cup (180 grams) butter, unsalted softened",3/4 cup (150 grams) brown sugar,1 large egg,1 tbsp grated orange zest,1/3 cup (87 grams) fancy molasses,Mia Kouppa,https://miakouppa.com/ginger-molasses-cookies/,1 tbsp demerara sugar optional,NA,NA,NA,NA,NA,NA,NA,NA,NA,NA,NA,NA
Orange muffins with dates and figs,Mia Kouppa,5, 4 ,Breakfast,NA,Prep Time: 15 minutes minutes,Cook Time: 20 minutes minutes,NA,Total Time: 35 minutes minutes,12 muffins,9,"Preheat oven to 350 degrees Fahrenheit. 
Wash your orange, chop it into large chunks and remove any seeds (Do not peel your orange).  Place in blender or food processor and puree until smooth.
In the bowl of a stand mixer, or other large size bowl if using a hand held mixer, combine the pureed orange, egg, brown sugar and olive oil.  
In another bowl whisk together the oat flour, all-purpose flour, baking soda, baking powder and salt.
Mix the dry ingredients in with the wet ingredients and mix until well combined.  Then, add in the chopped dry figs and dates and mix until well combined.
Prepare the muffin pan by spraying it with cookie spray; use muffin liners if you like.  Fill your muffin cups 2/3 of the way full.
In a small bowl mix together the topping ingredients and then divide equally among your filled muffin cups, on top of the batter. 
Bake in middle rack of your oven for 15 - 20 minutes.
Enjoy!",16,1 orange,1 large egg,1/2 cup brown sugar,1/2 cup olive oil,1/4 cup chopped dry figs,1/4 cup chopped dates,3/4 cup all-purpose flour,3/4 cup oat flour,1 tsp baking powder,1 tsp baking soda,1/2 tsp salt,Mia Kouppa,https://miakouppa.com/orange-muffins-with-dates-and-figs/,1/3 cup large flake oatmeal,1/3 cup all purpose flour,1/4 cup brown sugar,1/2 cup melted butter,"rind of one orange, chopped up",NA,NA,NA,NA,NA,NA,NA,NA
Dates stuffed with almond butter and coconut,Mia Kouppa,5, 2 ,"Dessert, Snack",American,Prep Time: 10 minutes minutes,NA,NA,NA,4 dates,4,"Pit your dates by using a paring knife (or other small knife) to slice into the date, cutting towards the end of the date that has the stem.  While you are cutting through the date, use your knife to push the pit out of the end of the date. See video here 
With your pit removed, carefully make the slit large enough so that you can use a small spoon to stuff your dates with the almond butter.
When you have added the almond butter to the dates, dip the exposed almond butter part into a small dish of shredded coconut.
Enjoy!",3,4 mejool dates,2 - 3 tsp almond butter,2 tsp unsweetened flaked coconut,NA,NA,NA,NA,NA,NA,NA,NA,Mia Kouppa,https://miakouppa.com/dates-stuffed-with-almond-butter-and-coconut/,NA,NA,NA,NA,NA,NA,NA,NA,NA,NA,NA,NA,NA
Tsoureki inspired shortbread,Mia Kouppa,NA,NA,Dessert,Greek,Prep Time: 15 minutes minutes,Cook Time: 10 minutes minutes,Shaping time: 15 minutes minutes,Total Time: 40 minutes minutes,25 cookies,9,"Preheat oven to 350 degrees Fahrenheit.
In a medium sized bowl, whisk together the flour, cornstarch, mahlepi, mastiha and salt.  Set aside.
In the bowl of a stand mixer beat together the icing sugar, butter and shortening until well combined and fluffy, approximately 5 minutes.
Add 1/2 of the flour mixture to the butter and sugar mix, and beat until well combined.  Scrape down the sides of the bowl with a rubber spatula and then add the remaining flour.  Beat well until combined.
Shape your cookies by taking about a tablespoon of dough and shaping into a ball with your hands.  Once you have a ball, flatten it slightly in the palm of your hand so that you end up with a cookie which is about 1/2 inch thick.
If you like, decorate each cookie by pressing some slivered almonds onto the surface.
Place your cookies on a parchment lined cookie sheet and bake in the middle of your oven for 8 – 10 minutes.  Your cookies will brown on the bottom but will not really change colour otherwise (that is, the surface of your cookie will not brown).
Once your cookies are baked, allow them to cool on the baking tray for approximately 5 minutes before transferring them with a spatula to a cooling rack for them to cool completely.
Cookies can be stored in a air tight container for several days, at room temperature. ",9,1⅔ cup (250 grams) all purpose flour,2 tbsp (15 grams) cornstarch,1/4 teaspoon ground mastiha,1/4 teaspoon ground mahlepi,1/2 teaspoon salt,3/4 cup (96 grams) icing sugar,3/4 cup (180 grams) unsalted butter room temperature,2 tbsp (28 grams) vegetable shortening,slivered almonds optional,NA,NA,Mia Kouppa,https://miakouppa.com/tsoureki-inspired-shortbread/,NA,NA,NA,NA,NA,NA,NA,NA,NA,NA,NA,NA,NA
Vegan chocolate and strawberry cookies,Mia Kouppa,5, 2 ,Dessert,NA,Prep Time: 10 minutes minutes,Cook Time: 15 minutes minutes,NA,Total Time: 25 minutes minutes,35 cookies,7,"Preheat oven to 350 degrees Fahrenheit. 
In the bowl of a stand mixer combine the sugar and vegetable oil.  Mix well for 1 – 2 minutes until very well combined.  Alternatively you can mix the ingredients together with a hand held electric mixer, or with a whisk.
In a separate bowl whisk together the flour, cocoa powder, baking powder, cinnamon and salt and mix until well combined.
With the mixer off, add the flour mixture to the oil and sugar.  Then, add the strawberry jam.  Mix together for 1 – 2 minutes until everything is combined well.  
Using a 1 tablespoon mini scooper, or a spoon, place the dough onto a parchment lined cookie sheet.  Leave about 1 inch of space between each cookie.
Bake in the middle rack of your preheated oven for 10 – 12 minutes, being careful not to burn your cookies.  Note that your cookies will not change shape too much during the baking process.
As your cookies bake, remove from the oven and transfer immediately to a cooling rack to cool.",8,280 grams sugar or 1 1/4 cups,160 ml vegetable oil or 3/4 cup,440 grams all purpose flour or 2 3/4 cups,80 grams cocoa powder or 1/2 cup,2 tbsp baking powder,1 tsp ground cinnamon,1/2 tsp salt,400 grams strawberry jam,NA,NA,NA,Mia Kouppa,https://miakouppa.com/vegan-chocolate-and-strawberry-cookies/,NA,NA,NA,NA,NA,NA,NA,NA,NA,NA,NA,NA,NA
