title,author,rating,ratingnum,course,cuisine,preptime,cooktime,customtime,totaltime,servings,numberofsteps,actualsteps,totalingredients,ingredient1,ingredient2,ingredient3,ingredient4,ingredient5,ingredient6,ingredient7,ingredient8,ingredient9,ingredient10,ingredient11,source,link,ingredient12,ingredient13,ingredient14,ingredient15,ingredient16,ingredient17,ingredient18,ingredient19,ingredient20,ingredient21,ingredient22,ingredient23,ingredient24
Christmas koulourakia with yeast (Χριστουγεννιάτικα κουλουράκια με μαγιά),Mia Kouppa,5, 1 ,"Bread, meze, Snack",Greek,Prep Time: 30 minutes minutes,Cook Time: 20 minutes minutes,"Resting time, total: 14 hours hours",Total Time: 14 hours hours 50 minutes minutes,85 cookies,8,"The night before you are planning to make your koulourakia, mix your flour with the olive oil and the vegetable oil.   The flour will be somewhat crumbly; cover it with a clean kitchen towel and leave at room temperature until you are ready to use it the next day.
Several hours before you are planning to make your koulourakia you must prepare the liquid which will be used for the dough.
In a medium size pot combine the orange peel, cinnamon stick, nutmeg, cloves, thyme and salt.  Add 1 liter and 1/2 cup of water. Bring to a boil and then lower the heat to medium high and cook, covered, for 20 minutes. Turn the heat off and allow to rest with the cover still on for approximately 2 hours, or longer. If you prepare the liquid the night before, you can keep it in the refrigerator after it has come to room temperature. You will have to reheat it to warm for the next step.
In a small mixing bowl combine 1/2 cup of the warm liquid with the yeast.  Mix well and allow to sit for 2 – 3 minutes.
Add the yeast to the large bowl of flour along with 3 1/2 cups of additional water.  Mix well and knead the dough for approximately 7 – 10 minutes.  Add 1 tablespoon of vegetable oil to the bowl and continue to knead.  Watch video here,  to see what the dough should look like. Shape the dough into a ball and cover with a clean kitchen towel. Place in a warm, draft-free place and allow to rise for approximately 2 hours or until doubled in size.
To prepare the koulourakia take approximately 1 tablespoon of dough and roll it on a clean surface to make a strip which is approximately 6 to 8 inches long. Pinch the ends together to make it round.  Place on a parchment lined baking sheet and allow to rise for an additional 20 – 30 minutes.
Bake in a 350 degree pre-heated oven for 20-22 minutes, until golden brown.
Enjoy!",12,1/2 cup olive oil,1/2 cup vegetable oil,13 cups flour,"orange peel from 3 oranges, dried or fresh",1 cinnamon stick,1/2 teaspoon whole cloves,1 whole nutmeg,1 teaspoon salt,"1 teaspoon dried thyme, or a sprig of fresh thyme",1 liter + 1/2 cup water,2 tbsp active dry yeast,Mia Kouppa,https://miakouppa.com/christmas-koulourakia-with-yeast-%cf%87%cf%81%ce%b9%cf%83%cf%84%ce%bf%cf%85%ce%b3%ce%b5%ce%bd%ce%bd%ce%b9%ce%ac%cf%84%ce%b9%ce%ba%ce%b1-%ce%ba%ce%bf%cf%85%ce%bb%ce%bf%cf%85%cf%81%ce%ac%ce%ba%ce%b9/,"1 tbsp vegetable oil, or any other mild oil",NA,NA,NA,NA,NA,NA,NA,NA,NA,NA,NA,NA
Oatmeal and chocolate chunk ice cream sandwiches,Mia Kouppa,NA,NA,Dessert,American,NA,NA,NA,NA,8 sandwiches,8,"Preheat oven to 350 degrees Farenheit.
In a medium sized bowl, mix together the oats, flour, baking powder, baking soda, powdered vanilla, salt, cinnamon, and ginger.  Mix well until fully combined.
In the bowl of a stand mixer, combine the butter with the brown sugar and granulated sugar.  Using the paddle attachment of the stand mixer, mix until well combined. Add the egg and beat well.  Mix for 2 – 3 minutes.
Add the oat and flour mixture to the bowl of the stand mixture and beat all ingredients together until well combined.  Stir in the chocolate chunks.
Form a ball of cookie dough using two tablespoons worth of dough in your hands.  Press to flatten slightly and place on a parchment lined cookie sheet.  Repeat, leaving 2 inches between each cookie.
Bake in the middle rack of your oven for 12 minutes.  Remove baking tray from oven and allow the cookies to cool for 1 – 2 minutes before transferring them to a cooling rack to cool completely.
Once your cookies are cooled it is time to assemble your ice cream cookies.  Try to find pairs of cookies which are most similar in size and shape (all the cookies should be pretty similar in fact). Place a 1 inch layer of ice cream on the bottom side of one cookies and spread it out, being careful not to break your cookie.  Top with a second cookie.  Serve immediately, or wrap tightly in plastic wrap and place in freezer for later.
Enjoy!",14,1½ cups (150 grams) oats,3/4 cup (110 grams) all purpose flour,1 egg,1/2 cup (115 grams) butter,1/2 cup (100 grams) brown sugar,1/3 cup (67 grams) granulated white sugar,1/2 teaspoon baking powder,1/2 teaspoon baking soda,1 teaspoon vanilla,1/2 teaspoon salt,1/2 teaspoon ground cinnamon,Mia Kouppa,https://miakouppa.com/oatmeal-and-chocolate-chunk-ice-cream-sandwiches/,1/4 teaspoon ground ginger,"1 cup (175 grams) chocolate chunks, or chocolate chips",Ice cream of your choice for making the sandwiches,NA,NA,NA,NA,NA,NA,NA,NA,NA,NA
Koulourakia with orange (Νηστίσιμα κουλουράκια με πορτοκάλι),Mia Kouppa,4.95, 17 ,Dessert,Greek,NA,NA,NA,Total Time: 2 hours hours 30 minutes minutes,90 cookies,13,"Preheat oven to 350 degrees Fahrenheit.
Using a mixer, beat together the sugar, and oil for 5 minutes.  Add the orange juice, and mix for another couple of minutes (if you don’t have a stand mixer, a hand held mixer will do nicely).
Add in the ouzo and mix again, for a minute or so.  (If you're using liquid vanilla, add 2 teaspoons in this step)
In a medium size bowl, add 2 cups of your sifted flour.  Sift and add the baking powder, and vanilla powder (if you're using it).  Whisk together to combine.
Add this flour, baking powder and vanilla powder combination to your mixing bowl, containing the sugar/oil ingredients; and with your bread hook attachment, mix well to combine. 
Remove 1/2 cup of your measured sifted flour and keep aside.  You probably won't need it.
Continue to add the flour, one cup at a time, mixing well  after each addition. Alternatively, at this point, if you choose, you can use your hands to knead the dough.  
The dough should be soft and almost pillowy, but should hold its shape and be easy to roll. Watch video here. You want to avoid adding in too much flour.  You want to get to the point just where the dough is pulling away from the side of the mixing bowl, as it's mixing. As soon as you have about 2 cups of flour left, add it slowly.   As soon as you see the dough pulling away from the side, it's done.  Watch video here.  If you're not sure, don't add the extra flour you set aside.   Let the dough rest for about 10-20 minutes. Here's another video.
Take about 1 tablespoon (32 grams) of dough and make a log about 6 inches long. Keep in mind, that the dough will feel oily..this is ok.  It's a greasy dough. Then, create a thin “S” shape. Place on parchment lined cookie sheet and bake in middle rack of oven for about 25 minutes, turning halfway.
If you are going to use the sesame seeds, spread some of them on the counter or cutting board (wherever you will be rolling your koulourakia).  Roll out your dough and create your log on top of the sesame seeds; this way they will get embedded in the dough. Continue as above: Create an “S” shape.  Try not to let the ends of the cookie become too thin, because they will burn during baking. Place on parchment lined paper and bake in middle rack of oven for about 25 minutes.  Here's a video of our mom shaping them.
When the koulourakia are golden brown on the underside, and puffy and golden on top, they are ready.
Allow them to rest for about a minute and then remove from the cookie sheet and allow to cool on a cooling rack.
Enjoy, alone or with a nice cup of coffee!",8,1 ½ cups sugar,3 cups vegetable oil or 24 oz we use Mazola corn oil,"2 cups freshly squeezed orange juice, or 16 oz",1/4 cup ouzo or cognac see notes,2 tbsp baking powder,1 teaspoon vanilla powder heaping; see notes for substitution,"1,350 grams sifted, all-purpose flour (9 cups approx)",1/4 cup sesame seeds optional,NA,NA,NA,Mia Kouppa,https://miakouppa.com/koulourakia-with-orange-%ce%bd%ce%b7%cf%83%cf%84%ce%af%cf%83%ce%b9%ce%bc%ce%b1-%ce%ba%ce%bf%cf%85%ce%bb%ce%bf%cf%85%cf%81%ce%ac%ce%ba%ce%b9%ce%b1-%ce%bc%ce%b5-%cf%80%ce%bf%cf%81%cf%84%ce%bf%ce%ba/,NA,NA,NA,NA,NA,NA,NA,NA,NA,NA,NA,NA,NA
