title,author,rating,ratingnum,cuisine,preptime,cooktime,customtime,totaltime,servings,numberofsteps,actualsteps,totalingredients,ingredient1,ingredient2,ingredient3,ingredient4,ingredient5,ingredient6,ingredient7,ingredient8,ingredient9,ingredient10,ingredient11,ingredient12,ingredient13,source,link,ingredient14,ingredient15,ingredient16,ingredient17,ingredient18,ingredient19,ingredient20,ingredient21
Brown Sugar Cookies,John Kanell,4.96,24,American,10 minutes,12 minutes,NA,22 minutes,24 cookies,5,"In a medium mixing bowl, whisk together the flour, baking soda, baking powder, and salt.
In a large mixing bowl or the bowl of a stand mixer fitted with the paddle attachment, beat the butter and sugar together on medium speed until light and fluffy, about 3 minutes. Add the egg and vanilla, beating until well combined, stopping to scrape down the bowl as needed.
With the mixer on low speed, add in the flour mixture and beat until combined, stopping to scrape down the bowl at least once. Scoop the dough into small balls (about 2 tablespoons). If desired, roll the balls in additional brown sugar or decorating sugar. Chill the cookie dough balls for 1 hour.
Preheat the oven to 350F. Line two large baking sheets with parchment paper.
Place cookies 2 inches apart on the baking sheets and bake, one sheet at a time, for 12 minutes or until just starting to turn brown on the edges and then the center doesn’t appear pale. Let cool for a few minutes on the pan then transfer to a wire rack to cool completely. Store in an airtight container for up to 1 week.",8,▢ 3 cups all-purpose flour (360g),▢ ¾ teaspoon baking soda,▢ ¼ teaspoon baking powder,▢ 1 teaspoon salt,▢ 1 cup unsalted butter softened (227g),▢ 1¾ cups packed light brown sugar (385g),▢ 2 large eggs,▢ 2 teaspoons vanilla extract,NA,NA,NA,NA,NA,Preppy Kitchen,https://preppykitchen.com/brown-sugar-cookies/,NA,NA,NA,NA,NA,NA,NA,NA
Browned Butter-Earl Grey Cookies,John Kanell,5,13,American,NA,15 minutes,NA,15 minutes,24 cookies,9,"In a small spice grinder, blitz the tea leaves until finely chopped. Set aside.
In a small saucepan, melt ½ cup of butter over medium-high heat. Continue cooking until the butter foams and the milk solids turn deep golden brown in color, 6 to 8 minutes. Transfer to a small bowl. Stir in the vanilla, cardamom, and tea leaves.
Place the butter mixture in the fridge, stirring every 15 minutes, until smooth and spreadable, about 45 minutes. (You can also do this ahead of time and leave it covered at room temperature overnight.)
In a large mixing bowl or the bowl of a stand mixer fitted with the paddle attachment, combine the cooled browned butter mixture, remaining ½ cup softened butter, sugar, egg yolk, and salt. Beat on medium speed just until creamy and combined, about 1 minute. With the mixer on low speed, gradually add in the flour and cornstarch, mixing just until combined. Stop and scrape down the bowl occasionally during mixing. Transfer the dough to a lightly floured surface and shape into a disk. Wrap tightly in plastic wrap and chill for 30 minutes.
Lightly flour the chilled dough and roll between two sheets of parchment paper to ¼-thickness. Chill for another hour or until firm.
Preheat the oven to 350F. Line a baking sheet with parchment paper.
Cut into desired 2-inch shape and place on the baking sheet 1-inch apart.
Bake for 12 to 15 minutes or until the bottoms start to brown. Let the cookies cool completely on the pan.
In a medium bowl, whisk together the sugar, orange zest, milk, butter, and cardamom until smooth. Dip half of each cookie in the glaze place on parchment paper or drizzle the glaze over the cookies and set aside to dry. Let the glaze fully dry before serving. Cookies can be stored in single layers with parchment between them in an airtight container for up to a week.",14,▢ 1 tablespoon loose leaf earl grey tea,▢ 1 cup unsalted butter softened and divided (227g),▢ ½ vanilla bean seeds scraped or 1 teaspoon vanilla extract,▢ ¼ teaspoon ground cardamom,▢ ½ cup powdered sugar (60g),▢ 1 egg yolk,▢ ½ teaspoon salt,▢ 1¾ cups all-purpose flour (210g),▢ ¼ cup cornstarch (40g),▢ 1 cup confectioners’ sugar,▢ zest of 1 orange,▢ 1 tablespoon warm milk,▢ 1 tablespoon unsalted butter melted,Preppy Kitchen,https://preppykitchen.com/earl-grey-cookies/,▢ 1 pinch ground cardamom,NA,NA,NA,NA,NA,NA,NA
Cookie in a Mug,John Kanell,5,101,American,2 minutes,1 minute,NA,3 minutes,1 serving,3,"Place the butter in an 8-ounce microwave-safe mug, and microwave for 30 seconds until mostly melted.
Stir in the sugar, vanilla, and salt with a spoon until combined. Add the egg yolk and stir until smooth. Stir in the flour and most of the chocolate chips until combined. Sprinkle the top with the remaining chocolate chips.
Microwave on high for 45 seconds to 1 minute or until the dough has puffed and appears dry. Let cool for a few minutes before serving. Best is enjoyed warm with ice cream.",8,▢ 1 tablespoon unsalted butter,▢ 4 teaspoons packed light brown sugar,▢ 1 tablespoon granulated sugar,▢ ¼ teaspoon vanilla extract,▢ Pinch of salt,▢ 1 egg yolk,▢ 3 tablespoons all-purpose flour,▢ 2 tablespoons semisweet chocolate chips,NA,NA,NA,NA,NA,Preppy Kitchen,https://preppykitchen.com/cookie-in-a-mug/,NA,NA,NA,NA,NA,NA,NA,NA
Cornflake Cookies,John Kanell,5,21,American,20 minutes,10 minutes,NA,30 minutes,24 cookies,5,"Preheat the oven to 350°F. Line large baking sheets with parchment paper.
In a medium bowl, whisk together the flour, baking powder, baking soda, and salt.
In a large mixing bowl or the bowl of a stand mixer fitted with the paddle attachment, beat the butter and sugars on medium speed until light and fluffy, about 3 minutes. Add the egg and vanilla and beat well, stopping as needed to scrape down the sides during mixing.
Add the flour mixture and beat on low speed just until combined. Gently fold in the cornflakes, oats, and nuts until well incorporated into the dough. Using a 1½ tablespoons cookie scoop, drop the dough onto the prepared baking sheets about 2 inches apart. Press more cornflakes to the outside of the dough balls, if desired.
Bake one sheet at a time for 10 to 12 minutes or until the edges start to brown. Let the cookies cool on the baking sheet for a few minutes, then transfer to a wire rack to cool completely. Store cookies in an airtight container at room temperature for up to 1 week or frozen for up to 1 month.",12,▢ 1 cup all-purpose flour (120g),▢ ½ teaspoon baking powder,▢ ½ teaspoon baking soda,▢ ½ teaspoon salt,▢ ½ cup unsalted butter softened (113g),▢ ½ cup sugar (100g),▢ ½ cup packed light brown sugar (110g),▢ 1 large egg,▢ ½ teaspoon vanilla extract,▢ 1 cup corn flake cereal (38g),▢ ¾ cup quick oats (60g),▢ ½ cup chopped nuts (like peanuts or pecans) (56g),NA,Preppy Kitchen,https://preppykitchen.com/cornflake-cookies/,NA,NA,NA,NA,NA,NA,NA,NA
Kitchen Sink Cookies,John Kanell,5,15,American,15 minutes,12 minutes,NA,27 minutes,32 servings,5,"Preheat the oven to 350F. Line large baking sheets with parchment paper.
In a large mixing bowl or the bowl of a stand mixer fitted with the paddle attachment, beat the butter, sugars, and vanilla together on medium speed until light and fluffy, about 3 minutes.
Beat in the eggs, one at a time, stopping to scrape down the bowl between eggs. Beat each until well incorporated before adding the next.
To the mixing bowl, add the flour, baking soda, and salt. Beat on low speed just until combined. Add the chocolate chip, potato chips, pretzels, and toffee bits and stir in by hand until evenly distributed. Using a 2 tablespoons scoop, scoop the cookie dough and place on the lined baking sheets 2 inches apart. Sprinkle the top of each dough ball with flakey salt.
Bake one sheet at a time for 12 minutes or until the edges turn golden. Let cool for a few minutes on the pan, then transfer to a wire rack and cool completely. Store cookies in an airtight container for up to 1 week.",13,▢ 1 cup unsalted butter softened (227g),▢ ¾ cup packed light brown sugar (165g),▢ ½ cup granulated sugar (100g),▢ 2 teaspoons vanilla extract,▢ 2 large eggs,▢ 2¼ cups all-purpose flour (270g),▢ ½ teaspoon baking soda,▢ ½ teaspoon salt,▢ 1½ cups semisweet chocolate chips (270g),▢ 1 cup crushed potato chips (45g),▢ ½ cup chopped pretzels (25g),▢ ½ cup toffee bits (120g),▢ flakey sea salt,Preppy Kitchen,https://preppykitchen.com/kitchen-sink-cookies/,NA,NA,NA,NA,NA,NA,NA,NA
Ladyfingers,John Kanell,4.92,49,Italian,20 minutes,12 minutes,NA,32 minutes,30 servings,6,"Preheat the oven to 350F. Line two large baking sheets with parchment paper. Place a large round piping tip in a large piping bag.
Place the egg yolks, ¼ cup sugar, vanilla, and salt in a large mixing bowl. Beat on medium speed until pale and fluffy.
Place the egg whites in a separate bowl. Using clean beaters, beat on high speed until soft peaks form. While beating, add in the remaining ¼ cup sugar a spoonful at a time. Beat until the egg whites are thick and glossy, about 2 more minutes.
Beat the egg yolk mixture again just to remix, then fold the egg whites into the egg yolks in batches until well combined. Sift the flour and cornstarch into the egg mixture and fold until no dry streaks remain. (If the batter is a little lumpy, that’s okay. Don’t over-mix the batter.) Transfer the batter to the prepared piping bag.
Pipe the batter into 4-inch long logs (about 1-inch wide) on the baking sheet, spacing them about 2 inches apart. Dust one sheet generously with powdered sugar.
Bake the dusted sheet for 12 to 15 minutes or until lightly golden and firm to the touch. Let cool completely on the baking sheet. Dust the remaining baking sheet with powdered sugar and bake again as directed. Use or store immediately after they cool, as they will soften the longer they are exposed to air. Ladyfingers can be stored in an airtight container at room temperature for up to 2 weeks.",7,▢ 3 large eggs separated,▢ ½ cup granulated sugar divided (100g),▢ ½ teaspoon vanilla extract,▢ ¼ teaspoon salt,▢ 1 cup all-purpose flour (120g),▢ 5 teaspoons cornstarch,▢ powdered sugar for dusting,NA,NA,NA,NA,NA,NA,Preppy Kitchen,https://preppykitchen.com/ladyfingers/,NA,NA,NA,NA,NA,NA,NA,NA
Lebkuchen,John Kanell,5,4,German,15 minutes,20 minutes,NA,35 minutes,24 cookies,8,"In a food processor, combine the almonds and hazelnuts. Pulse until finely chopped. Transfer to a large bowl and add the flour, spices, baking powder, and salt. Whisk until combined.
Add ½ cup of the flour mixture and the candied orange and lemon peel to the food processor. Pulse until finely chopped. Stir the chopped citrus peel into the bowl with the flour mixture. (The mixture will look like coarse breadcrumbs.)
In a large mixing bowl or the bowl of a stand mixer fitted with a paddle attachment, beat the brown sugar, honey, and egg together on medium-high speed until thickened and fluffy, about 1 minute. Add the flour mixture and mix on low speed until just combined. Scrape down the dough, cover, and let rest at room temperature for at least 1 hour or up to 8 hours.
Preheat the oven to 350F. Line two rimmed baking sheets with parchment paper.
Scoop the dough into 2-tablespoon-sized balls and place on the parchment paper about 2 inches apart. (See notes about using wafers or Back Oblaten.) Flatten them into 2½-inch wide discs using the back of a wet spoon.
Bake one sheet at a time for 20 minutes or until the edges start to brown and the centers are still soft but appear dry. Let cool for a few minutes on the pan, then transfer to a wire cooling rack.
While the cookies are still warm, make the glaze by whisking together the powdered sugar, warm water or rum, and lemon juice. Brush the glaze over the warm cookies. Decorate with blanched or slivered almonds, if desired.
Lebkuchen are best is stored in an airtight container for 2 to 3 days before serving, as the texture and flavor improve with age. The glazed cookies can be stored for up to 3 weeks.",19,▢ ½ cup blanched almonds,▢ ½ cup toasted hazelnuts,▢ 2½ cups all-purpose flour (300g),▢ 2 teaspoons ground ginger,▢ 2 teaspoons ground cinnamon,▢ ½ teaspoon ground cloves,▢ ½ teaspoon ground cardamom,▢ ¼ teaspoon ground coriander,▢ ¼ teaspoon freshly ground nutmeg,▢ ¾ teaspoon baking powder,▢ ¼ teaspoon salt,▢ ½ cup roughly chopped candied orange peel* (70g),▢ ½ roughly cup chopped candied lemon peel* (70g),Preppy Kitchen,https://preppykitchen.com/lebkuchen/,▢ ¾ cup packed dark brown sugar (165g),▢ ¾ cup honey (180ml/250g)),▢ 2 large eggs,▢ ¾ cup powdered sugar (90g),▢ 1 tablespoon warm water or rum,▢ 1½ teaspoons lemon juice,NA,NA
Rainbow Cookies,John Kanell,4.96,23,Italian,30 minutes,27 minutes,NA,57 minutes,24 servings,13,"Position oven racks in the upper third and lower third of the oven. Preheat the oven to 325°F. Lightly grease 3 (9×13-inch) baking pans or quarter sheet pans and line with parchment paper.
In a large mixing bowl or the bowl of a stand mixer fitted with the paddle attachment, beat together ½ cup of butter, the sugar, and almond paste on medium speed until smooth, about 1 minute. Add the remaining 1 cup of butter. Beat on medium until light and fluffy, about 2 to 3 minutes.
With the mixer on low, add the egg yolks and almond extract, beating until just combined. Gradually add flour and salt, beating until just combined. Stop occasionally and scrape down the bowl during mixing.
In a large mixing bowl, beat the egg whites with an electric mixer with clean beaters or the whisk attachment on high speed until stiff peaks form, about 5 minutes. Working in batches, gently fold the egg whites into the cookie batter until combined and no streaks of egg white remain. Divide the batter evenly among 3 bowls.
Stir about 8 drops of red food coloring into one of the bowls of batter until fully combined. Spread into an even layer in 1 prepared pan. To another batter bowl, stir in about 8 drops of green food coloring and spread into another prepared pan. Spread the remaining plain batter into the remaining prepared pan.
Place 2 pans on the upper third rack, ensuring the pans are not touching, and 1 pan on the lower third oven rack.
Bake for 15 minutes, then rotate the pans on the top rack to the bottom rack and vice versa. Continue baking until a wooden pick inserted in the centers of each cookie pan comes out clean, about 12 minutes more. Let the cookies cool completely in the pans on wire racks.
With the cooled green layer still in the pan, spread ¼ cup of the jam in an even thin layer over the top. Flip the plain (un-dyed) layer on top of the jammy green layer and carefully remove and discard the parchment from the plain layer. Spread the remaining ¼ cup jam in an even thin layer over the plain layer. Place the red layer on top of the jammy plain layer and remove and discard the parchment. Cover with a sheet of plastic wrap.
Place one of the baking pans on top of the stacked layers. Evenly place weights (such as plates or canned vegetables) on top of the pan. Refrigerate for at least 4 hours or up to 12 hours.
Once chilled, remove the weights and plastic wrap. Place a large cutting board on top of the stack and invert. Carefully remove and discard the parchment paper from the green layer.. Using a serrated knife, trim the edges to straighten. Place the stack, green layer up, on a wire rack set inside a large, rimmed baking sheet.
In a medium, microwave-safe bowl, heat the chocolate chips in 30-second intervals stirring between each, until the chocolate is melted.. Spread the melted chocolate over the top and sides of the stack. Let cool slightly, about 5 minutes.
Using fork tines, scrape wavy lines into the chocolate. Refrigerate, uncovered, until the chocolate is set, about 30 minutes.
Using a serrated knife, slice the slab into 2-inch squares. Store the cookies in an airtight container at room temperature for up to 1 week or refrigerated for up to 2 weeks.",11,▢ 1½ cups unsalted butter softened divided (340g),▢ 1 cup granulated sugar (200g),▢ 1 (8-ounce/227g) package almond paste,▢ 4 large eggs separated,▢ 1½ teaspoons almond extract,▢ 2 cups all-purpose flour (240g),▢ ¼ teaspoon salt,▢ red food coloring,▢ green food coloring,▢ ½ cup raspberry jam (160g),▢ 1½ cups semi-sweet chocolate chips (312g),NA,NA,Preppy Kitchen,https://preppykitchen.com/rainbow-cookies/,NA,NA,NA,NA,NA,NA,NA,NA
Grinch Cookies,John Kanell,5,82,American,15 minutes,12 minutes,NA,27 minutes,24 cookies,6,"Preheat the oven to 350°F. Line 2 baking sheets with parchment paper.
In a large mixing bowl, whisk together the flour, 2 cups of powdered sugar, baking powder, and salt.
Cut the butter into tablespoons and drop the pieces into the flour mixture. Add the eggs and vanilla. Beat with an electric mixer on medium speed until combined. Add 2 drops of food coloring if desired, and beat until well incorporated, making sure there are no white streaks in the dough.
In a small bowl, whisk together the cornstarch and the remaining ½ cup of powdered sugar.
Scoop the dough into 1½ tablespoon-sized balls. Roll each between the palms of your hands to form a ball, then roll in the cornstarch mixture until well coated. Place each ball about 3 inches apart, on prepared baking sheets and slightly press down on the tops.
Bake for 12 minutes or until the cookies start to crinkle and are lightly browned on the bottoms. Remove from the oven and immediately press a heart-shaped sprinkle or candy on each cookie. Transfer to a wire rack and cool completely. Cookies can be stored in an airtight container at room temperature for up to 1 week.",10,▢ 2½ cups all-purpose flour (300g),▢ 2½ cups powdered sugar (300g),▢ 1 tablespoon baking powder,▢ ½ teaspoon salt,▢ ½ cup unsalted butter cubed and softened (113g),▢ 2 large eggs,▢ 1 tablespoon vanilla extract,▢ green gel food coloring,▢ ½ cup cornstarch (56g),▢ red heart-shaped sprinkles or cinnamon candies,NA,NA,NA,Preppy Kitchen,https://preppykitchen.com/grinch-cookies/,NA,NA,NA,NA,NA,NA,NA,NA
White Chocolate Cranberry Cookies,John Kanell,5,16,American,15 minutes,10 minutes,NA,25 minutes,24 cookies,7,"Preheat the oven to 375F. Line two baking sheets with parchment paper or lightly grease with baking spray.
In a medium bowl, whisk together the flour, baking soda, and salt.
In a large mixing bowl or the bowl of a stand mixer fitted with the paddle attachment, beat the butter and sugars on medium speed until light and fluffy, about 3 minutes.
Beat in the eggs, one at a time, scraping down the bowl and beating until well combined before adding the next egg. Beat in the vanilla.
With the mixer on low speed, gradually add in the flour mixture and beat just until combined. Scrape down the bowl. Stir in the white chocolate and cranberries.
Using a 2-tablespoon scoop, place dough balls on the cookie sheets about 2 inches apart.
Bake one sheet at a time for 10 to 12 minutes or until the edges are browned. Let cool for a few minutes, then transfer to a wire rack to cool completely. Store cookies in an airtight container for up to 1 week.",10,▢ 2¼ cups all-purpose flour (270g),▢ ½ teaspoon baking soda,▢ ½ teaspoon salt,▢ 1 cup unsalted butter softened (227g),▢ 1 cup packed light brown sugar (220g),▢ ½ cup granulated sugar (100g),▢ 2 large eggs,▢ 1 tablespoon vanilla extract,▢ 1½ cups dried cranberries (180g),▢ 1 cup white chocolate chips (180g),NA,NA,NA,Preppy Kitchen,https://preppykitchen.com/white-chocolate-cranberry-cookies/,NA,NA,NA,NA,NA,NA,NA,NA
Chocolate Biscotti,John Kanell,5,5,Italian,15 minutes,50 minutes,NA,5 minutes,18 servings,7,"Preheat the oven to 350F. Line a large baking sheet with parchment paper.
In a medium mixing bowl, whisk together the flour, cocoa, baking soda, and salt.
In a large mixing bowl or the bowl of a stand mixer fitted with the paddle attachment, beat the butter on medium speed until creamy. Add the sugar and vanilla and beat until well combined, about 2 minutes. Add the eggs, one at a time, stopping to scrape down the bowl between each, and beat until well combined.
Add the flour mixture and chocolate chips and mix on low speed just until combined. Scrape the dough out of the bowl onto a well-floured surface. Flouring your hands and the dough as needed (it will be sticky), shape the dough into a uniform ball and divide in half. Shape each half into short logs and brush off any excess flour.
Place the logs on the baking sheet several inches apart and press each into a rectangle about 1-inch thick and 2½ inches wide. (They will spread during baking so give plenty of space between them.)
Bake for 30 to 35 minutes or until firm to the touch. Let cool on the baking sheet for 5 minutes or until just cool enough to handle but still very warm. Using a sharp serrated knife, cut each log diagonally into ¾-inch wide slices. Flip the slices cut side down on the baking sheet.
Bake for another 10 to 15 minutes or until crisp. Transfer to a wire rack to cool completely. Store biscotti in an airtight container for up to 1 week at room temperature or freeze tightly wrapped in a freezer container for up to 1 month.",9,▢ 2 cups all-purpose flour (240g),▢ ½ cup unsweetened cocoa powder (50g),▢ ¾ teaspoon baking soda,▢ ½ teaspoon salt,▢ 4 tablespoons unsalted butter softened (56g),▢ 1 cup granulated sugar (200g),▢ 1 teaspoon vanilla extract,▢ 2 large eggs,▢ 1 cup semi-sweet chocolate chips (180g),NA,NA,NA,NA,Preppy Kitchen,https://preppykitchen.com/chocolate-biscotti/,NA,NA,NA,NA,NA,NA,NA,NA
Oatmeal Cream Pie,John Kanell,5,47,American,20 minutes,10 minutes,NA,30 minutes,12 sandwich cookies,7,"Preheat the oven to 350F. Line two baking sheets with parchment paper.
In a large bowl, whisk together the flour, oats, baking soda, and cinnamon.
In a large mixing bowl or the bowl of a stand mixer fitted with the paddle attachment, beat the butter just until creamy. Add the sugars, molasses, and salt. Beat at medium speed until light and fluffy, about 5 minutes. Add the egg and vanilla and beat until well combined. Stop and scrape down the bowl during mixing, as needed.
With the mixer on low speed, gradually add in the flour mixture and mix just until combined. Using a 1 ½-tablespoon scoop, scoop the dough onto the lined cookie sheets spacing each one about 2 inches apart.
Bake one sheet at a time for 10 minutes or just until the cookie edges are set and the centers puff up but still appear underdone. (You want soft cookies for these sandwiches so don’t be afraid to underbake them!) Let cool on the cookie sheet for a few minutes, then transfer to a wire rack to cool completely.
In a large mixing bowl or the bowl of a stand mixer fitted with the paddle attachment, beat the butter and salt until light and fluffy, about 3 minutes. With the mixer on low speed, gradually add the sugar and cream. Stop and scrape down the bowl as needed. Add the vanilla. Once combined, beat on medium speed until fluffy, about 1 minute.
Spread the filling on the bottom of half of the cookies. Top with another cookie. Oatmeal cream pies can be stored in an airtight container for up to 5 days.",16,▢ 1 ¼ cups all-purpose flour (150g),▢ ⅔ cup quick oats (70g),▢ ¾ teaspoon baking soda,▢ ¾ teaspoon ground cinnamon,▢ ½ cup unsalted butter room temperature (113g),▢ ¾ cup packed dark brown sugar (165g),▢ ¼ cup granulated sugar (50g),▢ 1 tablespoon molasses,▢ ½ teaspoon salt,▢ 1 large egg,▢ 2 teaspoons vanilla extract,▢ ½ cup unsalted butter (113g),▢ Pinch of salt,Preppy Kitchen,https://preppykitchen.com/oatmeal-cream-pie/,▢ 2 cups confectioners’ sugar (240g),▢ 2 to 3 tablespoons heavy cream,▢ 1 teaspoon vanilla extract,NA,NA,NA,NA,NA
