title,author,rating,ratingnum,cuisine,preptime,cooktime,customtime,totaltime,servings,numberofsteps,actualsteps,totalingredients,ingredient1,ingredient2,ingredient3,ingredient4,ingredient5,ingredient6,ingredient7,ingredient8,ingredient9,ingredient10,ingredient11,ingredient12,ingredient13,source,link,ingredient14,ingredient15,ingredient16,ingredient17,ingredient18,ingredient19,ingredient20,ingredient21
Pistachio Matcha Cookies,John Kanell,NA,NA,American,10 minutes,20 minutes,NA,30 minutes,28 to 30 cookies,8,"In the bowl of a stand mixer fitted with a paddle attachment, combine the butter, confectioners sugar, and salt. Beat on low speed just until combined. Increase the speed to medium and beat for about 3 minutes until light and fluffy.
Scrape down the sides and bottom of the bowl. Add the egg and almond extract. Beat on medium-low speed for about 1 minute. (The egg may not be fully incorporated, but the dough will smooth out once the flour is added.)
In a medium bowl, sift together the flour and matcha powder. With the mixer on low, gradually add the flour mixture, and mix just until combined. Scrape down the sides and bottom of the bowl. Add the pistachios and mix just until combined.
Turn the dough out onto a lightly floured surface and lightly flour your hands. Divide it into 2 equally-sized pieces and form each into a log shape, about 2 inches in diameter. Wrap tightly with plastic wrap and refrigerate for at least 2 hours, up to overnight.
About 20 minutes before you are ready to bake, place one oven rack in the top third of the oven and one in the bottom third. Preheat the oven to 350°F. Line two baking sheets with parchment paper.
Remove the cookie rolls from the refrigerator and unwrap the plastic wrap. Place the sparkling sugar on a plate. Roll the long sides of the pieces of dough in the sugar, pressing to adhere.
Slice the logs into ¼-inch thick cookies. Place the cookies about 1 inch apart on the prepared baking sheets.
Bake for 15 to 20 minutes, rotating the baking sheets from the upper to lower oven rack, and turning them 180° halfway through. Let the cookies cool for about 5 minutes on the sheet tray, then transfer to a wire rack to cool completely.",9,▢ 1 cup unsalted butter softened (226g),▢ ¾ cup confectioners’ sugar (90g),▢ ½ teaspoon salt,▢ 1 large egg,▢ ½ teaspoon almond extract,▢ 2 cups all-purpose flour (240g),▢ 4 teaspoons matcha powder (10g),▢ ½ cup chopped pistachios (70g),▢ ½ cup white sparkling sugar (150g),NA,NA,NA,NA,Preppy Kitchen,https://preppykitchen.com/pistachio-matcha-cookies/,NA,NA,NA,NA,NA,NA,NA,NA
Homemade Milano Cookies,John Kanell,5,1,American,20 minutes,10 minutes,NA,30 minutes,20 sandwich cookies,16,"Place one oven rack in the top third of the oven and one in the bottom third. Preheat the oven to 350°F.
In the bowl of a stand mixer fitted with a paddle attachment, combine the butter, powdered and granulated sugar. Beat on low speed for 30 seconds, just until combined. Increase the speed to medium and beat for about 3 minutes, until light and fluffy.
Scrape down the sides and bottom of the bowl. Add the egg and vanilla extract. Beat on medium-low speed for about 1 minute. (The egg may not be fully incorporated, but the dough will smooth out once the flour is added.)
Add the salt and then the flour in two parts, alternating with the milk. Mix on low speed between each addition, just until combined. Scrape down the sides and bottom of the bowl as needed.
Transfer the dough to a piping bag. Cut a ¾-inch wide opening from the tip of the piping bag. (I like to lay the piping bag flat on a cutting board and measure with a ruler, then cut across the tip of the bag with a paring knife.)
Line two large baking sheets with parchment paper. Pipe log-shaped cookies about 2½-inches long and about ¾ to 1 inch wide, leaving about 2 inches of space between each. (You should be able to fit 4 rows of 5 cookies on each sheet tray.)
Bake the cookies for 9 to 10 minutes, rotating the trays from top to bottom rack and giving them each a 180-degree turn after 5 minutes of baking, until the tops are dry and the the bottom edges are lightly golden.
Turn off the oven and crack the oven door open about 6 inches. Leave the cookies in the oven for 10 more minutes to help dry them out and crisp. Transfer to a cooling rack to cool completely.
Match cookies that are similar in size and shape to create pairs.
While the cookies are cooling, place the chocolate chips in a medium, heatproof bowl.
Fill the base of a double-boiler or small pot with 1 inch of water. Place over medium-high heat and bring the water to a simmer. Reduce the heat to medium-low and place the bowl of chocolate chips over the top, ensuring that the bottom of the bowl does not touch the water.
Cook for 4 to 6 minutes, stirring occasionally, until the chocolate is fully melted and smooth. Remove the bowl from the heat.
Let the chocolate cool for about 10 minutes, stirring occasionally, until it thickens slightly.
Spread about 1 teaspoon of the melted chocolate across the bottom of one of the cookies, reaching almost to the edges. Top with its similarly sized cookie and gently press the two together until the chocolate reaches the edges (but does not spill over). If the chocolate is too runny or drips down the sides, let it cool for a few more minutes, stirring occasionally, then try spreading it again.
Set aside the cookies to cool completely. Repeat with the remaining pairs of cookies.
Let the chocolate cool and set completely (You can refrigerate the cookies to speed this up).",9,"▢ ½ cup unsalted butter (113g), softened",▢ ½ cup powdered sugar (60g),▢ ½ cup granulated sugar (100g),▢ 1 large egg room temperature,▢ 1 teaspoon vanilla extract,▢ ½ teaspoon salt,▢ 1½ cups all-purpose flour (180g),▢ 1 tablespoon whole milk,▢ 1 cup semi-sweet chocolate chips (180g),NA,NA,NA,NA,Preppy Kitchen,https://preppykitchen.com/milano-cookies/,NA,NA,NA,NA,NA,NA,NA,NA
Chocolate Peppermint Bark Cookies,John Kanell,NA,NA,American,15 minutes,10 minutes,NA,35 minutes,24 cookies,10,"Preheat the oven to 375°F. Line two large baking sheets with parchment paper.
In a medium mixing bowl, whisk to combine the flour, cocoa powder, baking soda, and salt.
In the bowl of a stand mixer fitted with the paddle attachment (or in a large bowl, using a handheld electric mixer), cream the butter, light brown, and granulated sugar on medium speed for about 3 minutes until lightened in color and fluffy.
Add the egg, vanilla and peppermint extract, and mix on low speed for 30 seconds, just until combined.
With the mixer on low speed, gradually add the flour mixture a few tablespoonfuls at a time, mixing just until combined between each addition.
Chop one-quarter of the peppermint bark (4 ounces, 113g) into small pieces like the size of the dark chocolate chips (1 cup, chopped). Break the remaining peppermint bark (12 ounces, 340g) into about 1-inch pieces (you will need about 24 pieces). Set aside.
Add the chocolate chips and smaller peppermint bark pieces to the cookie dough and mix on low speed just until combined.
Scoop cookies to be about 2 tablespoons in size (about 40g each) with a triggered cookie scoop or two spoons onto the prepared baking sheets, leaving about 2 inches of space between each cookie.
Bake the trays one at a time for 9 to 10 minutes until the edges are set and the top appears dry. Remove the pan from the oven and immediately press one of the larger pieces of peppermint bark into the center of each cookie.
Sprinkle the cookies with chopped candy canes while they are hot. Let the cookies cool on the pan for 5 to 10 minutes to melt the bark slightly. Transfer them to a cooling rack to cool completely.",13,▢ 1¾ cups all-purpose flour (210g),▢ ⅓ cup cocoa powder (33g),▢ ¾ teaspoon baking soda,▢ ½ teaspoon salt,▢ ¾ cup unsalted butter softened (168g),▢ ½ cup light brown sugar (110g),▢ ½ cup granulated sugar (100g),▢ 1 large egg room temperature,▢ 1 teaspoon vanilla extract,▢ ½ teaspoon peppermint extract,▢ 16 ounces peppermint bark divided (450g),▢ ½ cup dark chocolate chips (80g),▢ 3 to 4 candy canes crushed,Preppy Kitchen,https://preppykitchen.com/chocolate-peppermint-bark-cookies/,NA,NA,NA,NA,NA,NA,NA,NA
Ritz Cookies,John Kanell,5,1,American,25 minutes,5 minutes,NA,45 minutes,30 cookies,6,"Place the crackers round-side down on a cutting board. On one flat side, spread about ½ teaspoon of peanut butter. Top with the flat side of another cracker and gently press until the peanut butter just reaches the edges of crackers, without coming out of the sides. Repeat with all of the crackers to make 30 sandwiches. Place on a small sheet tray and freeze for 15 minutes while you melt the chocolate.
Fill the base of a double-boiler or medium pot with 1 inch of water Place over medium-high heat and bring the water to a simmer. Reduce the heat to medium-low and place a large bowl over the top, ensuring that the bottom of the bowl does not touch the water.
Add the chocolate and coconut oil, if using, to the bowl. (If you use bars, the coconut oil is not necessary. It can help to make chocolate chips more fluid!) Cook for 4 to 6 minutes, stirring occasionally, until the chocolate is fully melted and smooth. Remove the bowl from the heat.
Dip the cracker sandwiches one at a time into the melted chocolate. turning to coat and ensuring that all of the sides are well covered. Remove them from the chocolate with a fork, allowing the excess to drizzle off. Place the cookes on a sheet tray lined with parchment paper.
Let the chocolate set for about 15 minutes, until it’s still glossy by has hardened slightly. Decorate with sprinkles, flaky sea salt or chopped peanuts.
Let the chocolate harden completely. To firm up more quickly, pop the sandwiches in the refrigerator for 5 to 10 minutes.",4,▢ 60 Ritz crackers (from 2 sleeves) (180g),▢ ¾ cup peanut butter (175g),▢ 1 pound semi-sweet chocolate bars (chopped) or chips (450g),▢ 2 teaspoons coconut oil optional,NA,NA,NA,NA,NA,NA,NA,NA,NA,Preppy Kitchen,https://preppykitchen.com/ritz-cookies/,NA,NA,NA,NA,NA,NA,NA,NA
Brown Butter Wassail Cookies,John Kanell,NA,NA,American,40 minutes,25 minutes,NA,35 minutes,2 dozens,11,"In a small pot, bring the apple cider to a simmer over medium heat. Stir in the apple pieces and the brandy and remove from the heat. Cover and let the apples soak for at least 30 minutes or up to 3 hours.
Drain the apples through a fine mesh sieve, gently pressing them with the back of a spoon to release extra liquid. Reserve the soaking liquid for the glaze.
In a small saucepan, melt the butter over medium heat. Continue cooking until the solids have separated and turned brown, 6 to 8 minutes. Transfer to a medium bowl. Whisk in the cinnamon, ginger, all-spice, and vanilla into the browned butter, and let the spices bloom for 5 minutes. Whisk in the orange and lemon zest.
Add the brown sugar, ¼ cup granulated sugar (50g), and egg, and whisk until well combined. Stir in the apples.
In a large bowl, combine the flour, baking soda, baking powder, and salt.
Pour the butter mixture into the flour mixture and stir together with a spatula until just combined. Refrigerate the dough for 30 minutes.
Meanwhile, preheat the oven to 350°F. Line two large baking sheets with parchment paper.
Scoop the dough into 2 tablespoon-sized balls (about 40g) and roll in the remaining ¼ cup (50g) of granulated sugar. Place them on the prepared baking sheets about 2 inches apart.
Bake one sheet at a time until the edges are set and the centers appear dry but are not firm to the touch, 10 to 12 minutes. Let the cookies cool on the pan for 5 minutes, then transfer to a wire rack to cool completely.
In a medium bowl, whisk together the confectioners’ sugar and 3 tablespoons of reserved apple-soaking liquid until smooth. If the icing is too thick, add the additional 1 tablespoon of soaking liquid, 1 teaspoon at a time.
Drizzle the icing over the top of the cooled cookies. Let the glaze set for at least 30 minutes, or until hardened and dry, before serving or storing.",19,▢ ¾ cup apple juice or cider (180mL),▢ 1 cup very finely chopped dried apples (80g),▢ ⅓ cup brandy (80mL),▢ 1 cup unsalted butter (227g),▢ 1½ teaspoons ground cinnamon,▢ 1½ teaspoons ground ginger,▢ ½ teaspoon ground allspice,▢ 1 teaspoon vanilla bean paste or vanilla extract,▢ 1 tablespoon grated orange zest (about 1 orange),▢ 1 teaspoon grated lemon zest (about 1 lemon),▢ 1 cup packed dark brown sugar (220g),▢ ½ cup granulated sugar divided (100g),▢ 2¾ cups all-purpose flour (330g),Preppy Kitchen,https://preppykitchen.com/brown-butter-wassail-cookies/,▢ 1 teaspoon baking soda,▢ ½ teaspoon baking powder,▢ ½ teaspoon salt,▢ 1 large egg,▢ 1½ cups confectioners’ sugar,▢ 3 to 4 tablespoons reserved apple soaking liquid (45 to 60mL),NA,NA
Pizzelle,John Kanell,5,3,Italian,10 minutes,30 minutes,NA,40 minutes,28 pizzelles,8,"Preheat the pizzelle iron.
In a medium bowl, whisk together flour, baking powder and salt.
In a large bowl, beat the eggs and sugar on high for 3-4 minutes or until thicker and light yellow.
Mix in the melted butter, vanilla, and anise if using.
Add the dry ingredients to the wet and mix until just combined.
Brush the pizzelle iron lightly with oil or spray with nonstick spray.
Add a heaping tablespoon for each pizzella into the hot iron. Place the batter just behind the center, closer to the hinge, then close and cook for 60-90 seconds or until golden.
Let the pizzelle cool on a wire rack. Lightly dust with the powdered sugar before serving.",9,▢ 1¾ cups all-purpose flour (210g),▢ 2 teaspoons baking powder,▢ ¼ teaspoon salt,▢ 3 large eggs,▢ ¾ cup granulated sugar (150g),"▢ ½ cup unsalted butter (113g), melted and cooled slightly",▢ 1½ teaspoons vanilla extract,▢ 1½ teaspoons anise extract (optional),▢ Powdered sugar for serving,NA,NA,NA,NA,Preppy Kitchen,https://preppykitchen.com/pizzelle/,NA,NA,NA,NA,NA,NA,NA,NA
Zimtsterne (Cinnamon Star Cookies),John Kanell,NA,NA,German,30 minutes,25 minutes,NA,5 minutes,20 to 24 cookies,9,"In a large bowl using a handheld mixer (or in the bowl of a stand mixer with the whisk attachment), whisk the egg whites on medium speed for 1 to 2 minutes until soft peaks form. While mixing on medium-low speed, gradually add 1¼ cups (150g) of powdered sugar.
Once all of the sugar is added, scrape down the sides of the bowl and increase the speed to medium-high. Beat for 2 to 3 minutes until the mixture is thick, glossy and leaves a trail that holds its shape on the surface of the mixture for a few seconds when drizzled. Set aside ½ cup of this egg-white mixture in another small bowl (this will be used to ice the cookies later).
In another medium bowl, mix to combine the remaining ½ cup (60g) powdered sugar, ground almonds, cinnamon, lemon zest and salt. Sprinkle this mixture over the large bowl of egg white mixture and add the lemon juice. Fold to combine.
Scrape down the sides of the bowl with a silicone spatula or bowl scraper and knead with your hands to create a ball of dough. (If the dough is sticking to your hands or the bowl, lightly sprinkle with powdered sugar so that you can knead it into a cohesive ball.) Cover and refrigerate for 20 minutes.
Preheat the oven to 250°F. Line 2 large baking sheets with parchment paper.
Generously sprinkle a surface with powdered sugar. Pat the cookie dough into a flat rectangular shape, then lightly sprinkle the top of the dough with more powdered sugar. Using a rolling pin, roll the dough to be ¼-inch thick.
Cut cookies using a 2½-inch to 3-inch wide star-shaped cutter, dipping the cutter in powdered sugar between each cut. Place them on the prepared baking sheets leaving about 1-inch of space between each. Knead together any dough scraps, re-roll and cut. (You can continue to do this until all of the dough is used.)
Dollop ½ to 1 teaspoon of the reserved egg white mixture onto the center of each cookie. Use a very small pastry brush or toothpick to spread the mixture and cover the points of the stars.
Bake one sheet tray at a time for 25 to 30 minutes or until the bottoms just start to turn golden brown and the meringue is dry but not turning brown. Turn off the oven and leave the oven door open about 6 inches for another 10 minutes. Remove the cookies from the oven and transfer them to a wire rack to cool completely. Repeat with the other baking sheet.",7,▢ 2 egg whites (80g),"▢ 1¾ cups confectioners’ sugar (210g), divided",▢ 2¾ cups ground almonds (290g),▢ 2 teaspoons ground cinnamon,▢ 1 teaspoon lemon zest,▢ ¼ teaspoon salt,▢ 1 tablespoon lemon juice,NA,NA,NA,NA,NA,NA,Preppy Kitchen,https://preppykitchen.com/zimtsterne/,NA,NA,NA,NA,NA,NA,NA,NA
Pecan Shortbread Cookies,John Kanell,4.88,75,"British, Scottish",15 minutes,20 minutes,NA,35 minutes,14 cookies,9,"In a stand mixer fitted with a paddle attachment, beat the butter, confectioners’ sugar, vanilla, and salt at low speed just until combined. Increase the speed to medium and beat for about 3 minutes, until fluffy.
In a medium bowl, whisk together the flour and cinnamon.
Add the flour mixture to the butter mixture and beat on low until almost combined. Scrape the sides and bottom of the bowl then add the chopped, toasted pecans. Mix on low until fully combined.
Turn the dough out onto a lightly floured surface and lightly flour your hands. Roll the dough into a log shape, about 2 inches in diameter, then wrap in parchment paper or plastic wrap. Refrigerate for at least 2 hours, or until firm (up to 72 hours).
About 20 minutes before you are ready to bake, place one oven rack in the top third of the oven and one in the bottom third. Preheat the oven to 350°F. Line two large baking sheets with parchment paper.
Remove the cookies from the refrigerator and slice the logs into cookies about ½-inch thick.
Place the cookies on the prepared baking sheets, leaving about 1-inch of space between each.
Bake for 10 minutes, then rotate the baking sheets from the upper to lower racks in the oven and turn them 180 degrees. Bake for another 10 minutes or until golden brown.
Let the cookies rest for about 5 minutes on the sheet tray, before transferring them to a wire rack to cool completely.",7,▢ 10 tablespoons unsalted butter room temperature (140g),▢ ⅔ cup confectioners’ sugar (80g),▢ 2 teaspoons dark rum or vanilla extract,▢ ¾ teaspoon kosher salt,▢ 1½ cups all-purpose flour (180g),▢ ½ teaspoon cinnamon,▢ ¾ cup pecans coarsely chopped toasted (83g),NA,NA,NA,NA,NA,NA,Preppy Kitchen,https://preppykitchen.com/pecan-shortbread-cookies/,NA,NA,NA,NA,NA,NA,NA,NA
Oatmeal Cookies,John Kanell,4.99,64,American,15 minutes,12 minutes,NA,27 minutes,30 cookies,6,"In a medium bowl, whisk together the flour, baking soda, baking powder, salt, and cinnamon.
In a large mixing bowl or the bowl of a stand mixer fitted with the paddle attachment, combine the butter with both sugars. Beat on medium speed until light and fluffy, about 3 minutes
Reduce speed to low. Add the eggs and vanilla, and beat until well mixed, about 1 minute. Add the flour mixture and beat until almost combined. Stir in the oats and the raisins. Scoop the dough into 2 tablespoon-sized balls, cover, and chill for 1 hour or up to 72 hours.
Preheat oven to 350°F. Line two baking sheets with parchment paper.
Place the dough balls about 2 inches apart on the parchment-lined baking sheets.
Bake for 12 to 14 minutes, or until the cookies are golden brown around the edges but still soft in the center. (The centers should still appear wet and shiny but will set up once cooled.) Let cool on the pans for a few minutes, then transfer to a wire rack and let cool completely.",12,▢ 1½ cups all-purpose flour (180g),▢ ¾ teaspoon baking soda,▢ ¼ teaspoon baking powder,▢ ½ teaspoon salt,▢ 1 teaspoon ground cinnamon,▢ 1 cup unsalted butter room temperature (226g),▢ 1 cup packed light brown sugar (220g),▢ ½ cup granulated sugar (100g),▢ 2 large eggs,▢ 2 teaspoons vanilla extract,▢ 2½ cups old-fashioned rolled oats (280g),▢ 1 cup raisins (or other mixins) (160g),NA,Preppy Kitchen,https://preppykitchen.com/oatmeal-cookies/,NA,NA,NA,NA,NA,NA,NA,NA
Pumpkin Snickerdoodles,John Kanell,5,19,American,20 minutes,10 minutes,NA,NA,18 cookies,8,"In a small bowl, whisk together the sugar and cinnamon. Set aside.
Preheat the oven to 375°F. Line two baking sheets with parchment paper.
In a large bowl, whisk together flour, spices, baking soda, cream of tartar, and salt.
In the bowl of a stand mixer with the paddle attachment, beat butter on medium speed until smooth. Add the sugars and beat until light and fluffy, about 3 minutes.
Add the pumpkin purée, egg yolk and vanilla, and beat until combined, scraping down the sides as needed.
With the mixer on low, slowly add in the flour mixture. Mix just until combined. Cover and chill for at least 30 minutes or up to 24 hours. (Do not skip this step. The dough won’t roll in your hands if it isn’t chilled.)
Scoop 1½ tablespoons (32g) of chilled dough and drop it into the cinnamon sugar. Roll in the cinnamon sugar until well coated, then roll into a ball between your palms. Place balls 3 inches apart on the prepared baking sheets.
Bake for about 10 minutes or until puffed and golden on the edges. Let cool on the baking sheet for 5 minutes then transfer to a wire rack and cool completely.",14,▢ ¼ cup granulated sugar (50g),▢ 1 teaspoon cinnamon or pumpkin pie spice,▢ 1¾ cups all-purpose flour (210g),▢ 1 teaspoon pumpkin pie spice,▢ 1 teaspoon ground cinnamon,▢ ¾ teaspoon cream of tartar,▢ ½ teaspoon baking soda,▢ ½ teaspoon salt,▢ ½ cup unsalted butter softened (113g/1 stick),▢ ½ cup light brown sugar (110g),▢ ½ cup granulated sugar (100g),▢ ⅓ cup pumpkin purée (82g),▢ 1 egg yolk,Preppy Kitchen,https://preppykitchen.com/pumpkin-snickerdoodles/,▢ 2 teaspoons vanilla extract,NA,NA,NA,NA,NA,NA,NA
Alfajores,John Kanell,4.97,89,latin,15 minutes,10 minutes,NA,25 minutes,36 cookies,9,"In a large bowl, whisk to combine the cornstarch, flour, salt, and baking powder, then set aside.
To the bowl of a stand mixer fitted with a paddle attachment (or a large bowl if using a hand mixer), add the softened butter, and sugar. Beat on medium speed for about 3 minutes or until light and fluffy.
Add the egg yolks and vanilla extract, then mix for 1 minute until combined. Scrape down the bottom and sides of the bowl with a rubber spatula and mix once more.
Add the flour mixture all at once. Mix on low speed for 30 seconds until just combined. Scrape the bowl down one last time and mix for a few seconds more.
Transfer the dough to a piece of plastic wrap and flatten it into one or two disks. Wrap well and chill for about 1 hour.
Preheat the oven to 350°F and bring the dough out onto the countertop to warm up for a few minutes.
Lightly flour the surface and the top of the dough. With a rolling pin, roll the dough to be ¼ to ⅛-inch thick. Use a 1¾ to 2-inch round cookie cutter to cut the dough into circles. Place the cookies on parchment or silicone-lined baking sheets. Re-roll any excess dough and cut or freeze for later.
Bake for about 10- 12 minutes, until the cookies are just set, and start to turn light brown on the edges, rotating the pans halfway through. Allow to cool on the baking sheet before assembling.
Once the cookies are cool, pipe or spread a dollop of dulce de leche onto the back of a cookie and sandwich it to the bottom of another cookie. Roll the edges of the cookie in shredded coconut and repeat the assembly for the remaining cookies.",10,▢ 1¼ cup cornstarch (180g),▢ 1 cup all-purpose flour (120g),▢ 1 teaspoon baking powder,▢ ¼ teaspoon salt,"▢ ¾ cup unsalted butter (170g), room temperature",▢ ⅔ cup granulated sugar (133g),▢ 3 egg yolks,▢ 2 teaspoons vanilla extract,▢ 1 (13.4-ounce) can dulce de leche (380g),▢ ⅓ cup shredded coconut unsweetened,NA,NA,NA,Preppy Kitchen,https://preppykitchen.com/alfajores/,NA,NA,NA,NA,NA,NA,NA,NA
