title,author,dateinfo,description,rating,ratingnum,preptime,cooktime,customtime,totaltime,yield,numberofsteps,actualsteps,totalingredients,ingredient1,ingredient2,ingredient3,ingredient4,ingredient5,ingredient6,ingredient7,ingredient8,ingredient9,ingredient10,source,link,ingredient11,ingredient12,ingredient13,ingredient14,ingredient15,ingredient16,ingredient17,ingredient18,ingredient19,ingredient20,ingredient21,ingredient22,ingredient23,ingredient24
Sweet Vanilla Bean Biscotti,Sally McKenney,Updated: 04/09/2025,"A twice-baked cookie with a deliciously crunchy bite, these vanilla biscotti have sweet vanilla flavor and taste exceptionally indulgent with a dip in white chocolate.",4.6,29,40 minutes,45 minutes,NA,"1 hour, 25 minutes",18 cookies,7,"Preheat oven to 350°F (177°C). Line two large baking sheets with parchment paper or silicone baking mats. Set aside.
Whisk the flour, sugar, baking powder, and salt together in a large bowl until combined. Using a pastry cutter or fork, cut in the butter until the mixture is crumbly. Set aside. In a medium bowl, whisk the 3 eggs, oil, and vanilla extract together. Pour into the flour/butter mixture and gently mix together with a wooden spoon or silicone spatula until everything is just barely moistened. It will be very crumbly, see photo above for a visual.
Turn dough out onto a lightly floured surface and with floured hands, knead lightly until the dough is soft and slightly sticky, about 8-10 times. If it’s sticking all over your hands, knead 1-2 more Tablespoon(s) of flour into the dough. Divide the dough in two and place each half onto a baking sheet. Shape each half into an 8-9 inch long slab, patting down until each is about 1/2 inch thick. Using a pastry brush, lightly brush the top and sides of each biscotti slab with egg wash.
Bake in batches (or together) for 25-26 minutes, or until the top and sides of the biscotti slabs are lightly browned. Remove from the oven, but do not turn off the heat. Allow to cool for 10 minutes. Once the slabs are cool enough to handle, cut each into 1 inch wide slices. Set slices cut sides upright, ¼ inch apart, on the baking sheets. (It’s tricky to set the end slices upright, so just turn them over.) Return to the oven to continue baking for 8 minutes. Turn biscotti over and bake other side for 8 minutes. The cookies will be slightly soft in the centers with harder edges.
Remove from the oven and cool the biscotti for 5 minutes on the baking sheet. Transfer to a wire rack to cool completely before dipping in white chocolate. The biscotti becomes more and more crunchy as it cools. It’s helpful to save the baking sheets for the next step.
Optional White Chocolate: Melt the chopped white chocolate in a double boiler or carefully use the microwave. For the microwave, place the white chocolate in a medium heat-proof bowl. Melt in 15 second increments, stirring after each increment until completely melted and smooth. Dip each cookie in the melted chocolate and place back onto the baking sheets. Allow chocolate to set in the refrigerator or at room temperature.
Biscotti stays fresh covered at room temperature or in the refrigerator for 1-2 weeks.",10,"2 and 1/4 cups (281g) all-purpose flour (spooned & leveled), plus more for work surface + hands",1 cup (200g) vanilla sugar or granulated sugar* (see note before starting),1 teaspoon baking powder,1/2 teaspoon salt,"1/4 cup (4 Tbsp; 56g) unsalted butter, cold and cubed",3 large eggs,1 Tablespoon (15ml) vegetable oil or melted coconut oil,2 teaspoons pure vanilla extract,egg wash: 1 large egg beaten with 1 Tablespoon (15ml) milk,"optional: two 4 ounce (226g) white chocolate bars, coarsely chopped*",Sally's Baking Addiction,https://sallysbakingaddiction.com/sweet-vanilla-bean-biscotti/,NA,NA,NA,NA,NA,NA,NA,NA,NA,NA,NA,NA,NA,NA
Brownie Cookies,Sally McKenney,Updated: 04/11/2025,"These are extra rich, extra fudge-like, and extra chewy brownie cookies. For best results, use good chocolate and follow this recipe closely.",4.8,142,15 minutes,12 minutes,NA,50 minutes (includes chilling),24 cookies,9,"Melt the chocolate in a double boiler or use the microwave. Microwave in 20 second increments, stirring after each until completely melted. Set aside to slightly cool (so it doesn’t melt the butter or cook the eggs).
Whisk the flour, cocoa powder, espresso powder, baking powder, and salt together. Set aside.
In a large bowl using a handheld or stand mixer fitted with a paddle attachment, beat the butter, brown sugar, and granulated sugar together on medium-high speed until smooth and creamy, about 3 minutes. (Here’s a helpful tutorial if you need guidance on how to cream butter and sugar.) Add the eggs and vanilla extract, and beat on high speed for 2 full minutes. Scrape down the sides and up the bottom of the bowl, then beat on high for 1 more minute. Pour in the slightly cooled melted chocolate and mix on medium-high speed for 2 full minutes.
Pour in the the dry ingredients and beat on low speed until combined. Finally, beat in the chocolate chips.
Preheat oven to 350°F (177°C). Line large baking sheets with parchment paper or silicone baking mats. As the oven preheats, continue to step 6.
Cover and chill the dough in the refrigerator for just 20 minutes as the oven preheats. This quick chill time helps slightly solidify the chocolate and butter in the dough, which gives the cookies a nice spread (not over-spread). Chilling for longer creates thicker cookies where, in some cases, they may not spread at all. If chilling for longer than 20 minutes, allow the dough to sit at room temperature for 15 minutes before rolling and baking.
Roll or scoop the dough into balls, 1.5 Tablespoons of dough each. I recommend a medium cookie scoop. Place 3 inches apart on the baking sheets and bake for 12-13 minutes or until the edges appear set. (The centers will be quite soft, but will set up as the cookies cool.)
Remove from the oven and allow cookies to cool on the baking sheet for 5 minutes before transferring to a wire rack to cool completely.
Cookies stay fresh covered at room temperature for up to 1 week.",12,"2 four ounce bars (226g) semi-sweet chocolate, coarsely chopped",3/4 cup (94g) all-purpose flour (spooned & leveled),1/4 cup (21g) natural unsweetened or dutch-process cocoa powder,1 teaspoon espresso powder,1 teaspoon baking powder,1/4 teaspoon salt,"5 Tablespoons (71g) unsalted butter, softened to room temperature",3/4 cup (150g) packed light brown sugar,1/4 cup (50g) granulated sugar,"2 large eggs, at room temperature",Sally's Baking Addiction,https://sallysbakingaddiction.com/brownie-cookies/,1 teaspoon pure vanilla extract,optional: 3/4 cup (135g) semi-sweet chocolate chips,NA,NA,NA,NA,NA,NA,NA,NA,NA,NA,NA,NA
Apricot Cream Cheese Thumbprint Cookies,Sally McKenney,Updated: 04/11/2025,"These thumbprint-style apricot cream cheese cookies include cream cheese in the dough, so they’re extra tender and soft. They’re flavored with almond extract and refreshing lemon zest, rolled in sliced almonds for a little crunch, and filled with apricot jam.",4.6,34,45 minutes,15 minutes,NA,4 hours (includes chilling),40 cookies,9,"Whisk the flour, baking soda, and salt together in a medium bowl. Set aside.
In a large bowl using a hand mixer or a stand mixer fitted with a paddle attachment, beat the cream cheese on medium-high speed until completely smooth and creamy. Add the butter and beat until combined, scraping down the sides and up the bottom of the bowl as needed. Add granulated sugar and beat on medium-high speed until smooth and creamy, about 2 minutes. (Here’s a helpful tutorial if you need guidance on how to cream butter and sugar.) Add the egg, lemon zest, vanilla extract, and almond extract and beat on high speed until combined, about 1 minute. Scrape down the sides and up the bottom of the bowl and beat again as needed to combine.
Add the flour mixture to the wet ingredients and beat on low until combined. Dough will be very creamy, sticky, and soft. Cover and chill the dough for at least 3 hours (and up to 4 days) in the refrigerator.
Preheat oven to 350°F (177°C). Line large baking sheets with parchment paper or silicone baking mats.
Remove dough from the refrigerator and roll into balls, 1 Tablespoon of dough each. Dough gets sticky as you roll, so feel free to lightly dust your hands with all-purpose flour or confectioners’ sugar as you work. Roll each ball into sliced almonds. Arrange 3 inches apart on the baking sheets. Indent your thumb or the bottom end of a silicone spatula or wooden spoon into the center of each dough ball to make a crevice. Spoon a heaping 1/2 teaspoon jam/preserves into each indent. *These cookies do have the tendency to spread especially if the dough has been sitting out and handled long enough before baking. Placing the shaped thumbprints in the refrigerator for 10 minutes before baking helps. You can place the entire baking sheet in the refrigerator, then place in the oven to bake.*
Bake for 14-15 minutes or until lightly browned on the sides. The jam won’t look completely set, but will set as the cookies cool.
Remove from the oven. Allow cookies to cool on the baking sheet for 5 minutes before transferring to a wire rack to cool completely.
Once cool, dust the cookies with confectioners’ sugar. Sugar usually melts into the jam centers, but remains on the cookie edges.
Cookies stay fresh covered at room temperature for 2 days or in the refrigerator for up to 1 week.",13,2 and 1/2 cups (313g) all-purpose flour (spooned & leveled),1 teaspoon baking soda,1/4 teaspoon salt,"6 ounces (170g) full-fat brick cream cheese, softened to room temperature","1/2 cup (8 Tbsp; 113g) unsalted butter, softened to room temperature",1 cup (200g) granulated sugar,"1 large egg, at room temperature",1 teaspoon lemon zest,1 teaspoon pure vanilla extract,1/2 teaspoon almond extract,Sally's Baking Addiction,https://sallysbakingaddiction.com/apricot-cream-cheese-cookies/,6–7 Tablespoons (120-140g) apricot jam or preserves*,optional: 3/4 cup (95g) sliced almonds,optional: 3 Tablespoons (23g) confectioners’ sugar for dusting,NA,NA,NA,NA,NA,NA,NA,NA,NA,NA,NA
Cinnamon Brown Sugar Stamped Cookies,Sally McKenney,Updated: 04/11/2025,"Sweetened mostly with brown sugar and spiced with cinnamon, ginger, nutmeg, and cardamom, these stamped cookies are just as flavorful as they are beautiful. Chill the cookie dough in the refrigerator for at least 2 hours. Feel free to skip the cookie stamp and bake them as round cookie dough balls.",4.5,60,"2 hours, 30 minutes (includes chilling)",13 minutes,NA,3 hours (includes cooling),32 cookies,8,"Whisk the flour, baking soda, salt, cinnamon, nutmeg, ginger, and cardamom together in a medium bowl. Set aside.
Using a hand mixer or a stand mixer fitted with paddle attachment, beat the softened butter, brown sugar, and granulated sugar together on medium-high speed until creamy, about 3 minutes. (Here’s a helpful tutorial if you need guidance on how to cream butter and sugar.) Scrape down the sides and bottom of the bowl as needed. Add the molasses, egg, and vanilla extract and mix on high speed until combined, about 1 minute. Scrape down the sides and bottom of the bowl again as needed.
Add the flour mixture to the wet ingredients, then mix on low speed until combined. Cover and chill the dough in the refrigerator for at least 2 hours (and up to 4 days). If chilling for longer than a few hours, allow to sit at room temperature for at least 15 minutes before rolling because the dough will be quite hard.
Preheat oven to 350°F (177°C). Line baking sheets with parchment paper or silicone baking mats. Set aside.
Roll and stamp: Measure 1 Tablespoon (20g) of chilled cookie dough per cookie and roll into balls. The dough may seem crumbly, but will come together as you roll. Arrange dough balls 3 inches apart on the baking sheets. Place the cookie stamp directly on top of each cookie dough ball, centering the ball as best as you can, then firmly press down until the dough extends nearly to the edges of the cookie stamp. Lift straight up. If your cookie dough is sticking to the cookie stamp (mine does!), lightly dip the cookie stamp in a bowl of flour before stamping the cookie dough ball. If dipped lightly, the flour bakes right off the cookie.
Bake cookies until the edges are set, about 13 minutes.
Remove from the oven and allow cookies to cool on the baking sheet for 5 minutes before transferring to a wire rack to cool completely.
Cover leftover cookies tightly and store at room temperature for up to 1 week.",13,"2 cups (250g) all-purpose flour (spooned & leveled), plus extra as needed for stamping",1/2 teaspoon baking soda,1/2 teaspoon salt,2 and 1/2 teaspoons ground cinnamon,1/2 teaspoon ground nutmeg,1/2 teaspoon ground ginger,1/4 teaspoon ground cardamom,"1/2 cup (8 Tbsp; 113g) unsalted butter, softened to room temperature",3/4 cup (150g) packed light or dark brown sugar,1/3 cup (65g) granulated sugar,Sally's Baking Addiction,https://sallysbakingaddiction.com/cinnamon-brown-sugar-stamped-cookies/,"1 Tablespoon (15ml) unsulphured or dark molasses (do not use blackstrap; I prefer Grandma’s brand), maple syrup, or honey","1 large egg, at room temperature",1 teaspoon pure vanilla extract,NA,NA,NA,NA,NA,NA,NA,NA,NA,NA,NA
Almond Butter Coconut Macaroons (GF),Sally McKenney,Updated: 04/11/2025,"Made from only 6 ingredients, these naturally gluten free almond butter coconut macaroons are soft and moist in the centers with extra chewy edges. We love them with chocolate and sea salt on top.",4.8,18,15 minutes,20 minutes,NA,1 hour (includes cooling),26 cookies,7,"Preheat oven to 325°F (163°C). Line large baking sheets with parchment paper or silicone baking mats. Set aside.
Make the macaroons: Pulse the coconut and almond flour together in a food processor or blender until the coconut is finely chopped and the two are combined, about 10-12 pulses. Add the almond butter and pulse until mixture is moistened and combined, about 10 more pulses. Set aside until the end of the next step.
In a large bowl using a handheld or stand mixer with a whisk attachment, beat the egg whites, sugar, and vanilla extract together on high speed until creamy and thickened and the sugar has mostly dissolved, at least 4-5 minutes. See photo above for a visual. (Should look like thinned out marshmallow creme.) Using a silicone spatula or your mixer on medium speed, fold/beat in the coconut almond mixture until combined and the coconut is evenly moistened. Dough is wet and sticky.
Using a medium cookie scoop or a spoon, scoop 1.5 Tablespoons of the mixture and arrange on prepared baking sheets at least 3 inches apart.
Bake until lightly golden brown around the edges, about 20 minutes. Cool for 10 minutes on the baking sheets, then transfer to a wire rack to cool completely.
Optional Topping: Melt the chopped chocolate in a double boiler or use the microwave. For the microwave, place the chocolate in a medium heat-proof bowl or use a glass liquid measuring cup. Melt in 15 second increments, stirring after each increment until completely melted and smooth. Drizzle on cooled cookies. Sprinkle each with sea salt, if desired. Allow chocolate to set in the refrigerator or at room temperature.
Macaroons stay fresh covered at room temperature for up to 3 days or in the refrigerator for up to 1 week.",7,14-ounce (396g) package sweetened shredded coconut (about 5 cups),1/3 cup (35g) almond flour,1/2 cup (128g) almond butter,"4 large egg whites, at room temperature",1/2 cup (100g) granulated sugar,1 teaspoon pure vanilla extract,optional topping: 4-ounce (113g) semi-sweet chocolate bar + flaky sea salt,NA,NA,NA,Sally's Baking Addiction,https://sallysbakingaddiction.com/almond-butter-coconut-macaroons/,NA,NA,NA,NA,NA,NA,NA,NA,NA,NA,NA,NA,NA,NA
Mint Chocolate Checkerboard Cookies,Sally McKenney,Updated: 04/11/2025,"Developed from the same cookie dough used for my neapolitan cookies, these mint chocolate checkerboard cookies are styled and shaped to resemble a checkerboard pattern. It all starts from 1 basic cookie dough! For best success, read through the recipe and notes before beginning because there are a couple chilling and shaping steps.",4.7,42,"4 hours, 45 minutes (includes chilling)",13 minutes,NA,5 hours,24-36 cookies,14,"Make the dough: Whisk the flour, baking powder, and salt together in a medium bowl. Set aside.
In a large bowl using a hand mixer or a stand mixer fitted with a paddle attachment, beat the butter and granulated sugar together on medium-high speed until creamed, about 3 minutes. (Here’s a helpful tutorial if you need guidance on how to cream butter and sugar.) Add the egg, egg yolk, and vanilla extract and beat on high speed until combined, about 1 minute. Scrape down the sides and up the bottom of the bowl and beat again as needed to combine.
Add the dry ingredients to the wet ingredients and mix on low until combined. Dough will be thick and sticky. Remove from the mixing bowl. No need to rinse out the mixing bowl.
Divide the dough in half: There’s almost 4 cups of dough. Divide in half, a bit less than 2 cups each.
Make the mint dough: Place half of the dough back into the mixing bowl. Add the mint dough ingredients. I recommend starting with 1 small drop of green food coloring. Beat on low speed until dough is combined. Add another small drop of food coloring if desired. For the pictured cookies, I used 1 drop of leaf green gel food coloring. Remove from the mixing bowl. No need to rinse out the mixing bowl, but feel free to wipe clean.
Make the chocolate dough: Place other half of dough back into the mixing bowl. Add all of the chocolate dough ingredients. Beat on low speed until dough is combined.
Shape & chill cookie dough for just 1 hour: Place doughs on a lightly floured work surface. It’s sticky, so do your best in this step. With lightly floured hands, carefully form both doughs into a 6 inch long rectangle block, 2 inches tall and 2 inches wide. Wrap both dough blocks up in plastic wrap or place on a plate and cover with aluminum foil. Refrigerate for just 1 hour. The *key* is to only refrigerate until the dough is less sticky, but still pliable enough to bend and shape. Chilling any longer will make it difficult to form a neat checkerboard pattern. If you need to chill it for longer than 1 hour, make sure you let it sit at room temperature for 15-30 minutes before continuing with the next step.
Shape the dough: See photos in the blog post above for visuals of this step. Remove doughs from refrigerator and unwrap. Using a sharp knife, cut each block lengthways into 3 even strips. Then cut each strip into thirds again. You’ll have 9 thin strips from each dough block. My strips are usually a little uneven and messy, so for a neat checkerboard pattern, I always trim off* any rounded edges. Place 1 mint dough strip on your work surface. Line up a chocolate dough strip next to it. Line up a mint dough strip next to that. Top each with a row of alternating flavored dough strips, then top that with another row of alternating dough strips. Repeat with 2nd block, starting with a chocolate dough strip this time. As you’re working, press the strips tightly together to rid any gaps. (This is why it’s important the doughs are still a bit soft and pliable.) If desired to keep the checkerboard pattern neat, trim off* any rounded edges of your blocks.
Chill for 2 more hours: Wrap each block of dough back up or cover and refrigerate for 2 more hours and up to 4 days.
Preheat oven to 350°F (177°C). Line 2 baking sheets with parchment paper or silicone baking mats. Set aside.
Slice and bake: Slice each block into 12 1/2-inch thick cookies. For thinner cookies, slice each block into 18 cookies, about 1/3-inch thick. (Bake time will be about 1 minute shorter.) Trim the cookie edges* to make neat squares, if desired.
Arrange cookies 2-3 inches apart on the baking sheets. If desired, brush each lightly with egg wash (see recipe note) and sprinkle with coarse sugar. Bake for 12-14 minutes or until very lightly browned around the edges.
Remove from the oven and allow cookies to cool on the baking sheet for 5 minutes before transferring to a wire rack to cool completely.
Cookies stay fresh covered at room temperature for 1 week.",13,2 and 1/2 cups (313g) all-purpose flour (spooned & leveled),1/2 teaspoon baking powder,1/2 teaspoon salt,"1 cup (16 Tbsp; 226g) unsalted butter, softened to room temperature",1 cup (200g) granulated sugar,"1 large egg + 1 egg yolk, at room temperature* (save extra egg white)",1 and 1/2 teaspoons pure vanilla extract,optional for topping: 1 Tablespoon (15ml) water and 1/4 cup (50g) coarse sugar,1 teaspoon peppermint extract,optional: 1 drop green food dye,Sally's Baking Addiction,https://sallysbakingaddiction.com/mint-chocolate-checkerboard-cookies/,2 Tablespoons (10g) unsweetened natural or dutch-process cocoa powder,1 Tablespoon (15ml) milk,optional: 1 teaspoon espresso powder,NA,NA,NA,NA,NA,NA,NA,NA,NA,NA,NA
Gingerbread Whoopie Pies,Sally McKenney,Updated: 04/11/2025,These gingerbread whoopie pies combine soft ginger molasses cookies with cool and creamy cream cheese filling. Chilling the cookie dough is an important step because the cookies will spread out and crisp up otherwise—don’t skip it.,4.8,46,"2 hours, 45 minutes (includes chilling)",14 minutes,NA,"3 hours, 30 minutes (includes cooling)",12 sandwiches,9,"Whisk the flour, ginger, cinnamon, nutmeg, cloves, baking soda, baking powder, and salt together.
Whisk the molasses and hot water together. Give it a minute to slightly cool down, then whisk in the sugar and oil. Finally, whisk in the egg. Pour these wet ingredients into the flour mixture. Fold everything together with a silicone spatula or wooden spoon until combined—or use a mixer on medium speed. (It’s a bit too heavy for a whisk.) Dough/batter is heavy and looks a bit oily.
Cover the dough and chill in the refrigerator for at least 2 hours and up to 2 days.
Preheat the oven to 350°F (177°C). Line large baking sheets with parchment paper or silicone baking mats. Set aside.
Spoon or scoop mounds of batter, a scant 1 and 1/2 Tablespoons each, onto prepared baking sheets about 3 inches apart.
Bake the cookies for 13-14 minutes or until the edges appear set. Remove from the oven and allow cookies to cool on the baking sheet for 5 minutes before transferring to a wire rack to cool completely. Make the filling as they cool.
Make the filling: In a large bowl using a handheld or stand mixer fitted with a paddle or whisk attachment, beat the cream cheese on high speed until completely smooth and creamy, about 2 minutes. Add the butter and beat until smooth and combined. Add the confectioners’ sugar, vanilla, and spices, then beat on medium speed until combined. Taste. Add a pinch more of the spices if desired.
Pair the cookies up based on their size. Spread or pipe (I used Wilton 1A piping tip) the frosting onto the flat side of one cookie and sandwich with the other. Repeat with remaining cookies.
Cover leftover whoopie pies and store in the refrigerator for up to 1 week.",18,2 and 1/4 cups (281g) all-purpose flour (spooned & leveled),2 teaspoons ground ginger,2 teaspoons ground cinnamon,1/2 teaspoon ground nutmeg,1/2 teaspoon ground cloves,1 teaspoon baking soda,1/2 teaspoon baking powder,1/2 teaspoon salt,6 Tablespoons (90ml) unsulphured or dark molasses (do not use blackstrap; I prefer Grandma’s brand),1/4 cup (60ml) hot water,Sally's Baking Addiction,https://sallysbakingaddiction.com/gingerbread-whoopie-pies/,2/3 cup (130g) granulated sugar,1/2 cup (120ml) vegetable oil,"1 large egg, at room temperature","6 ounces (170g) full-fat brick cream cheese, softened to room temperature","1/4 cup (4 Tbsp; 56g) unsalted butter, softened to room temperature","1 and 1/2 cups (180g) confectioners’ sugar, sifted",1/2 teaspoon pure vanilla extract,"small pinch of each: ground ginger, ground cinnamon, ground nutmeg, ground cloves (see note)",NA,NA,NA,NA,NA,NA
