title,author,dateinfo,description,rating,ratingnum,preptime,cooktime,customtime,totaltime,yield,numberofsteps,actualsteps,totalingredients,ingredient1,ingredient2,ingredient3,ingredient4,ingredient5,ingredient6,ingredient7,ingredient8,ingredient9,ingredient10,source,link,ingredient11,ingredient12,ingredient13,ingredient14,ingredient15,ingredient16,ingredient17,ingredient18,ingredient19,ingredient20,ingredient21,ingredient22,ingredient23,ingredient24
Chocolate Whoopie Pies with Salted Caramel Frosting,Sally McKenney,Updated: 01/13/2022,"Sweet, salty, and rich, these chocolate whoopie pies with salted caramel frosting satisfy all your dessert cravings!",4.4,9,40 minutes,12 minutes,NA,"1 hour, 10 minutes",15 whoopie pies,8,"Preheat the oven to 350°F (177°C). Line two large baking sheets with parchment paper or silicone baking mats. Set aside.
Whisk the flour, cocoa powder, baking soda, and salt together.
In a large bowl using a hand-held or stand mixer fitted with a paddle attachment, beat the butter for 1 minute on medium-high speed until completely smooth and creamy. Add the brown sugar and beat on medium high speed until fluffy and combined. Beat in the egg and vanilla on high speed, scraping down the sides and bottom of the bowl as needed to combine.
On low speed, add half of the dry ingredients to the wet ingredients. Then add half of the buttermilk. Repeat with the remaining dry ingredients and buttermilk until everything is added. Beat on medium speed until combined. It will be a thick, tacky, and sticky cake batter.
Scoop mounds of batter, about 1 and 1/2 Tablespoons each, onto prepared baking sheets—about 3 inches apart.
Bake the cookies for 10-12 minutes or until the tops spring back when touched. Mine usually take 11 minutes. Allow to cool completely before sandwiching. Make the frosting as they cool.
Make the frosting: Melt the butter in a small saucepan over medium heat. Once melted, add brown sugar and 2 Tablespoons of heavy cream. Whisk constantly until sugar is dissolved. Add salt. Allow to bubble for about 2-3 minutes, whisking every 30 seconds. Remove from heat, pour into a heat-proof mixing bowl, and allow to cool for about 30 minutes. With a hand or stand mixer fitted with a whisk attachment, beat in 2 cups confectioners’ sugar and 3 more Tablespoons of heavy cream. Slowly add 1/4 cup – 1/2 cup more confectioners’ sugar until you reach the desired consistency. Add 1 more Tablespoon heavy cream if you find the frosting too thick. (Or more if it’s much too thick!)
Pair the cookies up based on their size. Spread the frosting onto the flat side of one cookie and sandwich with the other. Repeat with remaining. Cover leftover whoopie pies and store in the refrigerator for up to 1 week.",14,2 cups (250g) all-purpose flour (spooned & leveled),6 Tablespoons (32g) unsweetened natural cocoa powder,1 and 1/4 teaspoons baking soda,1/2 teaspoon salt,"1/2 cup (8 Tbsp; 113g) unsalted butter, softened to room temperature",1 cup (200g) packed light brown sugar,"1 large egg, at room temperature",1 and 1/2 teaspoons pure vanilla extract,"1 cup (240ml) buttermilk, at room temperature*","1/2 cup (8 Tbsp; 113g) unsalted butter, softened to room temperature",Sally's Baking Addiction,https://sallysbakingaddiction.com/chocolate-whoopie-pies-with-salted-caramel-frosting/,1 cup (200g) packed light brown sugar,"5 – 6 Tablespoons heavy cream, divided*",1/4 teaspoon salt,"2 and 1/2 cups (240-300g) confectioners’ sugar, sifted",NA,NA,NA,NA,NA,NA,NA,NA,NA,NA
Blueberry Banana Breakfast Cookies,Sally McKenney,Updated: 12/23/2022,Blueberry banana breakfast cookies are packed with 9 happy and wholesome ingredients to power you through the day.,4.9,44,5 minutes,20 minutes,NA,45 minutes,12 cookies,6,"Preheat oven to 325°F (163°C). Line two large baking sheets with parchment paper or silicone baking mats. Set aside.
Add everything to a large bowl and mix together with a silicone spatula or wooden spoon until combined (or use a handheld or stand mixer).
Scoop mounds of dough, about 1/4 cup each, onto baking sheets. 6 cookies per baking sheet since they are so large. The cookies won’t spread much in the oven, so gently press the mounds down to create a flatter shape.
Bake for 18-21 minutes until lightly browned on the sides.
Remove from the oven and let cool on baking sheet for 5 minutes before transferring to a wire rack to cool completely.
Cover and store cookies at room temperature for up to 4 days or in the refrigerator for up to 1 week.",9,3/4 cup (173g) mashed bananas (about 3 medium or 2 large ripe bananas)*,2 and 1/2 cups (213g) old-fashioned whole rolled oats*,1 cup (250g) any nut butter (I use almond butter),1/2 cup (60g) chopped pecans or walnuts*,1/3 cup (113g) honey*,1 teaspoon pure vanilla extract,1/2 teaspoon ground cinnamon,1/4 teaspoon salt,1 cup (140g) fresh or frozen blueberries (do not thaw frozen),NA,Sally's Baking Addiction,https://sallysbakingaddiction.com/blueberry-banana-breakfast-cookies/,NA,NA,NA,NA,NA,NA,NA,NA,NA,NA,NA,NA,NA,NA
Cinnamon Roll Cookies,Sally McKenney,Updated: 01/14/2022,"These simple, sweet, and irresistible cinnamon roll cookies are made from sugar cookie dough!",4.5,48,"2 hours, 20 minutes",10 minutes,NA,"2 hours, 40 minutes",about 36 cookies,10,"Make the dough: Whisk the flour, baking powder, and salt together in a medium bowl. Set aside.
In a large bowl using a handheld or a stand mixer fitted with a paddle attachment, beat the butter and sugar together on high speed until completely smooth and creamy, about 2 minutes. Add the egg and vanilla and beat on high speed until combined, about 1 minute. Scrape down the sides and up the bottom of the bowl and beat again as needed to combine.
Add the dry ingredients to the wet ingredients and mix on low until combined. Dough will be a bit soft. If the dough seems too soft and sticky for rolling, add 1 more Tablespoon of flour.
Shape and fill: Divide the dough into 2 equal parts. Roll each portion out in a rectangle (about 9×7 inches) onto a floured silicone baking mat (or floured parchment paper) to about 1/4″ thickness. Spread 1 Tablespoon of melted butter onto each rectangle. Mix the granulated sugar and cinnamon together then sprinkle evenly over each.
Working slowly, tightly roll up each rectangle into a 9-inch log. If the dough is cracking at all, use your fingers to smooth it out. Some cracks are OK. Chill the logs of dough for at least 2 hours (or freeze up to 3 months). What I like to do is carefully transfer the logs to a cutting board or plate and cover loosely with plastic wrap.
Preheat oven to 350°F (177°C). Line a large baking sheet with parchment paper or a silicone baking mat.
Remove dough logs from the refrigerator. Cut into 1/2 inch slices. Place slices onto baking sheets about 2 inches apart.
Bake for 10-11 minutes, until lightly browned on the sides. Remove from the oven, allow to cool on the baking sheet for 5 minutes, then transfer to a wire rack to cool completely before icing.
Make the icing: Whisk all of the icing ingredients together. Drizzle over cookies.
Cover and store cookies at room temperature for up to 5 days.",13,"2 and 1/4 cups (281g) all-purpose flour (spooned & leveled), plus more as needed for rolling and work surface",1/2 teaspoon baking powder,1/4 teaspoon salt,"3/4 cup (12 Tbsp; 170g) unsalted butter, softened to room temperature",3/4 cup (150g) granulated sugar,"1 large egg, at room temperature",2 teaspoons pure vanilla extract,"2 Tablespoons (28g) butter, melted and slightly cooled",1/4 cup (50g) granulated sugar,1 Tablespoon ground cinnamon,Sally's Baking Addiction,https://sallysbakingaddiction.com/cinnamon-roll-cookies/,1 cup (120g) confectioners’ sugar,3 Tablespoons (45ml) milk,1/2 teaspoon pure vanilla extract,NA,NA,NA,NA,NA,NA,NA,NA,NA,NA,NA
Maple Cinnamon Star Cookies,Sally McKenney,Updated: 04/06/2022,Flavorful maple cinnamon star cookies are made from a basic and easy sugar cookie dough. Dunk in white chocolate for an extra special treat!,4.8,17,2 hours,11 minutes,NA,"2 hours, 45 minutes",about 28 3-inch stars,9,"Whisk the flour, cinnamon, baking powder, and salt together in a medium bowl. Set aside.
In a large bowl using a handheld or a stand mixer fitted with a paddle attachment, beat the butter and sugar together on high speed until completely smooth and creamy, about 2 minutes. Add the egg, maple extract, and vanilla extract and beat on high speed until combined, about 1 minute. Scrape down the sides and bottom of the bowl and beat again as needed.
Add the dry ingredients to the wet ingredients and mix on low until combined. Dough will be a bit soft. If the dough seems too soft and sticky for rolling, add 1 more Tablespoon of flour.
Divide the dough into 2 equal parts. Place each portion onto a piece of lightly floured parchment paper or a lightly floured silicone baking mat. With a lightly floured rolling pin, roll the dough out to about 1/4-inch thickness. Use more flour if the dough seems too sticky. The rolled-out dough can be any shape, as long as it is evenly 1/4-inch thick.
Lightly dust one of the rolled-out doughs with flour. Place a piece of parchment on top. (This prevents sticking.) Place the 2nd rolled-out dough on top. Cover with plastic wrap or aluminum foil, then refrigerate for at least 1-2 hours and up to 2 days.
Once chilled, preheat oven to 350°F (177°C). Line 2-3 large baking sheets with parchment paper or silicone baking mats. Carefully remove the top dough piece from the refrigerator. If it’s sticking to the bottom, run your hand under it to help remove it. Using a cookie cutter, cut into star shapes. Transfer the cut cookie dough to the prepared baking sheet. Re-roll the remaining dough and continue cutting until all is used. Repeat with 2nd piece of dough. (Note: It doesn’t seem like a lot of dough, but you get a lot of cookies from the dough scraps you re-roll.)
Before baking, top with sprinkles. Use a spoon to press the sprinkles into the cookies so they stay secure on top.
Bake for 11-12 minutes, until lightly browned around the edges. If your oven has hot spots, rotate the baking sheet halfway through bake time. Allow to cool on the baking sheet for 5 minutes, then transfer to a wire rack to cool completely before dipping into chocolate.
If using, melt the chopped white chocolate in the microwave in 20 second increments, stirring after each until completely melted. Dip the cookies into the white chocolate and allow chocolate to set completely at room temperature or in the refrigerator.",11,"2 and 1/4 cups (281g) all-purpose flour (spooned & leveled), plus more as needed for rolling and work surface",1 teaspoon ground cinnamon,1/2 teaspoon baking powder,1/4 teaspoon salt,"3/4 cup (12 Tbsp; 170g) unsalted butter, softened to room temperature",3/4 cup (150g) granulated sugar,"1 large egg, at room temperature",1 and 1/2 teaspoons maple extract*,1 teaspoon pure vanilla extract,gold sprinkles and/or edible glitter stars,Sally's Baking Addiction,https://sallysbakingaddiction.com/maple-cinnamon-star-cookies/,"optional: 8 ounces white chocolate, coarsely chopped",NA,NA,NA,NA,NA,NA,NA,NA,NA,NA,NA,NA,NA
Brown Butter Sugar Cookies,Sally McKenney,Updated: 01/09/2023,"Brown butter sugar cookies are easy to make, incredibly flavorful, and ready in under an hour!",4.7,49,45 minutes,13 minutes,NA,1 hour,36 cookies,7,"Brown the butter: Have a large heat-proof bowl handy. Slice the butter into pieces and place in a light-colored skillet. (Light colored helps you determine when the butter begins browning.) Melt the butter over medium heat, whisking occasionally. Once melted, the butter will begin to foam. Keep whisking occasionally. After 5–8 minutes, the butter will begin browning; you’ll notice lightly browned specks begin to form at the bottom of the pan and it will have a nutty aroma. See photo above for a visual. Once browned, remove from heat immediately, pour into bowl. Allow to cool for 5 minutes.
Meanwhile, whisk the flour, baking soda, and salt together in a medium bowl. Set aside.
Add the granulated sugar and brown sugar to the brown butter. Using a handheld mixer or stand mixer with paddle attachment, beat together on medium-high speed until relatively combined, about 1 minute. Beat in the egg and vanilla extract.
Pour the dry ingredients into the wet ingredients and begin beating together on low speed, slowly working up to high speed until everything is combined. The dough will be thick and a little greasy. That’s ok! Just roll into balls as best you can in the next step.
Roll the dough into balls, about 1 Tablespoon of dough each, and dip the tops into sprinkles. Place dough balls tightly together on a lined baking sheet (or a couple large plates). Loosely cover with plastic wrap and place in the refrigerator to chill for 30 minutes.
Preheat oven to 350°F (177°C). Line large baking sheets with parchment paper or silicone baking mats. (Always recommended for cookies.)
Line chilled dough balls onto baking sheets about 3 inches apart. Bake for 12–13 minutes or until lightly browned on the sides. Remove from the oven and allow to cool on the baking sheet for 5 minutes then transfer to cooling rack to cool completely.",9,1 cup (16 Tbsp; 226g) unsalted butter,2 cups + 2 Tablespoons (265g) all-purpose flour (spooned & leveled),1 teaspoon baking soda,1/2 teaspoon salt,3/4 cup (150g) granulated sugar,3/4 cup (150g) packed light brown sugar,"1 large egg, at room temperature",2 teaspoons pure vanilla extract,optional: sprinkles and/or nonpareils for topping,NA,Sally's Baking Addiction,https://sallysbakingaddiction.com/brown-butter-sugar-cookies/,NA,NA,NA,NA,NA,NA,NA,NA,NA,NA,NA,NA,NA,NA
Peppermint White Chocolate Cookies,Sally McKenney,Updated: 01/14/2022,"Soft and chewy peppermint cookies with white chocolate and candy canes are festive, delicious, and easy!",4.4,20,"2 hours, 15 minutes",12 minutes,NA,"2 hours, 45 minutes",24 cookies,7,"Whisk the flour, cornstarch, baking soda, and salt together in a medium bowl.
In a large bowl using a handheld mixer or stand mixer with paddle attachment, beat the butter for 1 minute on medium speed until completely smooth and creamy. Add the brown sugar and granulated sugar and mix on medium speed until fluffy and light in color. Mix in egg, vanilla extract, and peppermint extract. Scrape down the sides and bottom of the bowl as needed.
On low speed, slowly mix the dry ingredients into the wet ingredients until combined. The cookie dough will be quite thick. Add the white chocolate chips and crushed candy cane, then mix for about 5 seconds until combined. Cover dough tightly with aluminum foil or plastic wrap and chill for at least 2 hours and up to 3 days.
Remove cookie dough from the refrigerator and allow to sit at room temperature for 10 minutes, then preheat oven to 350°F (177°C). Line 2 large baking sheets with parchment paper or silicone baking mats. (Always recommended for cookies.) Set aside.
Once chilled, the dough will be slightly crumbly, but will come together if you work the dough with your hands as you roll into individual balls. Roll balls of dough, about 1.5 Tablespoons of dough each, into balls. (I like using a medium cookie scoop for this.)
Bake for 12 minutes, until lightly golden brown around the edges. Allow to cool for 5 minutes on the cookie sheet, then transfer to cooling rack to cool completely.
If using, melt the chopped white chocolate in the microwave in 20 second increments, stirring after each until completely melted. Drizzle over cooled cookies.",13,2 cups (250g) all-purpose flour (spooned & leveled),1 teaspoon cornstarch,1 teaspoon baking soda,1/2 teaspoon salt,"3/4 cup (12 Tbsp; 170g) unsalted butter, softened to room temperature",1/2 cup (100g) packed light brown sugar,1/2 cup (100g) granulated sugar,"1 large egg, at room temperature",1 and 1/2 teaspoons pure vanilla extract,3/4 teaspoon peppermint extract,Sally's Baking Addiction,https://sallysbakingaddiction.com/peppermint-white-chocolate-cookies/,3/4 cup (135g) white chocolate chips,1/2 cup crushed candy cane pieces (5 candy canes),"4 ounces (113g) white chocolate, coarsely chopped",NA,NA,NA,NA,NA,NA,NA,NA,NA,NA,NA
Salted Chocolate Pistachio Shortbread,Sally McKenney,Updated: 01/14/2022,"With just a few ingredients, you can turn traditional shortbread into this salted chocolate pistachio shortbread. An easy one bowl dessert recipe!",4.4,12,20 minutes,30 minutes,NA,"2 hours, 30 minutes",24 cookies,6,"Preheat oven to 325°F (163°C). Line two 9-inch cake pans with parchment paper leaving enough overhang around the sides to easily lift shortbread out. (Parchment is used so you can easily remove the shortbread and not cut it while it’s in the pan.)
Using a hand mixer or a stand mixer fitted with paddle attachment, beat the butter on high speed until completely smooth, about 1 minute. Add the granulated sugar and brown sugar and beat together until smooth and creamy, about 1 minute. Add the vanilla, salt, and flour and beat on low speed, gradually increasing to high speed as the mixture combines. Add 2/3 cup of the finely chopped pistachios, reserving the rest for sprinkling on top of the chocolate. Dough will be very crumbly.
Press 1/2 of the dough into each of the prepared cake pans. You want it nice and compact in each pan.
Bake the shortbread for 30 minutes or until lightly browned on top and around the edges.
Remove from the oven and allow to cool for 10 minutes. Carefully remove the shortbread from the pans by picking it up with the parchment paper on the sides. Cut each into 12 wedges. You want to make sure you cut the shortbread while it’s still warm. Allow to cool completely on the parchment before dipping into chocolate.
Melt the chopped chocolate in the microwave in 20 second increments, stopping and stirring after each until completely smooth. Dip the shortbread ends into chocolate and sprinkle with remaining chopped pistachios and sea salt. Allow chocolate to completely set.",9,"1 cup (16 Tbsp; 226g) unsalted butter, softened to room temperature",1/2 cup (100g) granulated sugar,1/4 cup (50g) light brown sugar,1 teaspoon pure vanilla extract,1 teaspoon salt,2 and 1/4 (281g) cups all-purpose flour (spooned & leveled),"1 cup (100g) finely chopped pistachios, divided*","8 ounces (226g) semi-sweet chocolate, coarsely chopped",optional: flaky sea salt for sprinkling on top,NA,Sally's Baking Addiction,https://sallysbakingaddiction.com/salted-chocolate-pistachio-shortbread/,NA,NA,NA,NA,NA,NA,NA,NA,NA,NA,NA,NA,NA,NA
Crisp Molasses Cookies,Sally McKenney,Updated: 01/09/2023,Crisp molasses cookies have perfect crispy edges and are packed with spice flavor!,4.9,23,"1 hour, 15 minutes",13 minutes,NA,"1 hour, 50 minutes",about 30 cookies,6,"Whisk the flour, baking soda, cinnamon, cloves, ginger, and salt together. Set aside.
Using a hand mixer or a stand mixer fitted with paddle attachment, beat the butter on high speed until completely smooth, about 1 minute. Add the granulated sugar and beat the two together until smooth and creamy, about 1 minute. Add the molasses, egg, and vanilla and beat on high until completely combined, about 2 minutes. Scrape down the sides and bottom of the bowl as needed.
Add the dry ingredients to the wet ingredients and mix on low until combined. Cover and chill the dough for 1 hour in the refrigerator (and up to 2-3 days). If chilling for longer than a few hours, allow to sit at room temperature for at least 30 minutes before rolling and baking because the dough will be quite hard and the cookies may not spread.
Preheat oven to 350°F (177°C). Line two large baking sheets with parchment paper or silicone baking mats. (Always recommended for cookies.) Set aside.
Roll balls of dough (about 1 scant Tablespoon of dough per cookie) into the granulated/coarse sugar. Place each ball 2 inches apart on the baking sheets. Bake for 13 minutes or until cracked on the top.
Remove from the oven and allow to cool on baking sheet for 5 minutes before transferring to a wire rack to cool completely.",12,2 cups (250g) all-purpose flour (spooned & leveled),1 teaspoon baking soda,1 teaspoon ground cinnamon,1 teaspoon ground cloves,3/4 teaspoon ground ginger,1/2 teaspoon salt,"3/4 cup (12 Tbsp; 170g) unsalted butter, softened to room temperature",1 cup (200g) granulated sugar,1/4 cup (60ml) unsulphured or dark molasses (do not use blackstrap; I prefer Grandma’s brand),"1 large egg, room temperature",Sally's Baking Addiction,https://sallysbakingaddiction.com/crisp-molasses-cookies/,1 teaspoon pure vanilla extract,for rolling: 2/3 cup granulated or coarse sugar*,NA,NA,NA,NA,NA,NA,NA,NA,NA,NA,NA,NA
"Magic 5 Cookies, Holiday Edition",Sally McKenney,Updated: 11/12/2021,Soft-baked white chocolate cranberry and pecan oatmeal cookies have the most unbelievable flavor and chew!,5,8,"1 hour, 15 minutes",11 minutes,NA,2 hours,36 cookies,6,"Whisk the flour, baking soda, cinnamon, salt, and oats together. Set aside.
Using a hand mixer or a stand mixer fitted with paddle attachment, cream the butter, brown sugar, and granulated sugar together on medium speed until smooth, about 2 minutes. Add the eggs and beat on high until combined, about 1 minute. Scrape down the sides and bottom of the bowl as needed. Add the vanilla and molasses and mix on high until combined.
Add the dry ingredients to the wet ingredients and mix on low until combined. With the mixer running on low speed, add the white chocolate, dried cranberries, coconut, and pecans. Dough will be thick, yet very sticky. Chill the dough for 1 hour in the refrigerator (and up to 2-3 days). If chilling for longer than a few hours, though, allow to sit at room temperature for at least 30 minutes before rolling and baking because the dough will be quite hard and the cookies may not spread.
Preheat oven to 350°F (177°C). Line two large baking sheets with parchment paper or silicone baking mats. (Always recommended for cookies.) Set aside.
Roll balls of dough (about 1.5 tablespoons of dough per cookie—I like using this medium cookie scoop) and place 2 inches apart on the baking sheets. Bake for 10-11 minutes until very lightly browned on the sides. The centers will look very soft.
Remove from the oven and let cool on baking sheet for 5 minutes before transferring to a wire rack to cool completely. While the cookies are still warm, I like to press a few more white chocolate chips into the tops—this is only for looks!",12,1 and 1/2 cups (188g) all-purpose flour (spooned & leveled),1 teaspoon baking soda,1 teaspoon ground cinnamon,1/2 teaspoon salt,3 cups (255g) old-fashioned whole rolled oats,"1 cup (16 Tbsp; 226g) unsalted butter, softened to room temperature",1 cup (200g) packed light or dark brown sugar,1/4 cup (50g) granulated sugar,"2 large eggs, room temperature",2 teaspoons pure vanilla extract,Sally's Baking Addiction,https://sallysbakingaddiction.com/white-chocolate-cranberry-pecan-oatmeal-cookies/,"1 Tablespoon (15ml) unsulphured or dark molasses (do not use blackstrap; I prefer Grandma’s brand) *optional, see post above","1/2 cup each: white chocolate chips (90g), dried cranberries (60g), sweetened shredded coconut (40g), chopped pecans (64g)",NA,NA,NA,NA,NA,NA,NA,NA,NA,NA,NA,NA
