title,author,dateinfo,description,rating,ratingnum,preptime,cooktime,customtime,totaltime,yield,numberofsteps,actualsteps,totalingredients,ingredient1,ingredient2,ingredient3,ingredient4,ingredient5,ingredient6,ingredient7,ingredient8,ingredient9,ingredient10,source,link,ingredient11,ingredient12,ingredient13,ingredient14,ingredient15,ingredient16,ingredient17,ingredient18,ingredient19,ingredient20,ingredient21,ingredient22,ingredient23,ingredient24
Gingerbread Latte Cookies,Sally McKenney,NA,"These gingerbread latte cookies are every bit as chewy, soft, and nostalgic as my classic iced oatmeal cookies, but with a festive flavor twist. Dunk in espresso-speckled white chocolate and top with a sprinkle of spice for a creamy gingerbread latte experience… in a cookie!",4.6,37,45 minutes,13 minutes,NA,"1 hour, 30 minutes",30 cookies,9,"Make the cookies: Pulse the oats in a food processor 10–12 times until you have a variety of texture—chopped oats with some oat flour. See photo above for a visual.
Whisk the pulsed oats, flour, espresso powder, baking soda, salt, ginger, cinnamon, nutmeg, and cloves together in a medium bowl. Set aside.
In a large bowl using a hand mixer or a stand mixer fitted with a paddle attachment, beat the butter, brown sugar, and granulated sugar together on medium-high speed until creamed, about 3 minutes. (Here’s a helpful tutorial if you need guidance on how to cream butter and sugar.) Add the egg and molasses and beat on high speed until combined, about 1 minute. Scrape down the sides of the bowl and beat again as needed to combine.
Add the dry ingredients to the wet ingredients and mix on low speed until combined. Dough will be very thick and sticky. Cover and chill the dough for 30–45 minutes (and up to 3 days) in the refrigerator. If chilling for longer than a few hours, allow to sit at room temperature for at least 30 minutes before scooping because the dough will be quite hard.
Preheat oven to 350°F (177°C). Line large baking sheets with parchment paper or silicone baking mats. Set aside.
Scoop cookie dough, about 1.5 Tablespoons (35g) of dough per cookie, and place 3 inches apart on the baking sheets. Bake for 12–13 minutes or until lightly browned on the sides. The centers will look very soft.
Remove from the oven and allow cookies to cool on the baking sheet for 10 minutes, then transfer to a cooling rack to cool completely before dipping.
Make the topping: Melt the chopped white chocolate, oil, and espresso powder in a double boiler or use the microwave. For the microwave, place it all in a medium heat-proof bowl or liquid measuring cup. Melt in 20-second increments, stirring after each increment until completely melted and smooth. Dip each completely cooled cookie halfway into the white chocolate and place onto a parchment- or silicone baking mat-lined baking sheet or cooling rack. In a small bowl, mix together cinnamon and nutmeg. Using your fingers, lightly sprinkle a tiny pinch of the spice mix on top of the white chocolate-covered part of the cookie. Repeat with the remaining cookies. Place the baking sheet in the refrigerator to set the white chocolate, about 30 minutes.
Cookies stay fresh covered at room temperature for 3 days, or in the refrigerator for up to 1 week.",18,2 cups (170g) old-fashioned whole rolled oats,1 and 2/3 cups (210g) all-purpose flour (spooned & leveled),2 teaspoons espresso powder,1 teaspoon baking soda,1/4 teaspoon salt,1 teaspoon ground ginger,1 teaspoon ground cinnamon,1/4 teaspoon ground nutmeg,1/8 teaspoon ground cloves,"3/4 cup (12 Tbsp; 170g) unsalted butter, softened to room temperature",Sally's Baking Addiction,https://sallysbakingaddiction.com/gingerbread-latte-cookies/,1 cup (200g) packed light or dark brown sugar,1/4 cup (50g) granulated sugar,"1 large egg, at room temperature",1/4 cup (60ml/75g) unsulphured or dark molasses (do not use blackstrap; I prefer Grandma’s brand),"8 ounces (226g) white chocolate, chopped",1 teaspoon vegetable oil or coconut oil (optional; helps to thin the chocolate),1/2 teaspoon espresso powder,"pinch each of cinnamon and nutmeg, for sprinkling on top",NA,NA,NA,NA,NA,NA
Cake Batter Chocolate Chip Cookies,Sally McKenney,NA,"These cake batter chocolate chip cookies are a cross between delicious, soft-baked chocolate chip cookies and sprinkle-filled funfetti cake. If you like chocolate chip cookies and you like the flavor of cake batter, you will love these soft & chewy cookies!",4.9,74,"2 hours, 15 minutes",10 minutes,NA,3 hours,28-32 cookies,8,"In a large bowl, sift flour, cake mix, salt, and baking soda together. Set aside.
Using a hand mixer or a stand mixer fitted with paddle attachment, beat the softened butter and both sugars together on medium speed until creamy and smooth, about 3 minutes. (Here’s a helpful tutorial if you need guidance on how to cream butter and sugar.) Add the egg and mix on high until combined, about 1 minute. Scrape down the sides and bottom of the bowl as needed. Add the vanilla and beat on high until combined. Add the flour mixture to the wet ingredients and mix on low-medium speed until just combined. Add the chocolate chips and sprinkles. Mix on low until the add-ins are evenly combined.
Cover tightly with plastic wrap and refrigerate dough for at least 2 hours, or up to 3-4 days. This step is imperative. The dough is fairly sticky, so chilling the dough is required in order to avoid the cookies from spreading too much. If you chill longer than 2 hours, make sure you roll the cookie dough into balls after the 2 hour mark. Place dough balls on a plate, cover tightly, and store in the refrigerator until ready to bake. You may also freeze the balls at this point for up to 3 months. (Then bake as directed adding 1 minute to the bake time without thawing.)
Once dough has been chilled, preheat oven to 350°F (177°C). Line two large cookie sheets with parchment paper or silicone baking mats (always recommended for cookies).
Scoop rounded balls of the cold dough onto an ungreased baking sheet, use around 1.5 Tablespoons (about 35g) of cookie dough per cookie. A medium cookie scoop is helpful for this. Shape your cookie dough balls to be “taller” than they are wide, as pictured above. Make sure to keep dough refrigerated when working in batches.
Bake the cookies for 13-15 minutes, or until the edges are lightly browned. The centers will still appear very soft, but the cookies will continue to set as they cool. While the cookies are still warm, I like to press a few more chocolate chips into the tops of the cookies. This is optional and only for looks.
Allow the cookies to cool on the baking sheet for 5 minutes, then transfer to a wire rack to cool completely.
Cookies stay fresh covered at room temperature for up to 1 week.",11,1 and 1/3 cup (167g) all-purpose flour (spooned & leveled),1 and 1/4 cup (190g) yellow or vanilla boxed cake mix (not the whole box and you just need the DRY mix)*,1/2 teaspoon baking soda,1/2 teaspoon salt,"3/4 cup (12 Tbsp; 170g) unsalted butter, softened to room temperature",1/2 cup (100g) granulated sugar,1/2 cup (100g) packed light brown sugar,"1 egg, at room temperature",1 and 1/2 teaspoons pure vanilla extract,1 cup (180g) chocolate chips (I use 1/2 cup white and 1/2 cup semi-sweet),Sally's Baking Addiction,https://sallysbakingaddiction.com/recipe-round-2-cake-batter-chocolate-chip-cookies/,1/2 cup (80g) sprinkles,NA,NA,NA,NA,NA,NA,NA,NA,NA,NA,NA,NA,NA
Salted Caramel Dark Chocolate Cookies,Sally McKenney,NA,"This award-winning recipe comes together with an easy cookie dough and even easier assembly process. Stuffing these salted caramel dark chocolate cookies is as simple as wrapping the chocolatey dough around a Rolo caramel candy! The dough needs to chill for at least 3 hours, but you can make it ahead of time and refrigerate overnight.",4.9,42,"3 hours, 25 minutes",12 minutes,NA,"3 hours, 45 minutes",18 cookies,10,"Preliminary note: This cookie dough requires at least 3 hours of chilling, but I prefer to chill the dough overnight. The colder the dough, the easier it is to handle and shape.
In a large bowl using a handheld or stand mixer fitted with a paddle attachment, beat the butter, granulated sugar, and brown sugar together on medium high speed until fluffy and light in color, about 3 minutes. (Here’s a helpful tutorial if you need guidance on how to cream butter and sugar.) Add the egg and vanilla, and then beat on high speed until combined. Scrape down the sides and up the bottom of the bowl as needed.
In a separate bowl, whisk the flour, cocoa powder, baking soda, and salt together until combined. With the mixer running on low speed, slowly pour the dry into the wet ingredients. Beat on low until combined. The cookie dough will be thick. Switch to medium-high speed and beat in the milk, then the chocolate chips. The cookie dough will be sticky. Cover dough tightly and chill in the refrigerator for at least 3 hours and up to 3 days. Chilling is mandatory for this sticky cookie dough.
Remove cookie dough from the refrigerator and allow to sit at room temperature for 10 minutes.
Preheat oven to 350°F (177°C). Line large baking sheets with parchment paper or silicone baking mats. Set aside.
Scoop 2 Tablespoons (40g) of dough and divide in half. Roll each half into a ball. Make a thumb indent into 1 ball and place a caramel candy in the center. Top with other ball of dough and seal down the sides, enclosing the candy inside. Repeat with remaining dough and caramel candies. Tip: The cookie dough is certainly sticky, so wipe your hands clean after every few balls of dough you shape.
Arrange stuffed cookie dough balls 2–3 inches apart on the baking sheets and sprinkle each lightly with sea salt. 
Bake the cookies for 12–13 minutes or until the edges appear set and the centers still look soft. Tip: If they aren’t really spreading by minute 9, remove them from the oven and lightly bang the baking sheet on the counter 2–3x. This helps initiate that spread. Return to the oven to continue baking.
Cool cookies for 5 minutes on the baking sheet. During this time, I like to press a few more chocolate chips into the tops of the warm cookies. (This is optional and only for looks.) Transfer to cooling rack to cool completely. The cookies will slightly deflate as they cool.
Cover leftover cookies tightly and store at room temperature for up to 1 week.",13,"1/2 cup (8 Tbsp; 113g) unsalted butter, softened to room temperature",1/2 cup (100g) granulated sugar,1/2 cup (100g) packed light or dark brown sugar,"1 large egg, at room temperature",1 teaspoon pure vanilla extract,1 cup (125g) all-purpose flour (spooned & leveled),2/3 cup (55g) unsweetened cocoa powder,1 teaspoon baking soda,1/8 teaspoon salt,2 Tablespoons (30ml) milk,Sally's Baking Addiction,https://sallysbakingaddiction.com/salted-caramel-dark-chocolate-cookies/,1 and 1/2 cups (270g) semi-sweet or dark chocolate chips,"18 chocolate-coated caramels, such as Rolos (or use regular caramels)*","flaky sea salt or coarse sea salt, for sprinkling",NA,NA,NA,NA,NA,NA,NA,NA,NA,NA,NA
Homemade Oreos,Sally McKenney,Updated: 05/15/2024,"Originally published on my website in 2013, my homemade version of store-bought Oreo cookies feature two dark cocoa cookies with a sweet cream filling. With only 10 minutes of dough-chilling time and no rolling pin required, making a batch of these iconic sandwich cookies from scratch is quicker and easier than you think!",4.8,109,35 minutes,9 minutes,NA,2 hours (includes cooling),20-21 sandwich cookies,8,"Make the cookies: Whisk the flour, cocoa powder, baking soda, and salt together in a large bowl. Set aside.
Using a handheld or stand mixer fitted with a paddle attachment, beat the butter, granulated sugar, and brown sugar on medium-high speed until combined and creamed, about 3 minutes. Scrape down the sides and the bottom of the bowl as needed. (Here’s a helpful tutorial if you need guidance on how to cream butter and sugar.) Beat in the egg and vanilla extract. Pour the dry ingredients into the wet ingredients and beat on low speed until a thick dough forms.
Line large baking sheets with parchment paper or silicone baking mats. Roll the dough into small balls, 2 teaspoons or 13–15g of dough each. Place the cookie dough balls on the lined baking sheets, and feel free to squeeze as many as you can onto one (since you’re refrigerating these and may not have space in your refrigerator for multiple baking sheets). Using the flat bottom of a measuring cup or drinking cup, flatten the balls into discs that are about 1.5 inches in diameter (doesn’t need to be exact). Place the baking sheet(s) in the refrigerator for just 10 minutes to help set the cookies’ shape.
Meanwhile, preheat oven to 350°F (177°C).
Space the cold flattened cookies out to be 3 inches apart on the baking sheets. There will be a couple batches of these cookies, so keep the shaped cookies in the refrigerator while the first batches bake. Bake for 8–10 minutes, or until the edges appear set and the tops are slightly cracking. Remove from the oven and allow to cool for at least 5 minutes on the baking sheets before transferring to a wire rack to cool completely.
While the cookies are cooling, make the filling: In a small bowl using a handheld or stand mixer with a paddle attachment, beat the butter and shortening together on high speed until totally combined and creamy, about 2 minutes. Add the confectioners’ sugar and vanilla. Beat on low speed for 1 minute and then switch to high and beat for 1–2 more minutes until creamy and combined. The filling is very thick.
Spread or pipe the cream filling on the bottom sides of half of the cookies. I usually use Wilton piping tip #12. Sandwich the remaining unfrosted cookies on top of the cream filling, pressing down gently.
Cookies stay fresh covered at room temperature for up to 1 week.",13,1 and 1/4 cups (156g) all-purpose flour (spooned & leveled),1/2 cup (41g) unsweetened Dutch-process cocoa powder (see Note if using natural cocoa),1 teaspoon baking soda,1/8 teaspoon salt,"1/2 cup (8 Tbsp; 113g) unsalted butter, softened to room temperature",3/4 cup (150g) granulated sugar,1/4 cup (50g) packed light brown sugar,"1 large egg, at room temperature",1 teaspoon pure vanilla extract,"1/4 cup (4 Tbsp; 56g) unsalted butter, softened to room temperature",Sally's Baking Addiction,https://sallysbakingaddiction.com/homemade-oreos/,"1/4 cup (48g) vegetable shortening, room temperature",1 and 3/4 cups (210g) confectioners’ sugar,1 teaspoon pure vanilla extract,NA,NA,NA,NA,NA,NA,NA,NA,NA,NA,NA
Red Velvet Chocolate Chip Cookies,Sally McKenney,NA,"These are soft-baked red velvet chocolate chip cookies made from scratch. Be sure to refrigerate the cookie dough for at least 1 hour, and feel free to skip the food coloring for light brown cookies.",4.7,82,"1 hour, 10 minutes",12 minutes,NA,"1 hour, 30 minutes",20 cookies,8,"Whisk the flour, cocoa powder, baking soda, and salt together in a medium bowl. Set aside.
Using a hand mixer or a stand mixer fitted with paddle attachment, beat the butter, brown sugar, and granulated sugar together on medium speed until creamy, about 3 minutes. (Here’s a helpful tutorial if you need guidance on how to cream butter and sugar.) Add the egg and vanilla extract and mix on high until combined, about 1 minute. Scrape down the sides and bottom of the bowl as needed.
Pour the dry ingredients into the wet ingredients, add the milk and food coloring, and then mix on low speed until everything is combined. The dough will be sticky. If you want a more vibrant hue, beat in more food coloring a little at a time. Add the chocolate chips and beat on low speed until just combined.
Cover and chill the dough in the refrigerator for at least 1 hour (and up to 3 days). I recommend just 1 to 2 hours, otherwise the cookies won’t spread much. If chilling for longer than 2 hours, allow dough to sit at room temperature for at least 15 minutes before rolling and baking because the dough will be quite hard.
Preheat oven to 350°F (177°C). Line large baking sheets with parchment paper or silicone baking mats. Set aside.
Scoop and roll cookie dough, about 1.5 Tablespoons (30–35g) of dough each. (A medium cookie scoop is helpful here.) Arrange on the baking sheet about 3 inches apart. Bake for 11–13 minutes or until the edges appear set. Centers will look very soft. If the cookies didn’t spread, simply press down on the warm cookies with the back of a spoon to slightly flatten. If desired, lightly press a few chocolate chips into the tops of the warm cookies.
Cool for 5 minutes on the baking sheets. Transfer to a wire rack to cool completely.
Cover and store leftover cookies at room temperature for up to 1 week.",12,1 and 2/3 cups (210g) all-purpose flour (spooned & leveled),1/4 cup (21g) unsweetened natural cocoa powder,1 teaspoon baking soda,1/4 teaspoon salt,"1/2 cup (8 Tbsp; 113g) unsalted butter, softened to room temperature",3/4 cup (150g) packed light or dark brown sugar,1/4 cup (50g) granulated sugar,"1 large egg, at room temperature",1 Tablespoon milk (I recommend buttermilk),2 teaspoons pure vanilla extract,Sally's Baking Addiction,https://sallysbakingaddiction.com/red-velvet-chocolate-chip-cookies/,3/4 teaspoon gel red food coloring (or alternative)*,1 cup (180g) white or semi-sweet chocolate chips (plus a few extra for tops),NA,NA,NA,NA,NA,NA,NA,NA,NA,NA,NA,NA
Iced Cherry Almond Linzer Cookies,Sally McKenney,NA,"These iced cherry almond linzer cookies are as lovely to look at as they are to eat, and there’s no special cookie decorating skill required. You can use any small cookie cutters you have to cut the almond cookie dough into your choice of shapes, and the filling is simply store-bought cherry preserves. Take your time with these cookies, especially when handling the dough and sandwiching the cookies together. ",5,10,4 hours (includes chilling),12 minutes,NA,"4 hours, 30 minutes",22–25 3-inch sandwich cookies,13,"Make the dough: Place the almonds in a food processor. Pulse until the almonds are finely chopped, but not so finely that it’s turning into almond flour. See photo above for a visual.
In a medium bowl, whisk together the chopped almonds, flour, baking powder, cinnamon, and salt until combined. Set aside.
In a large bowl using a handheld or stand mixer fitted with a paddle attachment, beat the butter and sugar together on high speed until completely smooth and creamy, about 3 minutes. (Here’s a helpful tutorial if you need guidance on how to cream butter and sugar.) Add the egg, vanilla extract, and almond extract, and beat on high speed until combined, about 1 minute. Scrape down the sides and up the bottom of the bowl and beat again as needed to combine.
Add the dry ingredients to the wet ingredients and mix on low speed until combined. The dough will be thick and crumbly, and weigh about 850g.
Divide the dough into 2 equal portions (about 425g each, or just eyeball it), gently flatten into discs, and wrap each in plastic wrap. Chill the discs in the refrigerator for at least 3 hours (and up to 4 days). 
Preheat oven to 350°F (180°C). Line baking sheets with parchment paper or silicone baking mats. (Always recommended for cookies.) Set aside.
Cut out and bake the cookies: Remove 1 disc of chilled cookie dough from the refrigerator. After chilling, the dough will be very hard. Let it sit at room temperature for 10 minutes (or 30 minutes, if the dough chilled for longer than 3 hours) before you try to roll it. Generously flour a work surface, as well as your hands and the rolling pin. Roll out the disc to about 1/4-inch thickness. If the dough is cracking a lot when rolling out, wait a few more minutes for it to soften up a bit more. The more you work with it, the softer and easier to work with it will become. Using a 2-inch or 3-inch cookie cutter, cut dough into shapes. Re-roll the remaining dough and continue cutting until all is used. Repeat with the second disc of dough. You should have about 44–60 cookies, depending on the size of cookie cutter you use.
Using a small (1-inch) cookie cutter (see Note if you don’t have one), cut a hole into the center of half of the cookies. Let’s call these the “top cookies,” and the ones without a hole the “bottom cookies.”
Arrange the cookies 2 inches apart on lined baking sheets. Bake the cookies for about 11–12 minutes, or until lightly browned around the edges. Allow cookies to cool on the baking sheets for 5 minutes, then transfer to a wire rack to cool completely before assembling.
Make the icing: In a small bowl, whisk together (I usually use a fork) confectioners’ sugar, 1 Tablespoon milk, and extract(s) until smooth. If the icing is too thick to whisk, add a little more milk, a teaspoon at a time, until it reaches desired consistency. You want to keep it on the thicker side.
Lightly dip the surface of each top cookie into the icing, and let any excess icing drip off. Place the iced top cookies on a wire rack or parchment paper. It’s ok if the icing is not completely set before sandwiching the cookies.
Assemble the cookies: Spread about 1/2 teaspoon of cherry preserves on the bottom side of each bottom cookie. Carefully top each bottom cookie with a top iced cookie and press together very gently to create a cookie sandwich. Icing will set in a few hours, so you can stack, store, transport, and gift the cookies.
Cookies will stay fresh covered at room temperature for 2 days or in the refrigerator for up to 1 week.",14,2/3 cup (100g) salted roasted almonds (see Note if you use unsalted),"2 and 1/2 cups (313g) all-purpose flour (spooned & leveled), plus more for rolling",1/2 teaspoon baking powder,1/2 teaspoon ground cinnamon,1/2 teaspoon salt,"1 cup (16 Tbsp; 226g) unsalted butter, softened to room temperature",2/3 cup (135g) granulated sugar,"1 large egg, at room temperature",1 teaspoon pure vanilla extract,3/4 teaspoon almond extract,Sally's Baking Addiction,https://sallysbakingaddiction.com/cherry-almond-linzer-cookies/,1/2 cup (160g) cherry preserves (or other flavor; see Note),1 cup (120g) confectioners’ sugar,1–2 Tablespoons whole milk,1/2 teaspoon almond extract or pure vanilla extract (or 1/4 teaspoon each),NA,NA,NA,NA,NA,NA,NA,NA,NA,NA
