title,author,dateinfo,description,rating,ratingnum,preptime,cooktime,customtime,totaltime,yield,numberofsteps,actualsteps,totalingredients,ingredient1,ingredient2,ingredient3,ingredient4,ingredient5,ingredient6,ingredient7,ingredient8,ingredient9,ingredient10,source,link,ingredient11,ingredient12,ingredient13,ingredient14,ingredient15,ingredient16,ingredient17,ingredient18,ingredient19,ingredient20,ingredient21,ingredient22,ingredient23,ingredient24
The Best Sugar Cookies,Sally McKenney,Updated: 08/08/2025,"With crisp edges, thick centers, and room for lots of decorating icing, I know you’ll love these soft sugar cookies as much as I do. The number of cookies this recipe yields depends on the size of the cookie cutter you use. If you’d like to make dozens of cookies for a large crowd, double the recipe. This recipe is also in my New York Times best-selling cookbook, Sally’s Baking 101.",4.7,872,40 minutes,12 minutes,NA,3 hours (including chilling),24 3-4 inch cookies,9,"In a medium bowl, whisk the flour, baking powder, and salt together. Set aside.
In a large bowl using a handheld or a stand mixer fitted with a paddle attachment, beat the butter and sugar together on high speed until the mixture is light and creamy, about 3 minutes. Add the egg, vanilla, and almond extract (if using) and beat on high speed until combined, about 1 minute. Scrape down the sides and bottom of the bowl and beat again as needed to combine. Add the dry ingredients to the wet ingredients and mix on low speed until combined. The dough should be soft. If it seems too soft and sticky for rolling, beat in 1 more Tablespoon of flour.
Divide the dough in half. Place each portion on a piece of lightly floured parchment paper or a lightly floured silicone baking mat. With a lightly floured rolling pin, roll the dough to about 1/4-inch thickness. Use a bit more flour if the dough seems too sticky. The rolled-out dough can be any shape, as long as it is evenly 1/4 inch thick.
Lightly dust one of the rolled-out dough portions with flour. (This prevents sticking.) Place the second rolled-out dough portion, still on the parchment paper, on top of the first. Cover the dough tightly and refrigerate it for at least 2 hours and up to 2 days.
Preheat the oven to 350°F (177°C). Line large baking sheets with parchment paper or silicone baking mats.
Carefully remove the top piece of dough from the refrigerator. If it’s sticking to the bottom, run your hand under it to help remove it. Using a cookie cutter, cut the dough into shapes. Gather the scraps, reroll, and continue cutting until all the dough is used. (Note: It doesn’t seem like a lot of dough, but you get a lot of cookies from the dough scraps you reroll.) Repeat with the second piece of dough. Arrange the cookies 3 inches apart on the prepared baking sheets.
Bake for 11–12 minutes or until the edges of the cookies are very lightly browned and set. If your oven has hot spots, rotate the baking sheets halfway through bake time. Allow the cookies to cool on the baking sheet for 5 minutes, then transfer to a cooling rack to cool completely before decorating.
Decorate the cooled cookies with royal icing, easy cookie icing, or cookie decorating buttercream. Feel free to tint any of the icings with gel food coloring. See post above for recommended decorating tools. No need to cover the decorated cookies as you wait for the icing to set. If it’s helpful, decorate the cookies directly on a baking sheet so you can place the entire baking sheet in the refrigerator to help speed up the icing setting.
Enjoy cookies right away or wait until the icing sets to serve them. Once the icing has set, these cookies are great for gifting or shipping. Store plain or iced cookies covered tightly at room temperature for up to 5 days. For longer storage, cover and refrigerate for up to 10 days. If decorated with cookie buttercream, cover and store decorated cookies at room temperature for up to 1 day, or in the refrigerator for up to 5 days.",10,"2 and 1/4 cups (281g) all-purpose flour (spooned & leveled), plus more as needed for rolling and work surface",1/2 teaspoon baking powder,1/4 teaspoon salt,"3/4 cup (12 Tbsp; 170g) unsalted butter, softened to room temperature",3/4 cup (150g) granulated sugar,"1 large egg, at room temperature",2 teaspoons pure vanilla extract,"1/4 teaspoon almond extract (optional, but makes the flavor outstanding)*","Royal Icing, Easy Glaze Icing, or Cookie Buttercream (royal icing is pictured)",Assorted sprinkles,Sally's Baking Addiction,https://sallysbakingaddiction.com/best-sugar-cookies/,NA,NA,NA,NA,NA,NA,NA,NA,NA,NA,NA,NA,NA,NA
Chewy Chocolate Chip Cookies,Sally McKenney,Updated: 04/21/2025,"These super soft and chewy chocolate chip cookies are the most popular cookie recipe on my website for good reason. Melted butter, more brown sugar than white sugar, cornstarch, and an extra egg yolk guarantee the absolute chewiest chocolate chip cookie texture. The cookie dough is slick and requires chilling prior to shaping the cookies. This recipe is also in my New York Times best-selling cookbook, Sally’s Baking 101.",4.7,1850,15 minutes,13 minutes,NA,"2 hours, 45 minutes",16 XL cookies or 20 medium/large cookies,7,"In a large bowl, whisk the flour, baking soda, cornstarch, and salt together. Set aside.
In a medium bowl, whisk the melted butter, brown sugar, and granulated sugar together until no lumps remain. Whisk in the egg and egg yolk until combined, then whisk in the vanilla extract. The mixture will be thin. Pour into dry ingredients and mix together with a large spoon or spatula. The dough will be very soft, thick, and shiny. Fold in the chocolate chips. The chocolate chips may not stick to the dough because of the melted butter, but do your best to combine them.
Cover the dough tightly and refrigerate for at least 2 hours or up to 3 days. I highly recommend chilling the cookie dough overnight to prevent overspreading.
Preheat oven to 325°F (163°C). Line large baking sheets with parchment paper or silicone baking mats. If the dough has chilled for longer than 2 hours, let it sit at room temperature for about 15 minutes.
Using a cookie scoop or Tablespoon measuring spoon, scoop the chilled cookie dough, about 3 scant Tablespoons (about 2 ounces, or 60g) of dough for XL cookies or 2 heaping Tablespoons (about 1.75 ounces, or 50g) of dough for medium-large cookies. Roll into a ball, then use your fingers to shape the cookie dough so that it’s taller rather than wide—almost like a cylinder. This helps the cookies bake up thicker. Repeat with remaining dough. Arrange the cookies 3 inches apart on the prepared baking sheets.
Bake the cookies for 13–14 minutes or until the edges are very lightly browned. The centers will look very soft, but the cookies will continue to set as they cool. Cool on the baking sheet for 10 minutes before transferring to a cooling rack to cool completely. While the cookies are still warm, I like to press a few more chocolate chips into the tops—this is optional and only for looks! 
Store tightly covered at room temperature for up to 1 week.",10,2 and 1/4 cups (281g) all-purpose flour (spooned & leveled),1 teaspoon baking soda,1 and 1/2 teaspoons cornstarch*,1/2 teaspoon salt,"3/4 cup (170g/12 Tbsp) unsalted butter, melted & cooled for 5 minutes",3/4 cup (150g) packed light or dark brown sugar,1/2 cup (100g) granulated sugar,"1 large egg + 1 egg yolk, at room temperature",2 teaspoons pure vanilla extract,1 and 1/4 cups (225g) semi-sweet chocolate chips or chocolate chunks,Sally's Baking Addiction,https://sallysbakingaddiction.com/chewy-chocolate-chip-cookies/,NA,NA,NA,NA,NA,NA,NA,NA,NA,NA,NA,NA,NA,NA
Soft & Chewy Oatmeal Raisin Cookies,Sally McKenney,Updated: 01/14/2022,"Soft and chewy with that trademark homemade flavor, these are the best soft and chewy oatmeal raisin cookies. Your family will love these easy oatmeal raisin cookies!",4.8,1051,45 minutes,13 minutes,NA,1 hour,26-30 cookies,4,"Using a hand mixer or a stand mixer fitted with paddle attachment, cream the softened butter and both sugars together on medium speed until smooth, about 3 minutes. (Here’s a helpful tutorial if you need guidance on how to cream butter and sugar.) Add the eggs and mix on high until combined, about 1 minute. Scrape down the sides and bottom of the bowl as needed. Add the vanilla and molasses and mix on high until combined. Set aside.
In a separate bowl, whisk the flour, baking soda, cinnamon, and salt together. Add to the wet ingredients and mix on low until combined. Beat in the oats, raisins, and walnuts (if using) on low speed. Dough will be thick, yet very sticky. Chill the dough for 30-60 minutes in the refrigerator (do the full hour if you’re afraid of the cookies spreading too much). If chilling for longer (up to 2 days), allow to sit at room temperature for at least 30 minutes before rolling and baking.
Preheat oven to 350°F (177°C). Line two large baking sheets with parchment paper or silicone baking mats. Set aside.
Roll balls of dough (about 2 tablespoons of dough per cookie) and place 2 inches apart on the baking sheets. I recommend using a cookie scoop since the dough can be sticky. Bake for 12-14 minutes until lightly browned on the sides. The centers will look very soft and under-baked. Remove from the oven and let cool on baking sheet for 5 minutes before transferring to a wire rack to cool completely. The cookies will continue to “set” on the baking sheet during this time.",13,"1 cup (16 Tbsp; 226g) unsalted butter, softened to room temperature",1 cup (200g) packed light or dark brown sugar,1/4 cup (50g) granulated sugar,2 large eggs*,2 teaspoons pure vanilla extract,1 Tablespoon (15ml) unsulphured or dark molasses (do not use blackstrap; I prefer Grandma’s brand),1 and 2/3 cups (209g) all-purpose flour (spooned & leveled),1 teaspoon baking soda,1 and 1/2 teaspoons ground cinnamon,1/2 teaspoon salt,Sally's Baking Addiction,https://sallysbakingaddiction.com/soft-chewy-oatmeal-raisin-cookies/,3 cups (255g) old-fashioned whole rolled oats*,1 cup (140g) raisins (see Note below),optional: 1/2 cup (64g) chopped toasted walnuts,NA,NA,NA,NA,NA,NA,NA,NA,NA,NA,NA
Double Chocolate Chip Cookies Recipe,Sally McKenney,Updated: 10/07/2022,"These soft-baked thick and chunky double chocolate chip cookies are rich and fudge-like with chewy centers, slightly crisp edges, and oodles of melty chocolate chips in each glorious bite. The dough needs to chill for at least 3 hours, but you can make it ahead of time and refrigerate overnight. ",4.8,231,"3 hours, 15 minutes (includes chilling)",12 minutes,NA,"3 hours, 30 minutes",20-22 cookies,9,"Preliminary note: This cookie dough requires at least 3 hours of chilling, but I prefer to chill the dough overnight. The colder the dough, the thicker the cookies.
In a large bowl using a hand-held or stand mixer fitted with a paddle attachment, beat the butter, granulated sugar, and brown sugar together on medium high speed until fluffy and light in color, about 3 minutes. (Here’s a helpful tutorial if you need guidance on how to cream butter and sugar.) Add the egg and vanilla extract, and then beat on high speed until combined. Scrape down the sides and bottom of the bowl as needed.
In a separate bowl, whisk the flour, cocoa powder, baking soda and salt together until combined. With the mixer running on low speed, slowly pour into the wet ingredients. Beat on low until combined. The cookie dough will be quite thick. Switch to high speed and beat in the milk, then the chocolate chips. The cookie dough will be sticky and tacky. Cover dough tightly and chill in the refrigerator for at least 3 hours and up to 3 days. Chilling is mandatory for this sticky cookie dough.
Remove cookie dough from the refrigerator and allow to sit at room temperature for 10 minutes. If the cookie dough chilled longer than 3 hours, let it sit at room temperature for about 20 minutes. This makes the chilled cookie dough easier to scoop and roll.
Preheat oven to 350°F (177°C). Line large baking sheets with parchment paper or silicone baking mats. (Always recommended for cookies.) Set aside.
Scoop and roll dough, a heaping 1.5 Tablespoons (about 35-40g; I like to use this medium cookie scoop) in size, into balls. To ensure a thicker cookie, make the balls taller than they are wide (almost like a cylinder or column). Arrange 2-3 inches apart on the baking sheets. The cookie dough is certainly sticky, so wipe your hands clean after every few balls of dough you shape.
Bake the cookies for 11-12 minutes or until the edges appear set and the centers still look soft. Tip: If they aren’t really spreading by minute 9, remove them from the oven and lightly bang the baking sheet on the counter 2-3x. This helps initiate that spread. Return to the oven to continue baking.
Cool cookies for 5 minutes on the baking sheet. During this time, I like to press a few more chocolate chips into the tops of the warm cookies. (This is optional and only for looks.) Transfer to cooling rack to cool completely. The cookies will slightly deflate as they cool. 
Cover leftover cookies tightly and store at room temperature for up to 1 week.",11,"1/2 cup (8 Tbsp; 113g) unsalted butter, softened to room temperature",1/2 cup (100g) granulated sugar,1/2 cup (100g) packed light or dark brown sugar,"1 large egg, at room temperature",1 teaspoon pure vanilla extract,1 cup (125g) all-purpose flour (spooned & leveled),2/3 cup (55g) natural unsweetened cocoa powder,1 teaspoon baking soda,1/8 teaspoon salt,"1 Tablespoon (15ml) milk (any kind, dairy or non)",Sally's Baking Addiction,https://sallysbakingaddiction.com/double-chocolate-chip-cookies-recipe/,"1 and 1/4 cups (225g) semi-sweet chocolate chips, plus a few more for optional topping*",NA,NA,NA,NA,NA,NA,NA,NA,NA,NA,NA,NA,NA
Chewy Oatmeal Chocolate Chip Cookies,Sally McKenney,Updated: 02/24/2025,"With oats, butter, and mostly all brown sugar, you are guaranteed a soft and chewy oatmeal cookie. Use this perfect oatmeal cookie as the base for other add-ins such as raisins, dried cranberries, and nuts. Cinnamon and a touch of molasses add that little something extra. To prevent the cookies from over-spreading, don’t skip the brief dough refrigeration in step 4.",4.7,675,"1 hour, 10 minutes",14 minutes,NA,1 hour 24 minutes,32-35 cookies,8,"In a medium bowl, whisk the flour, cinnamon, baking soda, and salt together. Set aside.
In a large bowl using a hand mixer or a stand mixer fitted with a paddle attachment, beat the butter, brown sugar, and granulated sugar together on medium-high speed until combined and creamed, about 3 minutes. Add the eggs, molasses, and vanilla and beat on high speed until combined, about 1 minute. Scrape down the sides and bottom of the bowl and beat again as needed to combine.
Add the dry ingredients to the wet ingredients and mix on low speed until combined. Beat in the oats and chocolate chips. Dough will be thick and sticky.
Cover and refrigerate the dough for at least 45 minutes in the refrigerator (and up to 4 days). If chilling for longer than a few hours, allow to sit at room temperature for at least 30 minutes before rolling and baking because the dough will be quite firm.
Preheat oven to 350°F (177°C). Line baking sheets with parchment paper or silicone baking mats. Set aside.
Use a medium cookie scoop to scoop the cookie dough, about 2 Tablespoons (40g) of dough per cookie, which is a heaping cookie scoop-ful, and place 3 inches apart on the baking sheets. Bake for 13–14 minutes or until lightly browned on the sides. The centers will look very soft.
Remove from the oven and allow cookies to cool on the baking sheet for 5 minutes before transferring to a cooling rack to cool completely. While the cookies are still warm, I like to press a few more chocolate chips into the tops and sprinkle with flaky sea salt—both are optional!
Cookies stay fresh covered at room temperature for up to 1 week.",13,1 and 1/2 cups (188g) all-purpose flour (spooned & leveled),1 teaspoon ground cinnamon (optional),1 teaspoon baking soda,3/4 teaspoon salt,"1 cup (16 Tbsp; 226g) unsalted butter, softened to room temperature",1 cup (200g) packed light or dark brown sugar,1/2 cup (100g) granulated sugar,"2 large eggs, at room temperature",1 Tablespoon (15ml) unsulphured or dark molasses (do not use blackstrap; I prefer Grandma’s brand),2 teaspoons pure vanilla extract,Sally's Baking Addiction,https://sallysbakingaddiction.com/oatmeal-chocolate-chip-cookies/,3 cups (255g) old-fashioned whole rolled oats,1 and 3/4 cups (315g) semi-sweet chocolate chips,optional: flaky sea salt for sprinkling,NA,NA,NA,NA,NA,NA,NA,NA,NA,NA,NA
Soft & Thick Snickerdoodles,Sally McKenney,Updated: 05/03/2022,Here is my reader favorite recipe for soft and thick snickerdoodles. These soft-baked snickerdoodle cookies only require about 30 minutes start to finish! No dough chilling required.,4.7,478,20 minutes,10 minutes,NA,30 minutes,26-28 cookies,7,"Preheat oven to 375°F (190°C). Line two large cookie sheets with parchment paper or silicone baking mats (always recommended for cookies). Set aside.
Make the cookies: Whisk the flour, cream of tartar, baking soda, cinnamon, and salt together in a medium bowl.
In a large bowl using a hand mixer or stand mixer fitted with a paddle attachment, beat the butter and granulated sugar together on high speed until smooth and creamy, about 2 minutes. Add the egg, egg yolk, and vanilla extract. Beat on medium-high speed until combined. Scrape down the sides and up the bottom of the bowl with a rubber spatula as needed. With the mixer running on low speed, slowly add the dry ingredients to the wet ingredients in 3 different parts. The dough will be thick.
Make the topping: Combine the granulated sugar and cinnamon together in a small bowl.
Roll cookie dough into balls, about 1.5 Tablespoons (35g) of cookie dough each. I recommend this cookie scoop. Roll the dough balls in cinnamon-sugar topping. Sprinkle extra cinnamon-sugar on top if desired. Arrange 3 inches apart on the baking sheets.
Bake cookies for 10 minutes. The cookies will be very puffy and soft. When they are still very warm, lightly press down on them with the back of a spoon or fork to help flatten them out. Allow cookies to cool on the baking sheet for 10 minutes and transfer to a wire rack to cool completely.
Cookies remain soft & fresh for 7 days in an airtight container at room temperature.",11,3 cups (375g) all-purpose flour (spooned & leveled),2 teaspoons cream of tartar*,1 teaspoon baking soda,1 and 1/2 teaspoons ground cinnamon,1/2 teaspoon salt,"1 cup (16 Tbsp; 226g) unsalted butter, softened to room temperature",1 and 1/3 cup (267g) granulated sugar,"1 large egg + 1 large egg yolk, at room temperature",2 teaspoons pure vanilla extract,1/3 cup (70g) granulated sugar,Sally's Baking Addiction,https://sallysbakingaddiction.com/soft-thick-snickerdoodles-in-20-minutes/,1 teaspoon ground cinnamon,NA,NA,NA,NA,NA,NA,NA,NA,NA,NA,NA,NA,NA
Christmas Sugar Cookies Recipe with Easy Icing,Sally McKenney,NA,"Cut-out Christmas sugar cookies with crisp edges and soft centers. This icing recipe is so simple, making decorating hassle-free!",4.8,146,2 hours,12 minutes,NA,"2 hours, 10 minutes",24 3-inch cookies and 1.5 cups icing,13,"Make sure you have allotted enough time (and enough counter space!) to make these cookies. The cookie dough needs to chill, the cookies need to cool completely, and the icing needs 24 hours to completely set. If enjoying right away and hardened icing isn’t a concern, you’ll only need about 3–4 hours to make these.
Make the cookie dough: Whisk the flour, baking powder, and salt together in a medium bowl. Set aside.
In a large bowl using a handheld or a stand mixer fitted with a paddle attachment, beat the butter and sugar together on high speed until completely smooth and creamy, about 3 minutes. (Here’s a helpful tutorial if you need guidance on how to cream butter and sugar.) Add the egg, vanilla, and almond extract (if using), and beat on high speed until combined, about 1 minute. Scrape down the sides and up the bottom of the bowl and beat again as needed to combine.
Add the dry ingredients to the wet ingredients and mix on low until combined. Dough will be a bit soft. If the dough seems too soft and sticky for rolling, add 1 more Tablespoon of flour.
Divide the dough into 2 equal parts. Place each portion onto a piece of lightly floured parchment paper or a lightly floured silicone baking mat. With a lightly floured rolling pin, roll the dough out to about 1/4-inch thickness. Use more flour if the dough seems too sticky. The rolled-out dough can be any shape, as long as it is evenly 1/4-inch thick.
Lightly dust one of the rolled-out doughs with flour. Place a piece of parchment on top. (This prevents sticking.) Place the second rolled-out dough on top. Cover with plastic wrap or aluminum foil, then refrigerate for at least 1–2 hours and up to 2 days.
Once chilled, preheat oven to 350°F (177°C). Line 2–3 large baking sheets with parchment paper or silicone baking mats. Carefully remove the top dough piece from the refrigerator. If it’s sticking to the bottom, run your hand under it to help remove it. Using a cookie cutter, cut the dough into shapes. Re-roll the remaining dough and continue cutting until all is used. Repeat with second piece of dough. (Note: It doesn’t seem like a lot of dough, but you get a lot of cookies from the dough scraps you re-roll.)
Arrange cookies on baking sheets about 3 inches apart. Bake for 11–12 minutes or until lightly browned around the edges. If your oven has hot spots, rotate the baking sheet halfway through bake time. Allow cookies to cool on the baking sheet for 5 minutes, then transfer to a wire rack to cool completely before decorating. No need to cover the cookies as they cool.
Make the icing: Using a fork, stir the confectioners’ sugar, vanilla, corn syrup, and 4.5 Tablespoons (67ml) of water, and optional salt together in a medium bowl. It will be very thick and almost impossible to stir. Switch to a whisk and whisk in 1/2 Tablespoon (8ml) more of water. If you lift the whisk and let the icing drizzle back into the bowl, the ribbon of icing will hold shape for a few seconds before melting back into the icing. That is when you know it’s the right consistency and is ready to use. If it’s too thick (sometimes it is), whisk in another 1/2 Tablespoon (8ml) of water or a little more until you reach the proper consistency.
If you’re tinting the icing another color, stir in the food coloring. You can pour some icing into different bowls if using multiple colors. When tinting icing, use only 1–2 drops at first, stir it in, then add more as needed to reach your desired color. Remember, color darkens as icing dries.
Decorate the cookies: You can dip the cookies into the icing or use squeeze bottles or piping bags (reusable or disposable) fitted with piping tips (I usually use Wilton Piping Tip #4). Decorate your cookies as desired. If using the squeeze bottles or piping tips, I usually outline cookies with icing first, then fill in the middle. If adding sprinkles on top of the icing, add them right after applying icing on your cookie.
Let icing dry/set: Feel free to enjoy cookies before icing completely dries. Icing dries in 24 hours. No need to cover the decorated cookies as you wait for the icing to set. If it’s helpful, decorate the cookies directly on a baking sheet so you can place the entire baking sheet in the refrigerator to help slightly speed up the icing setting. Once the icing has dried, these cookies are great for gifting or for sending.
Cover and store decorated cookies for up to 5 days at room temperature or up to 10 days in the refrigerator.",14,"2 and 1/4 cups (281g) all-purpose flour (spooned and leveled), plus more as needed for rolling and work surface",1/2 teaspoon baking powder,1/4 teaspoon salt,"3/4 cup (12 Tbsp; 170g) unsalted butter, softened to room temperature",3/4 cup (150g) granulated sugar,"1 large egg, at room temperature",2 teaspoons pure vanilla extract,"1/4 or 1/2 teaspoon almond extract (optional, but makes the flavor outstanding)*",3 cups (360g) confectioners’ sugar,1/2 teaspoon pure vanilla extract (omit and replace with water for stark white icing),Sally's Baking Addiction,https://sallysbakingaddiction.com/christmas-sugar-cookies/,2 teaspoons light corn syrup*,4.5–5 Tablespoons (67–75ml) room temperature water,pinch salt*,optional: gel food coloring & sprinkles for decorating,NA,NA,NA,NA,NA,NA,NA,NA,NA,NA
